PairID,Text1,Text1 Translation,Text2,Text2 Translation,Score
ARY-train-0681,اكتشف ما يخبأه لك برجك صحيا ومهنيا وعاطفيا وعائليا يومه السبت (4 غشت 2012),"Find out what your zodiac sign has in store for you, health-wise, professionally, emotionally, and family-wise, on Saturday (August 4, 2012)",اكتشف ما يخبأه لك برجك صحيا ومهنيا وعاطفيا وعائليا يومه السبت (11 غشت 2012),"Find out what your zodiac sign has in store for you, health-wise, professionally, emotionally, and family-wise, on Saturday (August 11, 2012)",0.88
ARY-train-0682,فؤاد العروي يفوز بجائزة جيونو,Fouad Laroui wins the Juno Prize,فؤاد العروي يفوز بجائزة جون جيونو في الأدب الفرنسي,Fouad Laroui wins the Jean Gionot Prize in French Literature,0.84
ARY-train-0683,نبيل بنعبد الله لـ”كود”: مقلتش أني كنفكر باش منبقاش فقيادة “البي بي إس”,Nabil Benabdallah to “Code”: I didn’t say that I was thinking about not remaining in the leadership of “PBS”,برلمان “البي بي إس” مغاديش يجتامع. بنعبد الله لـ”كود”: مزال غادي نكملو النقاش فالمكتب السياسي,The BBC Parliament is not meeting. Benabdallah to “Code”: We are still going to continue the discussion in the Political Bureau,0.46
ARY-train-0684,بوليس الطاليان شد شبكة كبيرة ديال تهريب البشر متورطين فيها مغاربة تونسيين وطاليانيين,The Italian police have established a large human smuggling network involving Tunisian Moroccans and Italians.,بوليس الطاليان شد شبكة فيها مغاربة ختارقات دار السكة الايطالية وخدات 230 ألف وثيقة ثبوتية وباعتها للمهاجرين,"The Italian police formed a network in which Moroccans penetrated the Italian railway station, obtained 230,000 identity documents and sold them to immigrants.",0.61
ARY-train-0685,وزير خارجية إيرلندا: خاص تعيين مبعوث أممي جديد باش تبدا العملية السياسية لنزاع الصحرا – وثيقة,Irish Foreign Minister: Special appointment of a new UN envoy to begin the political process for the Sahara conflict - document,خارجية بريطانيا ردات على لوبي العسكر: هضرنا مع بوريطة على ملف الصحرا وبغينا مبعوث أممي جديد فالمنطقة – وثائق,British Foreign Ministry’s responses to the military lobby: We responded with Bourita on the Sahara file and wanted a new UN envoy to the region - documents,0.56
ARY-train-0686,اليوم حطمنا الروكور فالوفيات والإصابات بكورونا.. 60 مغربي ماتو دقة وحدة وتصابو 3763 و2392 تشافاو.. الطوطال: 170911 إصابة و2878 وفاة و141381 متعافي.. و26652 كيتعالجو منهم 523 حالتهم خطيرة,"Today, we destroyed the Corona virus, with deaths and infections due to Corona... 60 Moroccans died one minute, and 3,763 were infected and 2,392 recovered.. Total: 170,911 infections, 2,878 deaths, 141,381 recovered... and 26,652 are being treated, of whom 523 are in serious condition.",حصيلة كورونا اليوم.. 2397 مغربي ومغربية تصابو و29 ماتو و2361 تشافاو.. الطوطال: 107743 إصابة و1918 وفاة و88244 حالة شفاء.. و17581 كيتعالجو منهم 281 حالة خطيرة,"Corona’s toll today: 2,397 Moroccan men and women infected, 29 dead, and 2,361 recovered. Total: 107,743 infections, 1,918 deaths, 88,244 recoveries, and 17,581 are being treated, including 281 serious cases.",0.47
ARY-train-0687,تحقيق حول فضائح صندوق الايداع والتدبير. الجزء الثالث : إعادة بناء فندق الريف بغلاف مالي وصل ل50 مليار سنتيم وشقق تابعة للفندق مصيرها مجهول,An investigation into the deposit and management fund scandals. Part Three: Rebuilding the Al-Rif Hotel with a financial cover of 50 billion cents and apartments belonging to the hotel whose fate is unknown,شكوك حول فساد مالي في كلية الحقوق بأكدال. العجز وصل لـ 2 مليار سنتيم وجطو مطلوب لافتحاص حسابات المؤسسة,"Suspicions about financial corruption at the Faculty of Law in Agdal. The deficit has reached 2 billion centimes, and Jato is required to open the institution’s accounts",0.44
ARY-train-0688,لبسو حوايجكوم مزيان.. عاجل: مديرية الأرصاد تحذر من أمطار عاصفية قوية فهاد المناطق,Dress up for Hawijkum Meziane.. Urgent: The Meteorological Directorate warns of strong stormy rains in these areas,ردو بالكوم راه أمطار عاصفية قوية غادي طاح فهاد المناطق وها فوقاش,"They responded by saying that strong, stormy rains had started to fall in these areas and now they are falling",0.61
ARY-train-0689,حصيلة كورونا فالأقاليم والجهات: 405 تصابو و10 ماتو غير فكازا.. و201 براو من الفيروس فدرعة,"Corona toll in the regions and regions: 405 were infected, 10 died except for Fakaza... and 201 recovered from the virus in Draa",حصيلة كورونا فالأقاليم والجهات: 12 ماتو فمراكش و290 تصابو فكازا.. والإصابات والوفيات بدات كتنخافض فالشمال,The toll of Corona in the regions and regions: 12 died in Marrakesh and 290 were infected in Casa... and infections and deaths began to decrease in the north.,0.62
ARY-train-0690,حصيلة كورونا هاد الصباح: 43 وصابو و196 تشافاو.. الطوطال: 7375 حالة و197 متوفي و4573 متعافي,"Corona’s toll this morning: 43, 196, and 196, Chavao. Total: 7,375 cases, 197 deaths, and 4,573 recovered.",فتنا 10000 حالة. حصيلة كورونا هاد الصباح: 102 تصابو و35 تشافاو.. الطوطال: 10079 حالة و8319 متعافي و214 متوفي,"We missed 10,000 cases. Corona toll this morning: 102 infected and 35 recovered. Total: 10,079 cases, 8,319 recovered, and 214 deceased.",0.47
ARY-train-0691,"بنك المغرب: الدرهم طلع بـ0,31 في المائة مقابل الأورو ما بين 10 و16 ماي 2018","Bank of Morocco: The dirham rose by 0.31 percent against the euro between May 10 and 16, 2018.","بنك المغرب: قيمة الدرهم تزادت بنسبة %0,17 مقابل الأورو",Bank of Morocco: The value of the dirham increased by 0.17% against the euro,0.59
ARY-train-0692,حصيلة كورونا فهاد 24 ساعة: 1143 مغربي ومغربية تصابو و33 ماتو و1737 تشافاو و13933 كيتعالجو.. و42 بين الحياة والموت,"Corona’s toll in 24 hours: 1,143 Moroccan men and women infected, 33 dead, 1,737 recovered, 13,933 treated... and 42 between life and death.",الحصيلة الوبائية لفيروس كورونا فهاد 24 ساعة: 66 تصابو و56 تشافاو وواحد مات.. الطوطال: 8997 مصاب و7993 متعافي و213 متوفي .. و791 كيتعالجو و4023 مازالين تحت المراقبة,"The epidemiological toll of the Corona virus in 24 hours: 66 infected, 56 recovered, and one died.. Total: 8997 infected, 7993 recovered, 213 died.. 791 are being treated, and 4023 are still under observation.",0.25
ARY-train-0693,الدزاير.. 148 إصابة جديدة بـ”كورونا” و7 ماتو و97 تشفاو: ها شحال وصلو فالطُوطَالْ,"Al-Desire.. 148 new cases of “Corona”, 7 died, and 97 recovered: How have they arrived in the country?",رقم قياسي فالدزاير.. 336 حالة جديدة بـ”كورونا” و7 ماتو و223 تشفاو: ها شحال وصلو فالطُوطَالْ,"A record number in Desire... 336 new cases of “Corona”, 7 who died, and 223.",0.68
ARY-train-0694,ها شكون اطلع ليهوم الجُوكْ هاد السيمانة ف المناصب العليا وكولهوم ف التعليم العالي,"Here, I will go to the position of this juke in senior positions and Kolhom in higher education.",ها شكون اطلع ليهوم الجوك هاد السيمانة فتعيينات المناصب العليا وها شكون تدار رئيس جديد على جامعة عبد المالك السعدي اللّي مات رئيسها السابق بـ”كورونا”,"Who is going to go to this juke, this Simana, for appointments to senior positions, and who is now running a new president at Abdel Malik Al-Saadi University, whose previous president died of “Corona.”",0.58
ARY-train-0695,كورونا: 676 تصابو و1198 تشافاو فهاد 24 ساعة,"Corona: 676 infected and 1,198 recovered within 24 hours",كورونا: 6428 تصابو و13 ماتو و53 فحالة خطيرة فهاد 24 ساعة,"Corona: 6,428 were infected, 13 died, and 53 were in serious condition in 24 hours.",0.71
ARY-train-0696,البوليس شدو مصور الفيديو اللي بان فيه دري كيتحرش ببنت فـ طنجة وهزلها كسوتها وضربها لمؤخرتها,"The police caught the videographer who allegedly harassed a girl in Tangiers, mocked her, and hit her on the backside.",فيديو مكعي المغاربة والبوليس دخل على الخط.. دري تحرش ببنت فـ طنجة وصاحبو فيلما كولشي: هزلها كسوتها وضربها لمؤخرتها,Video: Moroccans and the police entered the line.. Dre harassed a girl in Tangier and Velma Colchi’s friends: He mocked her and hit her on the backside,0.68
ARY-train-0697,تنفرد بنشرها “كود”: سلسلة “كيفاش السلاطين ديال المغرب كايشوفو “ريوسهوم” وكايشوفو السلطة ديالهوم وكايحميوها؟ تنحية سيدي محمد بن يوسف والنتائج ديالو على استقلال المغرب: 20 غشت 1953 (3)…دور الباشا التهامي لكًلاوي. ح 115,"She is unique in publishing “Code”: the series “How can the sultans of Morocco be able to see “Rioshom” and how can they protect the authority and how can they protect it? The removal of Sidi Muhammad Ben Youssef and the results of the independence of Morocco: August 20, 1953 (3)... The turn of the Pasha Thami to Glaoui. H 115",“كود” تنفرد بنشر سلسلة “كيفاش السلاطين ديال المغرب كايشوفو “ريوسهوم” وكايشوفو السلطة ديالهوم وكايحميوها؟ !ح 10 : العلاقة بين الخليفة والسلطان المغربي,"“Code” is unique in publishing the series “How are the Sultans of Morocco, how do they see “Rioshom” and how do they protect the authorities? H10: The relationship between the Caliph and the Moroccan Sultan",0.25
ARY-train-0698,كيضحكو علينا. شوفو على وضعية وبائية شحال مزيانة ومازال سادين لبلاد. كورونا اليوم:1 مات و113 تصابو وكثر من 24 مليون دارو الجرعة اللولة,"They laugh at us. Look at how bad the epidemiological situation is, and we are still in control of the country. Corona today: 1 died, 113 were infected, and more than 24 million took the first dose",كورونا اليوم: مات واحد و 132 تصابو وكثر من 24 مليون و 419 ألف دارو الجرعة اللولة,"Corona today: One died, 132 were infected, and more than 24 million and 419 thousand took the first dose.",0.5
ARY-train-0699,القضاء الإسباني غايبدا لونكيط مع وزيرة الخارجية السابقة بسباب دخول زعيم البوليساريو لإسبانيا,"The Spanish judiciary, Gaibda Lonquet, with the former Minister of Foreign Affairs, because of the entry of the Polisario leader into Spain",قاضي التحقيق فإسبانيا مزال كيحقق مع وزيرة الخارجية السابقة فطريقة دخول زعيم البوليساريو لإسبانيا بهوية وپاسپور مزورين,The investigating judge in Spain is still investigating the former Foreign Minister as to how the Polisario leader entered Spain with a forged identity and passport.,0.64
ARY-train-0700,أمانة البي جي دي كتحدا القواعد فسوس.. صحاب بنعرفة فرضو القسطلاني صحا.. ووكيل اللائحة ومصادر لـ”كود”: كنعاودو أخطاء الاتحاد الاشتراكي,The secretariat of the PGD is like a challenge to the rules of Fessus... Benarfa’s companions forced Al-Qastalani to be correct... and the list’s representative and sources for “Code”: We are repeating the mistakes of the Socialist Union,أمانة البي جي دي رفضات استقالة الازمي.. وقيادي لـ”كود”: الأزمة أعمق من رفض الاستقالة,The PGD Secretariat rejected Al-Azmi’s resignation...and a leader of “Code”: The crisis is deeper than the refusal to resign,0.31
ARY-train-0701,حمزة مون بيبي. ملف دنيا باطما داز ثاني فالمحكمة.. وها آش قررات ابتدائية مراكش,Hamza Moon Baby. Dounia Batma Daz's second file is in court...and here are the decisions of the Marrakesh first instance,تطور مثير فقضية حسابات “حمزة مون بيبي”. دنيا باطما أمام وكيل ملك ابتدائية مراكش وممنوع تخرج من المغرب,"An exciting development in the issue of “Hamza Moon Baby” accounts. Dounia Batma in front of the viceroy of Marrakesh Primary School, and she is forbidden from graduating from Morocco",0.61
ARY-train-0702,جورنالات بلادينائب عمدة مراكش و23 متهما آخرين يمثلون أمام غرفة الجنايات في ملف سوق الجملة من أجل اختلاس أموال عامة ومخاوف من هجوم إرهابي تقود أزيد من 40 سلفيا إلى التحقيق,"Journals: The Deputy Mayor of Marrakesh and 23 other defendants appear before the Criminal Chamber in the wholesale market case for embezzling public funds, and fears of a terrorist attack lead more than 40 Salafists to be investigated.",جورنالات بلاديملف اختلاس أموال الهيئة الوطنية للأطباء أمام غرفة الأموال بالرباط والدعوة إلى محاسبة المسؤولين على النتائج الكارثية للمغادرة الطوعية في الوظيفة العمومية,My Journals: The file of the embezzlement of funds from the National Doctors Authority before the Finance Chamber in Rabat and the call for officials to be held accountable for the disastrous results of voluntary departure from public service.,0.16
ARY-train-0703,سلسلة “كيفاش السلاطين ديال المغرب كايشوفو ريوسهوم وكايشوفو السلطة ديالهوم وكايحميوها؟ !” الحلقة 9 “علاش الدول كتغير ولاءها”,Series: “How can the sultans of Morocco know how to protect their people and how can they protect their authority?” ! Episode 9 “Why do countries change their allegiance”,تنفرد بنشرها “كود” سلسلة “كيفاش السلاطين ديال المغرب كايشوفو “ريوسهوم” وكايشوفو السلطة ديالهوم وكايحميوها؟ مرحلة تقليدانية المؤسسة الملكية والحياة السياسية المغربية…أو التقليد كنتيجة للإفراط في استعمال الحداثة (3) ! ح 150,"She is unique in publishing the “code” of the series “How are the sultans of Morocco, how do they see “Rioshom” and how do they protect the authority? The stage of traditionalism of the royal institution and Moroccan political life...or imitation as a result of the excessive use of modernity (3)! H 150",0.25
ARY-train-0704,هذا ما قاله مستور عن اختياره حمل قميص الأسود,This is what Mastour said about his choice to wear the black shirt,الميلان نتقم من مستور بعد اختياره حمل قميص الأسود,Milan takes revenge on Mastour after he chose to carry the black shirt,0.88
ARY-train-0705,بنعرفة معندوش لاش يحشم.. قاليك غادي يقدم تقرير سياسي مفصّل أمام برلمان “البي جي دي” وغادي يهضر على الأداء الحكومي,"We know that he has nothing to be shy about.. He told you that Gadi presents a detailed political report before the “PGD” parliament, and Gadi criticizes the government’s performance",نايضا ف برلمان “البي جي دي” بسبب بيان إدانة التطبيع مع اسرائيل.. بنعرفة بكا وبرر توقيع الاتفاق مع تل ابيب وبنكيران محضرش واعضاء انسحبو,"Also in the “PGD” parliament due to a statement condemning normalization with Israel.. Benarfa cried and justified the signing of the agreement with Tel Aviv, and Benkirane did not attend, and the members withdrew.",0.22
ARY-train-0706,الجو تقلب عاوتاني.. الأرصاد الجوية: الشتا جاية مجهدة وغادي توصل لـ35 ملم فهاد لبلايص,"The weather is volatile, Awatani.. Meteorology: Winter is coming, stressful, and it will reach 35 mm, so this is Lablais",الشتا مزال جاية مجهدة لهاد البلايص وغاتقدر توصل حتى لـ50 ملم,Winter is still stressful for these sheets and they can't even reach 50 mm,0.54
ARY-train-0707,"تنفيذ قانون مالية . عجز الميزانية وصل لـ37,6 مليار درهم",Implementation of financial law. The budget deficit reached 37.6 billion dirhams,وا طلقو الحكومة خلاص.. راه عجز الميزانية حتى غشت وصل 4 مليار درهم,"They fired the government, that's it.. The budget deficit reached 4 billion dirhams until August",0.84
ARY-train-0708,التصاميم المزوّرة اللّي كانت فعهد شباط.. التحقيق التفصيلي قرّب مع 20 متهما وفيهم نواب ديال العمدة السابق,"The forged designs that were in the February era.. The detailed investigation was conducted with 20 accused, including the deputies of the former mayor.",التصاميم المزوّرة ف فاس.. الوكيل العام يأمر باعتقال 20 شخصا وفيهم نواب ديال شباط,"Counterfeit designs in Fez.. The Public Prosecutor orders the arrest of 20 people, including representatives of the February Party",0.83
ARY-train-0709,الجامعة وقفات النقاش وغرامات الوداد وها الفراقي واللعابة لي نزلات عليهم هاد السيمانة,"The university's discussion pauses, Wydad's fines, Al-Faraqi, and the slander that fell upon them, this Simana",الجامعة نزلات على الوداد والمترجي وها الفراقي واللعابة اللي جات فيهم الدقة هاد السيمانة,"The university went to Wydad and Al-Mutraji, and this is Al-Faraqi and the game that came from them, Al-Dakka, Hadi Al-Simana.",0.66
ARY-train-0710,توقع. رئيس وزراء اسبانيا ثابتيرو غادي يوجه كلمة لمؤتمر صحراويون من أجل السلام المعارضة للبوليساريو فالعيون,anticipation. Spanish Prime Minister Thabeiro Ghadi addresses the Sahrawis for Peace conference in Laayoune,انطلاق أشغال المؤتمر التأسيسي لحركة صحراويون من أجل السلام المعارضة للبوليساريو فالعيون – تصاور,"The launch of the founding conference of the Sahrawi Movement for Peace, opposition to the Polisario Front, in Laayoune - Tasawour",0.59
ARY-train-0711,حصيلة كورونا فهاد 24 ساعة: 73 تصابو و49 تشافاو.. الطوطال: 8224 حالة و208 متوفي و7364 متعافي,"Corona’s toll in 24 hours: 73 infected and 49 recovered. Total: 8224 cases, 208 deceased, and 7364 recovered.",ارتفاع صاروخي فعدد الإصابات بكورونا هاد الصباح: 206 تصابو و40 تشافاو.. الطوطال: 9280 حالة و8081 متعافي و213 متوفي,"A meteoric rise in the number of Coronavirus infections this morning: 206 infected and 40 recovered. Total: 9,280 cases, 8,081 recovered, and 213 deceased.",0.59
ARY-train-0712,الوضعية الوبائية لفيروس كورونا فهاد 24 ساعة: 333 تصابو و64 تشافاو وواحد مات.. الطوطال: 12969 حالة منها 9090 تعافاو و229 توفاو و3650 مازالين كيتعالجو,"The epidemiological situation of the Corona virus in 24 hours: 333 infected, 64 recovered, and one died. Total: 12,969 cases, including 9,090 recovered, 229 died, and 3,650 are still being treated.",حصيلة كورونا فهاد 24 ساعة: 46 تصابو و109 تشافاو وحتى واحد مامات.. الطوطال: 8931 حالة و7930 تشافاو و212 ماتو.. دار 16450 تيست وبقاو 782 كيتعالجو,"Corona’s toll in 24 hours: 46 infected, 109 recovered, and even one dead. Total: 8,931 cases, 7,930 recovered, and 212 died. 16,450 tests received, and 782 remained treated.",0.5
ARY-train-0713,حصيلة كورونا هاد 24 ساعة: 1537 مغربي ومغربية تصابو و30 ماتو و1303 تشافاو.. الطوطال: 52349 مصاب و888 متوفي و36343 متعافي.. و15118 كيتعالجو منهم 166 فحالة خطيرة,"Corona’s toll in 24 hours: 1,537 Moroccans infected, 30 dead, and 1,303 recovered. Total: 52,349 infected, 888 deceased, 36,343 recovered, 15,118 treated, 166 of whom are in serious condition.",حصيلة كورونا هاد الصباح: 63 تصابو و58 تشافاو.. الطوطال: 12596 حالة منها 8978 تعافاو و228 توفاو و3390 كيتعالجو,"Corona toll this morning: 63 infected and 58 recovered. Total: 12,596 cases, of which 8,978 recovered, 228 died, and 3,390 were treated.",0.19
ARY-train-0714,الموت باقا طالعة وحتى الاصابات.. حصيلة كورونا هاد 24 ساعة: 1021 تصابو و16 ماتو و661 تشافاو.. الطوطال: 27217 مصاب و417 متوفي و19629 متعافي و7171 مازال كيتعالجو من الفيروس,"Death is still coming, and even infections.. Corona’s toll in 24 hours: 1,021 infected, 16 dead, and 661 recovered.. Total: 27,217 infected, 417 deceased, 19,629 recovered, and 7,171 are still being treated for the virus.",حصيلة كورونا فهاد 24 ساعة: 81 تصابو و2 ماتو و329 تشافاو .. الطوطال : 8003 حالة ولكن غير 600 اللي مازال كيتعالجو,"Corona’s toll in 24 hours: 81 infected, 2 dead, and 329 recovered. Total: 8,003 cases, but not 600 who are still being treated.",0.38
ARY-train-0715,حصيلة كورونا هاد الصباح: 136 تصابو و68 تشافاو وواحد مات.. الطوطال: 15464 حالة و11895 متعافي و244 متوفي و3325 كيتعالجو,"Corona toll this morning: 136 infected, 68 recovered, and one died. Total: 15,464 cases, 11,895 recovered, 244 deceased, and 3,325 treated.",حصيلة كورونا هاد الصباح: 178 تصابو و56 تشافاو.. الطوطال: 14949 حالة منها 11372 تعافاو و242 توفاو و3335 كيتعالجو,"Corona toll this morning: 178 infected and 56 recovered. Total: 14,949 cases, including 11,372 recovered, 242 died, and 3,335 were treated.",0.57
ARY-train-0716,فالوقت اللي وزير خارجية عسكر الدزاير كيروج لكذوب.. الخارجية الأمريكية نفات مناقشة ملف الصحرا بين بوكَادوم و بلينكن,At the time when the Minister of Foreign Affairs of the Lashkar-el-Dzayer told a lie... the US State Department denied discussing the Sahara file between Boukadoum and Blinken.,ماكيتقاضاوش.. وزير خارجية عسكر الدزاير تلاقى نظيرو الروسي وهضر معاه على ملف الصحرا,He did not negotiate.. The Minister of Foreign Affairs of the Lashkar al-Dzayer met with his Russian counterpart and discussed the Sahara file with him,0.44
ARY-train-0717,مستحيل ما يهضرش عليه.. وزير خارجية نظام عسكر الدزاير مشى للكونكَو وملف الصحرا على راس البروكَرام,It is impossible for him not to be upset about it.. The Minister of Foreign Affairs of the Askar Al-Dzayer regime walked to the Congo with the Sahara file at the head of the program.,كايقلبوا على صدمة جديدة.. “لعمامرة” هضر مع وزير خارجية ميريكان وملف الصحرا على راس البروكَرام – تغريدة,They faced a new shock.. “Lamamra” attended with the Minister of Foreign Affairs of Merican and the Sahara file was at the head of the program - Tweet,0.31
