PairID,Text1,Text1 Translation,Text2,Text2 Translation,Score
ARY-train-0000,تنفرد بنشرها “كود”: سلسلة “كيفاش السلاطين ديال المغرب كايشوفو “ريوسهوم” وكايشوفو السلطة ديالهوم وكايحميوها؟ !” احتكار السلطان الشريف العلوي للمجال الديني والسياسي… السلطان العلوي وعلاقتو بالزوايا ح 86,"She is unique in publishing “Code”: the series “How can the sultans of Morocco be able to see “Rioshom” and how can they protect the authority and how can they protect it? ! Sultan Sharif Al-Alawi’s monopoly on the religious and political sphere... The Alawite Sultan and his relationship with the Zawiyas, 86",تنفرد بنشرها “كود” سلسلة “كيفاش السلاطين ديال المغرب كايشوفو “ريوسهوم” وكايشوفو السلطة ديالهوم وكايحميوها؟ !” آشنو هي المكانة المؤسسية ديال الأحزاب السياسية في المغرب؟ (1) ح 165,"She is unique in publishing the “code” of the series “How are the sultans of Morocco, how do they see “Rioshom” and how do they protect the authority? ! What is the institutional status of political parties in Morocco? (1) H 165",0.38
ARY-train-0001,الوضعية الوبائية لفيروس كورونا فهاد 24 ساعة: 238 تصابو و93 تشافاو و4 ماتو.. الطوطال: 12290 منهم 8833 صافي تعافاو و225 توفاو و3232 كيتعالجو و18 حالتهم حرجة,"The epidemiological situation of the Corona virus in 24 hours: 238 infected, 93 recovered, and 4 died.. Total: 12,290, of whom 8,833 net recovered, 225 died, 3,232 were treated, and 18 were in critical condition.",حصيلة كورونا فهاد 24 ساعة: 1143 مغربي ومغربية تصابو و33 ماتو و1737 تشافاو و13933 كيتعالجو.. و42 بين الحياة والموت,"Corona’s toll in 24 hours: 1,143 Moroccan men and women infected, 33 dead, 1,737 recovered, 13,933 treated... and 42 between life and death.",0.5
ARY-train-0002,هاباش سالا ملف الاتجار في العفو الملكي بسجن الأوداية وهاشحال عطاو للمتورطين,"Habach Sala, the trafficking file in the royal pardon in the Oudayas prison, and Hachhal Ataw for those involved",جورنالات بلاديفضيحة الاتجار في العفو الملكي تجر موظفين بسجن الأوداية إلى الاعتقال ومجهولون مسلحون ينفذون هجوما خطيرا على مستخدمي شركة “ستاريو” بسلا,"My Journals The royal pardon trafficking scandal leads employees of the Oudayas prison to arrest, and unidentified armed men carry out a serious attack on users of the “Stareo” company in Salé.",0.53
ARY-train-0003,تنفرد بنشرها “كود”: سلسلة “كيفاش السلاطين ديال المغرب كايشوفو “ريوسهوم” وكايشوفو السلطة ديالهوم وكايحميوها؟ !” محاولة تنحية سيدي محمد بن يوسف عن العرش لتاريخ 25 فبراية 1951…أسلحة الإقامة العامة الفرنسية. الحلقة 112 (الجزء 2),"She is unique in publishing “Code”: the series “How can the sultans of Morocco be able to see “Rioshom” and how can they protect the authority and how can they protect it? ! The attempt to remove Sidi Mohammed Ben Youssef from the throne on February 25, 1951...weapons of the French public residence. Episode 112 (Part 2)",سلسلة تنفرد بنشرها “كود”:”كيفاش السلاطين ديال المغرب كايشوفو “ريوسهوم” وكايشوفو السلطة ديالهوم وكايحميوها؟ !” الزعامة العسكرية للسلطان الشريف:الجيش الانكشاري ودوره الأمني والسياسي ح 68,"A series uniquely published by “Code”: “How can the sultans of Morocco see “Rioshom” and how can they protect this authority? ! The military leadership of Sultan Sharif: The Janissary army and its security and political role, 68",0.25
ARY-train-0004,في أقل من سيمانة.. 5224 قضية تعرضات على القضاء “عن بعد” وها شحال من محابسي استفد منها وفارس كيحذر من التراخي مع الإجراءات الصحية,"In less than one month.. 5224 cases were brought before the judiciary “remotely”, and many of my prisoners benefited from them, and Fares warns against laxity with health procedures.",المحاكمات “عن بعد”.. ها شحال من جلسة دازت غير فهاد الفترة وها شحال من محابسي استفد منها,"Trials “remotely”... There are many sessions that took place during this period, and there are many of my prisoners who benefited from them",0.56
ARY-train-0005,زيان لـ”كود”: الحكومة دارت لقاء مع راسها بعد خطاب عيد العرش وبلا نتيجة وها شنو خاصها دّير باش يخرج الشعب كيشطح,"Zayan to “Kode”: The government held a meeting with its head after the Throne Day speech, but without results. What’s wrong with it? Why should the people go out on a rampage?",شباط عن خطاب عيد العرش لـ”كود”: خطاب تاريخي وكيرد على الشعب وفيه رسائل واضحة للحكومة,"February, about “Kode’s” Throne Day speech: a historic speech, a response to the people, and it contains clear messages to the government",0.42
ARY-train-0006,منظمة الصحة العالمية خربقات العالم. خدات قرار آخور على الهيدروكسي كلوروكين: وقفناه حيت لقينا انه لا فائدة فيه فعلاج المصابين بكورونا,World Health Organization World Health Organization. I made a final decision on hydroxychloroquine: We stopped it when we found that it was of no benefit in treating people infected with Corona.,منظمة الصحة العالمية غاتجرب 3 ديال الدوايات لعلاج المصابين بكورونا,The World Health Organization is trying 3 medications to treat people infected with Corona,0.39
ARY-train-0007,الدزاير.. 129 إصابة جديدة بـ”كورونا” و5 ماتو و91 تشفاو: ها شحال وصلو فالطُوطَالْ,"Al-Desire.. 129 new cases of “Corona”, 5 died, and 91 recovered: They have arrived in the country",الدزاير سجلات 581 إصابة جديدة بـ”كورونا” و12 ماتو و273 تشفاو: ها شحال وصلو فالطُوطَالْ,"Al-Dzayer records 581 new cases of “Corona”, 12 died, and 273 recovered: How much have they arrived in the country?",0.66
ARY-train-0008,برنامج تاريخنا على “كود”.. اسرة العلويين الحاكمة فالمغرب (الحلقة 4) : السلطان اسماعيل قتل الالاف وقطع ريوسهوم وعلقها على اسوار فاس ومكناس,"Our History program on “Code”... The ruling Alawite dynasty in Morocco (Episode 4): Sultan Ismail killed thousands, cut off their heads, and hung them on the walls of Fez and Meknes.",برنامج تاريخنا على “كود”.. (الحلقة 2) : مولاي علي الشريف مؤسس حكم العلويين – فيديو,"Our History program on “Code”.. (Episode 2): Moulay Ali Sharif, founder of Alawite rule - video",0.31
ARY-train-0009,الأرصاد الجوية كتحذر من الحرارة اللّي جاية: غادي توصل لـ44 فهاد المناطق,Meteorology warns of the coming heat: It will reach 44 in these areas,الأرصاد الجوية: الحرارة غادي تزيد تشعل وغادي توصل لـ43 درجة فهاد المناطق,Meteorology: The temperature will rise and reach 43 degrees in these areas,0.75
ARY-train-0010,حصيلة كورونا اليوم: 4412 مغربي ومغربية تصابو بالفيروس و50 ماتو و4538 تشافاو و1032 حالتهم خطيرة,"Today’s Corona toll: 4,412 Moroccan men and women infected with the virus, 50 died, 4,538 recovered, and 1,032 are in serious condition.",حصيلة كورونا اليوم: 3020 مغربي ومغربية تصابو و46 ماتو و2823 تشافاو.. الطوطال: 197481 إصابة و3301 وفاة و163195 متعافي.. و30985 كيتعالجو منهم 743 حالتهم خطيرة,"Today’s Corona toll: 3,020 Moroccan men and women infected, 46 dead, and 2,823 recovered. Total: 197,481 infections, 3,301 deaths, 163,195 recovered. 30,985 are being treated, of whom 743 are in serious condition.",0.5
ARY-train-0011,موظف فالوكالة الوطنية للموانئ طارو عليه من داخل البار بسباب الرشوة,An employee of the National Ports Agency attacked him from inside the bar for bribery,ها بشحال تحكم على موظف فالوكالة الوطنية للموانئ طارو عليه من داخل البار بسباب الرشوة,This is how an employee of the National Ports Agency was arrested and arrested from inside the bar for bribery,0.89
ARY-train-0012,شكون اللي ضغط على العدالة والتنمية باش يستاقل حامي الدين من رئاسة فريق الحزب في مجلس المستشارين,Who is the one who pressured the Justice and Development Party to resign Hami al-Din from heading the party’s team in the House of Councilors?,العدالة والتنمية والاحرار. الازمة تزادت. حامي الدين يرد على العثماني: اش رابح المغرب من بقاء هاد الحزب فالحكومة راه عبء عليها وخاص التخلص منو,"Justice, development and freedom. The crisis increased. Hami Al-Din responds to Al-Othmani: What will Morocco gain from the survival of this party? The government sees it as a burden on it, especially getting rid of it.",0.29
ARY-train-0013,الحصيلة الوبائية لفيروس كورونا فهاد 24 ساعة: 82 تصابو و78 تشافاو وحتى واحد ما مات.. الطوطال: 8692 مصاب و7696 متعافي و212 متوفي .. و784 كيتعالجو,"The epidemiological toll of the Corona virus in 24 hours: 82 infected, 78 recovered, and not even one died. Total: 8,692 infected, 7,696 recovered, 212 died, and 784 were treated.",الموت والاصابات بكورونا مازال طالعين .. 1565 مغربي ومغربية تصابو و41 توفاو و841 تشافاو. الطوطال: 50812 مصاب و858 متوفي و35040 متعافي.. و14914 كيتعالجو منهم 186 فحالة خطيرة,"Deaths and infections with Corona are still on the rise... 1,565 Moroccan men and women have been infected, 41 Tuvao, and 841 Chavao. Total: 50,812 infected, 858 deceased, 35,040 recovered... and 14,914 being treated, of whom 186 are in serious condition.",0.38
ARY-train-0014,الدزاير.. 272 إصابة جديدة بـ”كورونا” و10 ماتو و183 تشفاو: ها شحال وصلو فالطُوطَالْ,"Al-Desire.. 272 new cases of “Corona”, 10 died, and 183 recovered: How have they arrived in the country?",“كورونا” فالدزاير.. ف24 ساعة تسجلات 413 إصابة جديدة و9 ماتو و490 تشفاو: ها شحال وصلو فالطُوطَالْ,"“Corona” in Valdezir.. In 24 hours, 413 new infections were recorded, 9 died, and 490 recovered: They have not arrived in the country.",0.66
ARY-train-0015,تنفرد بنشرها “كود” سلسلة “كيفاش السلاطين ديال المغرب كايشوفو “ريوسهوم” وكايشوفو السلطة ديالهوم وكايحميوها؟ !” آشنو هي مكانة الدستور في المغرب في ظل هيمنة المؤسسة الملكية على الحقل السياسي الديني في المغرب(4)؟ ح 163,"She is unique in publishing the “code” of the series “How are the sultans of Morocco, how do they see “Rioshom” and how do they protect the authority? ! What is the status of the constitution in Morocco in light of the dominance of the royal institution over the political-religious field in Morocco (4)? H 163",تنفرد بنشرها “كود”: سلسلة “كيفاش السلاطين ديال المغرب كايشوفو “ريوسهوم” وكايشوفو السلطة ديالهوم وكايحميوها؟ !” الاستقلال السياسي والإديولوجي المغربي على عهد السلالات ذات الشرعية الذاتية… السياسية الدينية للسلطان السعدي في اتجاه فقهاء الإسلام الرسمي ح 49,She is unique in publishing “Code”: the series “How can the sultans of Morocco be able to see “Rioshom” and how can they protect the authority and how can they protect it? ! Moroccan political and ideological independence during the era of self-legitimate dynasties...the religious policy of the Saadi Sultan in the direction of the jurists of official Islam c. 49,0.22
ARY-train-0016,بنك المغرب: نسبة البطالة وصلات لـ5 فالمية و سوق الشغل بدا كاينتاعش فهاد الفترة – أرقام,Bank of Morocco: The unemployment rate has reached 5 percent and the job market has begun to revive during this period - figures,“كورونا” دكَدكَات سوق الشغل.. تقرير رسمي: الاقتصاد الوطني خسر أكثر من 200 ألف منصب شغل ومعدل الشوماج داز من 5 فالمية لـ5 فالمية – أرقام,“Corona” has depressed the labor market.. Official report: The national economy has lost more than 200 thousand jobs and the Chumag-Daz rate has dropped from 5 percent to 5 percent - Figures,0.53
ARY-train-0017,تمديد حالة الطوارئ الصحية فالمغرب لـ10 فبراير,Extending the state of health emergency in Morocco until February 10,تمديد حالة الطوارئ الصحية فالمغرب لـ10 دجنبر,Extending the state of health emergency in Morocco until December 10,0.72
ARY-train-0018,الفرقة الوطنية بتنسيق مع الديستي طيحات ريزو كيزور الباس فاكسينال ومورط فتهريب الحشيش,"The National Band, in coordination with Al-Desti, Tahit Rizo, Keyzur Al-Bass Faxinal, is implicated in cannabis smuggling",الفرقة الوطنية بتنسيق مع الديستي طيحو بزناس ففاس لقاو عندو 850 كيلو ديال الحشيش – تصويرة,"The National Band, in coordination with Al-Desti, has 850 kilograms of hashish in Fez. Photo.",0.78
ARY-train-0019,الحصيلة الوبائية لكورونا فالجهات والأقاليم: تشافاو 120 فجهة فاس مكناس ومراكش آسفي سجلات 66 إصابة وحالة وفاة وحدة فجهة الشمال,"The epidemiological toll of Corona in the regions and regions: Chavao 120, the Fez region, Meknes and Marrakesh-Safi, records of 66 infections and one death, and a unit in the northern region.",الوضعية الوبائية فجهات وأقاليم المغرب ف24 ساعة: جهة كازا سجلات 37 حالة ومراكش آسفي . وفاس مكناس كتحقق أكبر نسبة دالشفاء,The epidemiological situation in the regions and regions of Morocco in 24 hours: the Casa region recorded 37 cases and Marrakesh-Safi. Fez-Meknes achieved the highest recovery rate,0.39
ARY-train-0020,ها فين مشى الوفد الدبلوماسي الروسي من بعد ماتلاقى رئيس المينورسو فالعيون,Here the Russian diplomatic delegation walked after meeting with the President of MINURSO in Laayoune,الوفد الدبلوماسي لي كاين فالعيون مشى لمقرات المينورسو العسكرية فأوسرد وأم ادريكة,The diplomatic delegation from Cairo to Laayoune walked to the MINURSO military headquarters in Awsard and Umm Adrika,0.71
ARY-train-0021,تنفرد بنشرها “كود”: سلسلة “كيفاش السلاطين ديال المغرب كايشوفو “ريوسهوم” وكايشوفو السلطة ديالهوم وكايحميوها؟ مضمون ما سمي “الظهير البربري” المؤرخ في 16 ماي ح 97,"She is unique in publishing “Code”: the series “How can the sultans of Morocco be able to see “Rioshom” and how can they protect the authority and how can they protect it? Contents of the so-called “Berber Decree” dated May 16, 1997",تنفرد بنشرها “كود”: سلسلة “كيفاش السلاطين ديال المغرب كايشوفو “ريوسهوم” وكايشوفو السلطة ديالهوم وكايحميوها؟ !” الحلقة8 : الدولة الزناتية و الخلافة,She is unique in publishing “Code”: the series “How can the sultans of Morocco be able to see “Rioshom” and how can they protect the authority and how can they protect it? ! Episode 8: The Zenatid State and the Caliphate,0.28
ARY-train-0022,حصيلة كورونا فالأقاليم والجهات: كازا سجلات 959 إصابة.. وعدد الحالات الجديد ارتفعو فدرعة وسوس,Corona toll in the regions and regions: Casa records 959 infections.. and the number of new cases increased in Draa and Souss,حصيلة كورونا فالأقاليم والجهات: 18 وفاة فكازا سطات و793 إصابة.. و130 واحد برا فدرعة تافيلالت,"Corona toll in the regions and regions: 18 deaths in Casa-Settat, 793 infections... and 130 in Draa-Tafilalet",0.61
ARY-train-0023,حصيلة كورونا والفاكسان اليوم: 3 مليون و800 الف مغربي خداو الجرعة اللولة من اللقاح و394 تصابو بالفيروس,Today’s Corona and Vaxan toll: 3 million and 800 thousand Moroccans took the first dose of the vaccine and 394 were infected with the virus.,حصيلة كورونا والفاكسان اليوم: 4 مليون مغربي خداو الجرعة اللولة من اللقاح وكثر من 70 الف خداو الثانية,"Today’s Corona and Vaxan toll: 4 million Moroccans have taken the first dose of the vaccine and more than 70,000 have taken the second.",0.57
ARY-train-0024,جنوب إفريقيا مسخرة دبلوماسيتها كلها ضد الوحدة الترابية ودافعات على البوليساريو فاللجنة الرابعة,South Africa is harnessing all its diplomacy against territorial integrity and pushing against Polisario in the Fourth Committee,الجزائر مسخرة دبلوماسيتها كلها ضد الوحدة الترابية وحتى البرتغال ما خلاتها فالتيقار,"Algeria is harnessing all its diplomacy against territorial integrity, even Portugal, except Valtigar",0.41
ARY-train-0025,الدزاير.. 302 إصابة جديدة بـ”كورونا” و7 ماتو و182 تشفاو: ها شحال وصلو فالطُوطَالْ,"Al-Desire: 302 new cases of “Corona”, 7 deaths, and 182.",الدزاير.. تسجيل 116 إصابة جديدة بـ”كورونا” و107 تشفاو و11 ماتو: ها شحال وصلو فالطُوطَالْ,"Al-Dzaïr.. 116 new cases of “Corona” were recorded, 107 recovered and 11 died: How have they arrived in the country?",0.47
ARY-train-0026,تنفرد بنشرها “كود”: سلسلة “كيفاش السلاطين ديال المغرب كايشوفو “ريوسهوم” وكايشوفو السلطة ديالهوم وكايحميوها؟ !” العقيدة القانونية والسياسية للحماية وإقصاء الإنسان المغربي من مجال الحقوق والحريات. الحلقة 94,She is unique in publishing “Code”: the series “How can the sultans of Morocco be able to see “Rioshom” and how can they protect the authority and how can they protect it? ! The legal and political doctrine of protection and exclusion of Moroccan people from the field of rights and freedoms. Episode 94,تنفرد بنشرها “كود” سلسلة “كيفاش السلاطين ديال المغرب كايشوفو “ريوسهوم” وكايشوفو السلطة ديالهوم وكايحميوها؟ !” الاستقلال السياسي والإديولوجي المغربي على عهد السلالات ذات الشرعية الذاتية… دولة الشُرفا السعديين، من تكون؟ ! بداية السعديين في جنوب المغرب ! ح 44,"She is unique in publishing the “code” of the series “How are the sultans of Morocco, how do they see “Rioshom” and how do they protect the authority? ! Moroccan political and ideological independence during the era of self-legitimate dynasties... The Saadian state of honor, who is it? ! The beginning of the Saadians in southern Morocco! H 44",0.17
ARY-train-0027,عضو اللجنة العلمية البروفيسور عفيف لـ”كود”: ها شنو خصنا نديرو فالعيد الكبير باش نتفاداو كارثة وبائية..و4 حالات فقط تصابو بالفيروس بعدما دارو جوج جرعات,"Member of the Scientific Committee, Professor Afif, told “Code”: What should we do on Eid Al-Kabir in order to avoid an epidemiological catastrophe...and only 4 cases were infected with the virus after taking two doses?",عضو اللجنة العلمية الدكتور عفيف لـ”كود”: أطفال صغار فالمغرب تقاسو بـ”دلتا” منهم جوج عندهم 12 العام ف الإنعاش ومؤسف نشوفو 7 نساء حوامل ماتو بالفيروس وخاص التسريع بالتلقيح,"Member of the Scientific Committee, Dr. Afif, told “Code”: Young children in Morocco are being treated with “Delta”, including those who are 12 years old in resuscitation, and it is unfortunate to see that 7 pregnant women have died from the virus, especially the acceleration of vaccination.",0.25
ARY-train-0028,حصيلة كورونا: 4 مليون خداو الجرعة الثانية من الفاكسان واليوم تصاب 507 واحد,"Corona toll: 4 million people took the second dose of Vaxan, and today 507 people were infected",حصيلة كورونا والفاكسان اليوم: 4 مليون مغربي خداو الجرعة اللولة من اللقاح وكثر من 70 الف خداو الثانية,"Today’s Corona and Vaxan toll: 4 million Moroccans have taken the first dose of the vaccine and more than 70,000 have taken the second.",0.71
ARY-train-0029,بغاو ايضايقو المغرب.. الجزائر وموريتانيا يعلنان رسميا تاريخ افتتاح المعبر الحدودي بينهما,They also want to announce Morocco.. Algeria and Mauritania officially announce the opening date of the border crossing between them,ها وقتاش غادي يكون افتتاح المعبر الحدودي بين الجزائر وموريتانيا,When will the border crossing between Algeria and Mauritania be opened?,0.54
ARY-train-0030,احتجاجا على تحرير مخالفة مرورية. شاب يضرم النار في أجزاء من جسده بمشرع بلقصيري,In protest against issuing a traffic violation. A young man sets parts of his body on fire in Belkasiri Street,النار لا زالت وسيلة للاحتجاج: شاب يضرم النار في جسده بالمعبر الحدودي باب سبتة احتجاجا على الديوانة,Fire is still a means of protest: A young man sets fire to his body at the Bab Ceuta border crossing in protest against customs.,0.39
ARY-train-0031,تنفرد بنشرها “كود”: سلسلة “كيفاش السلاطين ديال المغرب كايشوفو “ريوسهوم” وكايشوفو السلطة ديالهوم وكايحميوها؟ تنحية سيدي محمد بن يوسف والنتائج ديالو على استقلال المغرب: 20 غشت 1953 (3)…دور الباشا التهامي لكًلاوي. ح 115,"She is unique in publishing “Code”: the series “How can the sultans of Morocco be able to see “Rioshom” and how can they protect the authority and how can they protect it? The removal of Sidi Muhammad Ben Youssef and the results of the independence of Morocco: August 20, 1953 (3)... The turn of the Pasha Thami to Glaoui. H 115",تنفرد بنشرها “كود”. “كيفاش السلاطين ديال المغرب كايشوفو “ريوسهوم” وكايشوفو السلطة ديالهوم وكايحميوها؟ !” الاستقلال السياسي والإديولوجي المغربي على عهد السلالات ذات الشرعية الذاتية…آشنو كايمييز الخلافة الموحدية التومرتية على الخلافة الإسلامية؟ ح 40,It is unique in publishing “Code”. “How can the sultans of Morocco see “Rioshom” and how can they protect their authority? ! Moroccan political and ideological independence during the era of self-legitimate dynasties... What is the difference between the Almohad-Tumartian Caliphate and the Islamic Caliphate? H 40,0.16
