PairID,Text1,Text1 Translation,Text2,Text2 Translation,Score
ARY-train-0243,الحصيلة الوبائية لكورونا فالجهات والأقاليم: جهة كازا وطنجة سجلو 413 لإصابة بكورونا غير بوحدهم.. وتوفاو 6 فجهة الشمال وتعافاو 115,"The epidemiological toll of Corona in the regions and regions: The Casa and Tangier regions recorded 413 cases of infection with Corona, not alone... and 6 died in the northern region, and 115 recovered.",الحصيلة الوبائية لكورونا فالجهات والأقاليم: طنجة تطوان سجلات 55 إصابة بالفيروس و3 وفيات ف24 ساعة,The epidemiological toll of Corona in the regions and regions: Tangier-Tétouan records 55 cases of the virus and 3 deaths in 24 hours,0.46
ARY-train-0244,اش واقع اليوم: حصيلة هاد النهار من الجرائم و الحوادث,What is the reality today: the toll of crimes and accidents this day,أش واقع اليوم : حصيلة هاد النهار من الجرائم و الحوادث ” مغربي فطاليان قتل مرتو بالقرطاس وأصاب خمسة اشخاص آخرين,What is today’s reality: the toll of crimes and incidents this day: “A Moroccan Fatalian killed his wife with paper and injured five other people.”,0.66
ARY-train-0245,دنيا باطمة فرحانة بتأجيل الجلسات فقضية حمزة مون بيبي بسباب كورونا.. ودفاعها كيحاول يطلب عيشة عياش ما تعتارفش وتغرقها,Donia Batma is happy with the postponement of the hearings in the Hamza Moon Baby case due to Corona... and her defense is trying to ask for Ayyash’s life to not be recognized and drowned.,عاجل. دنيا باطمة تشدات فقضية حمزة مون بيبي,urgent. Donia Batma is distressed by the case of Hamza Moon Bibi,0.58
ARY-train-0246,أمانة البي جي دي كتحدا القواعد فسوس.. صحاب بنعرفة فرضو القسطلاني صحا.. ووكيل اللائحة ومصادر لـ”كود”: كنعاودو أخطاء الاتحاد الاشتراكي,The secretariat of the PGD is like a challenge to the rules of Fessus... Benarfa’s companions forced Al-Qastalani to be correct... and the list’s representative and sources for “Code”: We are repeating the mistakes of the Socialist Union,أمانة “البي جي دي” ندمات على دخول الاتحاد الاشتراكي للحكومة..قيادي لـ”كود”: حزب يتجه لأن يلقى حتفه بما كسبت يده,The secretariat of the “PGD” regrets the entry of the Socialist Union into the government.. A leader of “Code”: A party is heading towards its death due to what it has gained.,0.32
ARY-train-0247,سلسلة تنفرد بنشرها “كود”: “كيفاش السلاطين ديال المغرب كايشوفو “ريوسهوم” وكايشوفو السلطة ديالهوم وكايحميوها؟ !” قاعدة “تبيعية” السلطان للمخزن والميكانزمات ديالها. ح 88,A series uniquely published by “Code”: “How can the sultans of Morocco see “Rioshom” and how can they protect this authority and how can they protect it? ! The Sultan’s “sales” base for the store and its mechanisms. H 88,تنفرد بنشرها “كود”: سلسلة “كيفاش السلاطين ديال المغرب كايشوفو “ريوسهوم” وكايشوفو السلطة ديالهوم وكايحميوها؟ !” محاولة تنحية سيدي محمد بن يوسف عن العرش لتاريخ 25 فبراية 1951…أسلحة الإقامة العامة الفرنسية. الحلقة 112 (الجزء 2),"She is unique in publishing “Code”: the series “How can the sultans of Morocco be able to see “Rioshom” and how can they protect the authority and how can they protect it? ! The attempt to remove Sidi Mohammed Ben Youssef from the throne on February 25, 1951...weapons of the French public residence. Episode 112 (Part 2)",0.21
ARY-train-0248,أحكام تتراوح بين البراءة وأربع سنوات حبسا نافذا في حق خمسة متهمين توبعوا في قضايا لها علاقة بالإرهاب,Judgments ranging from acquittal to four years in prison were imposed against five defendants prosecuted in cases related to terrorism,أحكام تتراوح بين البراءة وسنتين حبسا نافذا في حق 52 معتقلا على خلفية أحداث شغب بالسجن المحلي بسلا,Verdicts ranging from acquittal to two years in prison for 52 detainees in connection with riots in the local prison in Salé.,0.59
ARY-train-0249,عمالة فحص أنجرة بطنجة: الناس خايفة من شركة خاصة للقنص.. والقضية حامْضة,Angry inspection labor in Tangier: People are afraid of a private sniping company... and the issue is sore,عمالة فحص أنجرة بطنجة.. الناس خايفة من شركة خاصة للقنص والقضية حامْضة,"Furniture inspection labor in Tangier.. People are afraid of a private sniping company, and the issue is sour",1.0
ARY-train-0250,بوريطة تلاقى وزير خارجية سيراليون اللي جدد دعم بلادو لمغربية الصحرا,"Bourita meets with the Foreign Minister of Sierra Leone, who renewed his country's support for the Moroccan Sahara",ردا على الكذوب ديال البوليساريو و الدزاير.. وزير خارجية زامبيا تلاقى بوريطة و جدد دعم بلادو لمغربية الصحرا و لمبادرة الحكم الذاتي,"In response to the lies of the Polisario and Desire, the Zambian Foreign Minister met with Bourita and renewed his country’s support for the Moroccan Sahara and the autonomy initiative",0.64
ARY-train-0251,منتدى دول جزر المحيط الهادي فالعيون غادي يبدا غدا,The Pacific Island Countries Forum in Laayoune Ghadi starts tomorrow,هافين غادي يدار مؤتمر المغرب ومنتدى دول جزر المحيط الهادي فالعيون,Haven Gadi runs the Morocco Conference and the Pacific Island States Forum in Laayoune,0.75
ARY-train-0252,كَلسو فديوركوم.. فاول نهار فرمضان تزادت 131 إصابة جديدة بكورونا.. وصلنا لـ3889 فالطوطال و159 ماتو و498 تشافاو,"Kelso Fediorkum.. On the first day of Ramadan, 131 new cases of Corona increased.. We reached 3889 in total, 159 died, and 498 Chavao",تزادت هاد الصباح 81 إصابة جديدة بكورونا.. وصلنا لـ6593 فالطوطال و189 ماتو و 3222 تشافاو,"There was an increase of 81 new cases of Corona this morning.. We reached 6,593 in total, 189 died, and 3,222 recovered.",0.61
ARY-train-0253,زيان يرد على إدارة السجون عبر “كود”: الكذوب وقتو قصير ورسالة الزفزافي عند قاضي التحقيق والاثنين كلشي يبان واش تصدقو محامي ووالد الزفزافي ولا هادو,"Zayan responds to the prison administration via “code”: The lie is short-lived, and Zefzafi’s letter is with the investigating judge, and on Monday everything is clear. Do you believe Zefzafi’s lawyer and father or not?",زيان: الأحزاب كتكذب على الملك وخاصها تعتذر لساكنة الرّيف والقانون بيني وبين إدارة السُّجون والرسالة ديال الزفزافي راها عند قاضي التحقيق,"Zayan: The parties are lying to the king, especially the parties, apologizing to the residents of the countryside. The law is between me and the prison administration, and the letter was sent to the investigating judge by Diyal Zefzafi.",0.41
ARY-train-0254,تفكيك عصابة إجرامية متخصصة في سرقة الأسلاك النحاسية بطنجة,Dismantling a criminal gang specialized in stealing copper wires in Tangier,تفكيك عصابة إجرامية متخصصة في سرقة الدراجات النارية في شفشاون,Dismantling a criminal gang specializing in motorcycle theft in Chefchaouen,0.5
ARY-train-0255,تأجيل ملف يتابع فيه ستة أفراد في إطار قانون مكافحة الإرهاب,Postponing a file in which six individuals are being pursued within the framework of the Anti-Terrorism Law,تأجيل ملف يتابع فيه 5 أشخاص في إطار قانون مكافحة الإرهاب,Postponing a file in which 5 people are being pursued within the framework of the anti-terrorism law,0.75
ARY-train-0256,تنفرد بنشرها “كود”: سلسلة “كيفاش السلاطين ديال المغرب كايشوفو “ريوسهوم” وكايشوفو السلطة ديالهوم وكايحميوها؟ !” تصور النخبة الإصلاحية المغربية لمفهوم القومية وتماهيه مع المفهوم النازي للقومية. ح 100,She is unique in publishing “Code”: the series “How can the sultans of Morocco be able to see “Rioshom” and how can they protect the authority and how can they protect it? ! The Moroccan reformist elite’s perception of the concept of nationalism and its identification with the Nazi concept of nationalism. H 100,سلسلة تنفرد بنشرها “كود” “كيفاش السلاطين ديال المغرب كايشوفو “ريوسهوم” وكايشوفو السلطة ديالهوم وكايحميوها؟ !” الاستقلال السياسي والإديولوجي المغربي على عهد السلالات ذات الشرعية الذاتية…الهيكلة الاجتماعية والسياسية لأمة الموحدين التومرتية ح .,A series uniquely published by “Code”: “How can the sultans of Morocco know how to see “Rioshom” and how can they protect this authority? ! Moroccan political and ideological independence during the era of self-legitimate dynasties... The social and political structure of the Almohad-Tumartian nation c.,0.21
ARY-train-0257,الاستقلال يرفض تقديم تقرير لجنة تقصي الحقائق في مكتب التصدير والاستيراد على الجلسة العامة,Al-Istiqlal refuses to present the report of the fact-finding committee in the Export and Import Office to the public session,الاغلبية تتجه لنسف جلسة تقديم تقرير تقصي الحقائق حول مكتب التسويق والتصدير ومجلس المستشارين يبدي استياءه من غياب بنكيران عن الجلسة. أول لجنة لتقصي الحقائق في ظل الدستور الجديد,"The majority tends to destroy the session to submit a fact-finding report on the Marketing and Export Office, and the Council of Advisors expresses its dissatisfaction with Benkirane’s absence from the session. The first fact-finding committee under the new constitution",0.43
ARY-train-0258,الدزاير.. 434 إصابة جديدة بـ”كورونا” و8 ماتو و487 تشفاو: ها شحال وصلو فالطُوطَالْ,"Al-Desire: 434 new cases of “Corona”, 8 deaths, and 487.",الدزاير.. 232 إصابة بـ”كورونا” و13 ماتو و159 تشفاو: ها شحال وصلو فالطُوطَالْ,"Al-Desire: 232 cases of “Corona”, 13 deaths, and 159 recoveries: They have arrived in the country",0.57
ARY-train-0259,مندوبية التخطيط: أكثر من 65 فالمية من العائلات المغربية صرحات بتدهور مستواها المعيشي و80 فالمية توقعات تزاد نسبة البطالة – أرقام,"Planning Commission: More than 65 percent of Moroccan families reported a deterioration in their standard of living, and 80 percent expected the unemployment rate to increase - figures.",التجارة الخارجية المغربية.. مندوبية التخطيط: غادي تنقص نسبة التراجع ديال الصادرات على اللي كانت عليه قبل – أرقام,Moroccan foreign trade.. Planning Commission: Gadi will reduce the rate of decline in exports to what it was before - figures,0.21
ARY-train-0260,تطورات مثيرة في قضية توقيف جوج ممرّضات بالمركز الاستشفائي الجامعي الحسن الثاني بفاس (وثائق),Exciting developments in the case of the arrest of two nurses at the Hassan II University Hospital Center in Fez (documents),سيدة تضع أربع توائم في صحة جيدة بالمركز الاستشفائي الجامعي الحسن الثاني بفاس,A woman gives birth to quadruplets in good health at the Hassan II University Hospital Center in Fez,0.25
ARY-train-0261,الجمعية المغربية لحماية المال العام: بغينا إجراءات تشريعية وإدارية وقضائية قادرة على محاربة الفساد ونهب المال العام,"Moroccan Association for the Protection of Public Money: We need legislative, administrative and judicial measures capable of fighting corruption and the plunder of public money",جمعية حماية المال العام: الرميد عاجز عن محاربة الفساد ونهب المال العام، وصرخ في وجهنا والوزارة تتهم جمعيات بتحريف كلام الوزير وتقرر توثيق كل الاجتماعات,"Association for the Protection of Public Money: Al-Ramid is incapable of fighting corruption and the plundering of public money, and he shouted at us, and the ministry accuses associations of distorting the minister’s words and decides to document all meetings.",0.21
ARY-train-0262,الدزاير.. تسجيل 133 إصابة جديدة بـ”كورونا” و8 ماتو فظرف 24 ساعة و127 تشفاو.. وها شحال فالطُوطَالْ,"Al-Desair.. 133 new cases of “Corona” were recorded, 8 died within 24 hours, and 127 recovered.. and this is how bad it is today.",الدزاير.. 405 إصابة جديدة بـ”كورونا” و9 ماتو و194 تشفاو: ها شحال وصلو فالطُوطَالْ,"Al-Desire: 405 new cases of “Corona”, 9 deaths, and 194.",0.59
ARY-train-0263,ها شكون اطلع ليهوم الجوك هاد السيمانة فتعيينات المناصب العليا وها شكون تدار رئيس جديد على جامعة عبد المالك السعدي اللّي مات رئيسها السابق بـ”كورونا”,"Who is going to go to this juke, this Simana, for appointments to senior positions, and who is now running a new president at Abdel Malik Al-Saadi University, whose previous president died of “Corona.”",ها شكون اطلع ليهوم الجُوكْ هاد السيمانة ف المناصب العليا,Is this guy going to get this high-ranking position?,0.69
ARY-train-0264,عمر محب القيادي فجماعة “العدل والإحسان” يعانق الحرية بعدما دوّز 10 سنوات سجنا على خلفية مقتل الطالب بنعيسى آيت الجيد,"Omar Moheb, leader of the “Justice and Charity” group, embraces freedom after serving 10 years in prison for the murder of student Benaissa Ait Al-Jadeed.",تأجيل جديد فقضية مقتل الطالب اليساري بنعيسى آيت الجيد,A new postponement in the case of the murder of leftist student Benaissa Ait El-Jaid,0.54
ARY-train-0265,“كود” تنفرد بنشر سلسلة “كيفاش السلاطين ديال المغرب كايشوفو “ريوسهوم” وكايشوفو السلطة ديالهوم وكايحميوها؟ !ح 10 : العلاقة بين الخليفة والسلطان المغربي,"“Code” is unique in publishing the series “How are the Sultans of Morocco, how do they see “Rioshom” and how do they protect the authorities? H10: The relationship between the Caliph and the Moroccan Sultan",تنفرد بنشرها “كود”. “كيفاش السلاطين ديال المغرب كايشوفو “ريوسهوم” وكايشوفو السلطة ديالهوم وكايحميوها؟ !” الاستقلال السياسي والإديولوجي المغربي على عهد السلالات ذات الشرعية الذاتية…آشنو كايمييز الخلافة الموحدية التومرتية على الخلافة الإسلامية؟ ح 40,It is unique in publishing “Code”. “How can the sultans of Morocco see “Rioshom” and how can they protect their authority? ! Moroccan political and ideological independence during the era of self-legitimate dynasties... What is the difference between the Almohad-Tumartian Caliphate and the Islamic Caliphate? H 40,0.25
ARY-train-0266,تنفرد بنشرها “كود”: سلسلة “كيفاش السلاطين ديال المغرب كايشوفو “ريوسهوم” وكايشوفو السلطة ديالهوم وكايحميوها؟ مضمون ما سمي “الظهير البربري” المؤرخ في 16 ماي ح 97,"She is unique in publishing “Code”: the series “How can the sultans of Morocco be able to see “Rioshom” and how can they protect the authority and how can they protect it? Contents of the so-called “Berber Decree” dated May 16, 1997",كود تنفرد بنشر سلسلة “كيفاش السلاطين ديال المغرب كايشوفو “ريوسهوم” وكايشوفو السلطة ديالهوم وكايحميوها؟ !” ح 16: كيفاش استغل المرابطون سلطة الفقهاء واش الفرق بين امارة المؤمنين وامارة المسلمين,Code is unique in publishing the series “How can the sultans of Morocco know how to see “Rioshom” and how can they protect this authority? ! H 16: How did the Almoravids exploit the authority of the jurists? What is the difference between the leadership of the believers and the leadership of the Muslims?,0.18
ARY-train-0267,5 مفارقات فمؤتمر البي جي دي الثامن: ابن عرفة ربح بشوهة ونافسو الازمي للي التحق بالحزب غير ف2011 وفشل يقتل بنكيران اللي خرج اكبر واقصى كل منافسيه وفرض بديكتاتورية يتيم,"5 paradoxes in the eighth PGD conference: Ibn Arafa won with a distortion, and they competed with Al-Azmi, who joined the party other than in 2011, and his failure killed Benkirane, who came out bigger and eliminated all his competitors and imposed an orphan dictatorship",نكبات بي جي دي ابن عرفة السياسية غادية وتتمدد ومعاها الديموقراطية. تگرگات مرة للمرة الخامسة فانتخابات جزئية بالعرايش شارك فيها اقل من 5 بالمائة,"PGD Ibn Arafa's political calamities are continuing and expanding, and with them democracy. For the fifth time, Tigragat held partial elections in Arache in which less than 5 percent participated",0.25
ARY-train-0268,64 حراكَ من إفريقيا جنوب الصحرا وصلو لكناريا من جايين سواحل العيون,64 movements from sub-Saharan Africa who arrived in Canaria from the coast of Laayoune,55 حراكَ وصلو لكناريا كلهم من دول جنوب الصحرا,"55 movements arrived in Canaria, all of them from sub-Saharan countries",0.65
ARY-train-0269,حصيلة كورونا اليوم: كثر من 150 ألف خداو الجرعة الثانية,"Corona’s toll today: More than 150,000 have received the second dose",كورونا اليوم: كثر من 111 ألف واحد خداو الجرعة الثالثة,Corona today: More than 111 thousand people took the third dose,0.66
ARY-train-0270,اكتشف ما يخبأه لك برجك مهنيا وصحيا وعاطفيا وعائليا يومه الثلاثاء (31 يوليوز 2012),"Find out what your zodiac sign has in store for you professionally, health-wise, emotionally, and family on Tuesday (July 31, 2012)",اكتشف ما يخبأه لك برجك صحيا ومهنيا وعاطفيا وعائليا يومه الاثنين (14 غشت 2012),"Find out what your zodiac sign has in store for you health-wise, professionally, emotionally, and family-wise on Monday (August 14, 2012)",0.79
ARY-train-0271,سلسلة تنفرد بنشرها “كود”: “كيفاش السلاطين ديال المغرب كايشوفو “ريوسهوم” وكايشوفو السلطة ديالهوم وكايحميوها؟ !” المؤسسة الملكية ومسلسل هيمنتها على الحقلين الديني والسياسي: بناء الدولة العصرية انطلاقا من إعادة تنشيط التقليد والتحكم في الوسائل المؤسسية الحديثة.ح 117,A series uniquely published by “Code”: “How can the sultans of Morocco see “Rioshom” and how can they protect this authority and how can they protect it? ! The royal institution and its series of dominance over the religious and political fields: building the modern state based on revitalizing tradition and controlling modern institutional means. H. 117,تنفرد بنشرها”كود”: سلسلة “كيفاش السلاطين ديال المغرب كايشوفو “ريوسهوم” وكايشوفو السلطة ديالهوم وكايحميوها؟ !” الثوار الباحثون عن شرعيات سياسية جديدة: العياشي وجمهورية بوركًراكً الموريسكية ح 55,"It is unique in publishing “Code”: the series “How can the sultans of Morocco be able to see “Rioshom” and how can they protect this authority and how can they protect it? ! Revolutionaries searching for new political legitimacy: Ayachi and the Morisco Republic of Burracara, 55",0.18
ARY-train-0272,الوضعية الوبائية لفيروس كورونا فهد 24 ساعة: 295 تصابو و156 تشافاو وواحد مات.. الطوطال: 11633 و8656 متعافي و218 متوفي,"The epidemiological situation of the Corona virus, Fahd 24 hours: 295 infected, 156 recovered, and one died. Total: 11,633, 8,656 recovered, and 218 deceased.",حصيلة كورونا فهاد 24 ساعة: 45 تصابو و107 تشافاو و2 ماتو.. الطوطال: 7577 حالة و4881 متعافي,"Corona’s toll in 24 hours: 45 infected, 107 recovered, and 2 died. Total: 7,577 cases and 4,881 recovered.",0.34
ARY-train-0273,الدزاير.. 844 إصابة جديدة بـ”كورونا” و14 ماتو و420 تشفاو,"Al-Desire: 844 new cases of “Corona”, 14 deaths, and 420 deaths",الدزاير.. 387 إصابة جديدة بـ”كورونا” و8 ماتو و279 تشفاو و31 فالعناية المركزة: ها شحال وصلو فالطُوطَالْ,"Al-Desire: 387 new cases of “Corona”, 8 who died, 279 who recovered, and 31 in intensive care: How long have they arrived in the country?",0.61
ARY-train-0274,قادة البي جي دي يحاكمون ابن عرفة والرميد. بعد كلام الملك والعثماني والرميد: من يسائل الاجهزة الامنية,"PGD leaders put Ibn Arafa and Al-Ramid on trial. After the words of the King, Al-Othmani and Al-Ramid: Who will ask the security services?",5 مفارقات فمؤتمر البي جي دي الثامن: ابن عرفة ربح بشوهة ونافسو الازمي للي التحق بالحزب غير ف2011 وفشل يقتل بنكيران اللي خرج اكبر واقصى كل منافسيه وفرض بديكتاتورية يتيم,"5 paradoxes in the eighth PGD conference: Ibn Arafa won with a distortion, and they competed with Al-Azmi, who joined the party other than in 2011, and his failure killed Benkirane, who came out bigger and eliminated all his competitors and imposed an orphan dictatorship",0.29
ARY-train-0275,الدزاير.. 910 إصابة جديدة بـ”كورونا” و14 ماتو و455 تشفاو: ها شحال وصلو فالطُوطَالْ,"Al-Desire.. 910 new cases of “Corona”, 14 died, and 455 recovered: How have they arrived in the country?",الدزاير: 237 إصابة جديدة بـ”كورونا” و6 ماتو و191 تشفاو وها شحال وصلو فالطُوطَالْ,"Al-Dzayer: 237 new cases of “Corona”, 6 died, 191 recovered, and they have not arrived in the country.",0.59
ARY-train-0276,ها فوقاش غيبدا إيداع التصريحات بالترشح لانتخابات ممثلي القضاة بالمجلس الأعلى للسلطة القضائية,Ha Fawqash will begin filing declarations of candidacy for the elections to represent judges in the Supreme Council of the Judicial Authority,فـ اختتام الدورة اللولة ديالو.. المجلس الأعلى للسلطة القضائية توصل بـ50 ترشيح لانتخابات ممثلي القضاة,"At the conclusion of the session, Laula Diallo.. The Supreme Council of the Judicial Authority received 50 nominations for the elections of the representatives of judges",0.57
