PairID,Text1,Text1 Translation,Text2,Text2 Translation,Score
ARY-train-0483,سلسلة تنفرد بنشرها “كود” “كيفاش السلاطين ديال المغرب كايشوفو “ريوسهوم” وكايشوفو السلطة ديالهوم وكايحميوها؟ بروز المؤسسة الملكية كفاعل سياسي مهيمن…رمزية “الزيارة الملكية لمدينة طنجة”: 10 أبريل .ح 109,A series uniquely published by “Code”: “How can the sultans of Morocco know how to see “Rioshom” and how can they protect this authority? The emergence of the royal institution as a dominant political actor...the symbolism of the “royal visit to the city of Tangier”: April 10. H. 109,تنفرد بنشرها “كود”: سلسلة “كيفاش السلاطين ديال المغرب كايشوفو “ريوسهوم” وكايشوفو السلطة ديالهوم وكايحميوها؟ المكانة السياسية والدينية للسلطان أمير المؤمنين وخليفة المسسلمين…احتكار السلطان الشريف العلوي للمجال الديني والسياسي… مرحلة اللين في السياسة الدينية للسلطان الشريف…..(2) ح 83,"She is unique in publishing “Code”: the series “How can the sultans of Morocco be able to see “Rioshom” and how can they protect the authority and how can they protect it? The political and religious status of the Sultan, Commander of the Faithful and Caliph of the Muslims... The monopoly of the Alawite Sultan Al-Sharif on the religious and political field... The stage of softness in the religious policy of the Sharif Sultan... (2) H 83",0.22
ARY-train-0484,خاص: بنكيران ينتظر مباركة محمد السادس على المخطط الاستعجالي لمواجهة الجفاف,Exclusive: Benkirane awaits Mohammed VI's blessing on the emergency plan to confront the drought,خاص: صافي هاد العام كاين الجفاف: بنكيران ينتظر مباركة محمد السادس على المخطط الاستعجالي لمواجهته,Exclusive: Safi this year has been drought: Benkirane is waiting for Mohammed VI's blessing on the urgent plan to confront him,0.72
ARY-train-0485,تنفرد بنشرها “كود” سلسلة “كيفاش السلاطين ديال المغرب كايشوفو “ريوسهوم” وكايشوفو السلطة ديالهوم وكايحميوها؟ !” آشنو هي مكانة الدستور في المغرب في ظل هيمنة المؤسسة الملكية على الحقل السياسي الديني في المغرب(1)؟ ح 159,"She is unique in publishing the “code” of the series “How are the sultans of Morocco, how do they see “Rioshom” and how do they protect the authority? ! What is the status of the constitution in Morocco in light of the dominance of the royal institution over the political-religious field in Morocco (1)? H 159",سلسلة “كيفاش السلاطين ديال المغرب كايشوفو “ريوسهوم” وكايشوفو السلطة ديالهوم وكايحميوها؟ !” الاستقلال السياسي والإديولوجي المغربي على عهد السلالات ذات الشرعية الذاتية.. أسطورة الدولة الإدريسية كأول دولة مغربية ! ح 43,The series “How can the sultans of Morocco know how to see “Rioshom” and how can they protect this authority? ! Moroccan political and ideological independence during the era of self-legitimate dynasties.. The myth of the Idrisid state as the first Moroccan state! H 43,0.25
ARY-train-0486,الإتحاد الأوروبي: الصادرات من الصحرا ما غاديش نمنعوها.. و كندعمو جهود الأمم المتحدة ف حل النزاع – وثيقة,The European Union: We will no longer ban exports from the Sahara... and we support the United Nations efforts to resolve the conflict - document,الاتحاد الأوروبي: كنتبعو مستجدات ملف الصحرا و كندعمو جهود الأمم المتحدة لحل النزاع,The European Union: We are following the latest developments in the Sahara issue and we are supporting the United Nations efforts to resolve the conflict,0.62
ARY-train-0487,بنعطية ينافس يايا توري وأسامواه جيا وأديبايور على جائزة أفضل لاعب إفريقي,"Benatia competes with Yaya Toure, Asamoah Giya and Adebayor for the Best African Player award",بنعطية ينافس عمالقة القارة السمراء على نيل جائزة أفضل لاعب إفريقي لسنة 2015,Benatia competes with the giants of the African continent to win the award for the best African player of the year 2015,0.71
ARY-train-0488,الوثائق الأمريكية السرية حصريا على كود: هكذا كشف كيسنجر عن خداع بوتفليقة للحسن الثاني في قضية الصحراء,Secret American documents exclusively on Code: This is how Kissinger revealed Bouteflika’s deception of Hassan II in the Sahara issue,الوثائق السرية الأمريكية حصريا على كود: هذه هي الخطة السرية الاسبانية الجزائرية لإفشال المسيرة الخضراء و بومدين يهدد بقصف المشاركين فيها,"American secret documents exclusively on Code: This is the secret Spanish-Algerian plan to thwart the Green March, and Boumediene threatens to bomb its participants.",0.22
ARY-train-0489,إيستيل زوجة النجم الهولندي كوليت: أتأسف لربط ريد انفصالنا بالمقاتل المغربي بدر هاري وأتمنى أن يستمر حبنا طويلا وهذا ما توصلت له الشرطة بخصوص الشجار الذي وقع بأمستردام,"Estelle, wife of the Dutch star Colette: I regret that Reid linked our separation to the Moroccan fighter Badr Hari, and I hope that our love will last a long time. This is what the police found regarding the quarrel that occurred in Amsterdam.",العلاقة بين زوجة ريد كوليت والمقاتل المغربي بدر هاري تغضب الهولنديين. إيستيل تفضل الاحتفال بعيد ميلادها الـ 34 مع هاري بأمستردام (فيديو),The relationship between Reid's wife Collette and Moroccan fighter Badr Hari angers the Dutch. Estelle prefers to celebrate her 34th birthday with Harry in Amsterdam (video),0.25
ARY-train-0490,حصيلة كورونا فالأقاليم والجهات: 737 إصابة و8 وفاة فكازا سطات.. و115 تشافاو اليوم ففاس مكناس,Corona toll in the regions and regions: 737 infections and 8 deaths in Casa-Settat... and 115 Chavaos today in Fez-Meknes,حصيلة كورونا فالأقاليم والجهات: جهة كازا سطات كملات 20 الف إصابة و14 ماتو فيها بوحدها.. و197 تشافاو ففاس مكناس,"The toll of Corona in the regions and regions: The Casa-Settat-Kamalat region has 20,000 infections and 14 deaths there alone... and 197 deaths in Chavaux, Fez, and Meknes.",0.62
ARY-train-0491,تنفرد بنشرها “كود” سلسلة “كيفاش السلاطين ديال المغرب كايشوفو “ريوسهوم” وكايشوفو السلطة ديالهوم وكايحميوها؟ رد فعل المؤسسة الملكية على المعارضة اللإسلاموية. ح 152,"She is unique in publishing the “code” of the series “How are the sultans of Morocco, how do they see “Rioshom” and how do they protect the authority? The response of the royal establishment to the non-Islamist opposition. H 152",حلقات تنفرد بنشرها “كود”: “كيفاش السلاطين ديال المغرب كايشوفو “ريوسهوم” وكايشوفو السلطة ديالهوم وكايحميوها؟ !” ترسيخ شرعية ذاتية خاصة بالدولة المرينية بمواضيع مقنعة بما فيه الكفاية !! إنعاش الثقافة الدينية كرافد أساسي لشرعنة سلطة المرينيين (الإسلام الشعبي الصوفي: السياق النظري) ح 27,Episodes uniquely published by “Code”: “How can the sultans of Morocco see “Rioshom” and how can they see the authority and protect it? ! Consolidating the self-legitimacy of the Marinid state with sufficiently convincing topics!! Reviving religious culture as an essential tributary to legitimizing the authority of the Marinids (Sufi Popular Islam: Theoretical Context) p. 27,0.25
ARY-train-0492,المغرب حطم الروكور فعدد الإصابات الجديدة بكورونا اليوم: 570 تصابو و228 تشافاو و7 ماتو.. الطوطال: 18834 مصاب و16100 متعافي و299 متوفي .. و2435 كيتعالجو,"Morocco has destroyed the rocor, as the number of new infections with Corona today: 570 infected, 228 recovered, and 7 died.. Total: 18,834 infected, 16,100 recovered, 299 died... and 2,435 are being treated.",حصيلة كورونا هاد الصباح: 218 تصابو و26 تشافاو.. الطوطال: 12854 حالة و9052 متعافي و228 متوفي و3574 كيتعالجو,"Corona toll this morning: 218 infected and 26 recovered. Total: 12,854 cases, 9,052 recovered, 228 deceased, and 3,574 treated.",0.57
ARY-train-0493,تامر حسني تلفات به الوقت.. مراتو المغربية بسمة بوسيل مازال قالباها صباط مع المصرية مي عز الدين,"Tamer Hosni is lost in time.. His Moroccan wife, Basma Bousil, is still in love with the Egyptian Mai Ezz El-Din",تامر حسني تقلق من معجب قرب من مراتو بسمة بوسيل –فيديو,Tamer Hosny is worried about a fan who is close to his wife Basma Bousil - video,0.44
ARY-train-0494,المطرب المصري تامر حسني تزوج على المغربية بسمة بوسيل,Egyptian singer Tamer Hosni married Moroccan Basma Bousil,المطرب المصري تامر حسني مستعد لإقامة 100 حفل زواج للمغربية بسمة بوسيل. أكد أنه تزوجها منذ 3 أشهر (فيديو),Egyptian singer Tamer Hosni is ready to hold 100 wedding ceremonies for Moroccan Basma Bousil. He confirmed that he married her 3 months ago (video),0.46
ARY-train-0495,دورة جديدة لمجلس جهة كَلميم واد نون فالشهر الجاي و البروكَرام مشارجي – وثيقة,A new session of the Guelmim-Oued Noun region council next month and the program “Machharji” – document,آش واقع؟.. وزارة التربية الوطنية بدلات أسماء أمازيغية لمؤسسات تعليمية بجهة كَلميم واد نون – وثيقة,What is the reality?.. The Ministry of National Education replaced Amazigh names for educational institutions in the Guelmim-Oued Noun region - document,0.5
ARY-train-0496,تنفرد بنشرها “كود” سلسلة “كيفاش السلاطين ديال المغرب كايشوفو “ريوسهوم” وكايشوفو السلطة ديالهوم وكايحميوها؟ نماذج من تدخل القضاء لإضفاء الشرعية على النظام… تهميش مبادئ المحاكمة العادلة أثناء ممارسة القضاء لمهمتو في إضفاء الشرعية على النظام (2). ح 136,"She is unique in publishing the “code” of the series “How are the sultans of Morocco, how do they see “Rioshom” and how do they protect the authority? Examples of judicial intervention to give legitimacy to the regime... Marginalization of the principles of fair trial while the judiciary is exercising its mission to give legitimacy to the regime (2). H 136",تنفرد بنشرها “كود”: سلسلة “كيفاش السلاطين ديال المغرب كايشوفو “ريوسهوم” وكايشوفو السلطة ديالهوم وكايحميوها؟ !” الاستقلال السياسي والإديولوجي المغربي على عهد السلالات ذات الشرعية الذاتية… السياسية الدينية للسلطان السعدي في اتجاه فقهاء الإسلام الرسمي ح 49,She is unique in publishing “Code”: the series “How can the sultans of Morocco be able to see “Rioshom” and how can they protect the authority and how can they protect it? ! Moroccan political and ideological independence during the era of self-legitimate dynasties... the religious policy of the Saadi Sultan in the direction of the jurists of official Islam c. 49,0.21
ARY-train-0497,عاجل: عقوبات قاسية تخرج بها الجامعة في حق فريق الرجاء البيضاوي,Urgent: Harsh penalties issued by the university against the Raja Casablanca team,عاجل: الجامعة تخرج بعقوبات في حق الرجاء البيضاوي وحسنية أكادير,Urgent: The university issues sanctions against Raja Casablanca and Hassania Agadir,0.86
ARY-train-0498,الدزاير.. 127 إصابة جديدة بـ”كورونا” و7 ماتو و199 تشفاو.. وها شحال فالطُوطَالْ,"Al-Desair.. 127 new cases of “Corona”, 7 died, and 199 recovered.. and this is how bad it is in the country.",الدزاير.. 401 إصابة ب”كورونا” و7 ماتو و287 تشفاو: ها شحال وصلو فالطوطال,"Al-Desire: 401 cases of “Corona”, 7 deaths, and 287 recoveries: How much have they arrived in the country?",0.75
ARY-train-0499,الرحيل ـ دمعة مسافرة ـ الحلقة التاسعة عشر,Departure - A Traveling Tear - Episode Nineteen,الرحيل ـ دمعة مسافرة ـ الحلقة عشرون,Departure - A Traveling Tear - Episode Twenty,0.72
ARY-train-0500,حصيلة كورونا اليوم: 3577 مغربي ومغربية تصابو و52 ماتو و2796 تشافاو.. الطوطال: 182580 إصابة و3079 وفاة و151634 متعافي.. و27867 كيتعالجو منهم 625 حالتهم خطيرة,"Corona’s toll today: 3,577 Moroccan men and women infected, 52 dead, and 2,796 recovered. Total: 182,580 infections, 3,079 deaths, 151,634 recovered. 27,867 are being treated, of whom 625 are in serious condition.",الوضعية الوبائية لفيروس كورونا فهاد 24 ساعة: 238 تصابو و93 تشافاو و4 ماتو.. الطوطال: 12290 منهم 8833 صافي تعافاو و225 توفاو و3232 كيتعالجو و18 حالتهم حرجة,"The epidemiological situation of the Corona virus in 24 hours: 238 infected, 93 recovered, and 4 died.. Total: 12,290, of whom 8,833 net recovered, 225 died, 3,232 were treated, and 18 were in critical condition.",0.46
ARY-train-0501,الأرصاد الجوية كتحذر: الشتا مزال جاية مجهدا وها المناطق المعنية,"Meteorology warns: Winter is still coming and will be stressful, and these are the areas concerned",الأرصاد الجوية كتحذر: الشتا جاية مجهدا بزااف وغادي وتوصل ما بين 50 و80 ملم فهاد المناطق,Meteorology warns: Winter is coming very hard and will reach between 50 and 80 mm in these areas.,0.72
ARY-train-0502,شباط غادي ويتصطى: بنكيران بدأ يتصرف في وقت من الأوقات كـ”ملك للبلاد” وبنعبد الله “كاري حنكو” وقياديين من البي جي دي شوشوا على التحكيم الملكي الذي طالب به حزب الاستقلال,February is coming and going: Benkirane began to act at one time as “king of the country” and Benabdellah “Kari Hanko” and leaders of the PJD disrupted the royal arbitration demanded by the Istiqlal Party.,حصري. طعون إدارية وقضائية كتساين شباط وها الخروقات اللّي شاد عليه البي جي دي.. الأزمي لـ”كود”: مزال برلماني باسم الاستقلال ومرشح باسم حزب آخر,"Exclusive. Administrative and judicial appeals took place in February, and these are the violations that the PJD denounced.. Al-Azmi for “Kode”: He is still a parliamentarian in the name of independence and a candidate in the name of another party",0.29
ARY-train-0503,بوليس طنجة شدو ريزو ديال التبزنيس ف الحشيش منهم واحد روشيرشي وهاشنو لقاو عندهم,"The police of Tangier, what did they say about the police in the hashish, including one of them, Rocherchi, and Hashnu, they found there?",بوليس الصويرة و بتنسيق مع “الديستي” شدو 3 دالبزناسة منهم واحد روشيرشي وها اللي لقاو عندهم,"Essaouira police, in coordination with “Al-Desti”, captured 3 police officers, including one of Rocherchi, and this is what they found there.",0.62
ARY-train-0504,بالفيديو. البارودي ديال اغنية سعد لمجرد ومحمد رمضان “انساي” مزاحمة مع الاصلية فالطوندونس,By video. Al-Baroudi’s song “Ansay” by Saad Lamjarred and Mohamed Ramadan competes with the original in Altondons,كليب “انساي” ديال سعد لمجرد ومحمد رمضان حقق إنجاز فاليوتوب عبر العالم – فيديو,The clip of “Ansay” by Dial Saad Lamjarred and Mohamed Ramadan achieved the achievement of YouTube across the world – video,0.66
ARY-train-0505,بوريطة هضر مع وزراء الخارجية ديال الكونكَو و رواندا والطوكَو و ملف الصحرا على راس البروكَرام,"Bourita Hadar with the foreign ministers of CONCO, Rwanda, and Toko, and the Sahara file is at the top of the program.",محادثات بين بوريطة و وزير خارجية النمسا و ملف الصحرا على راس البروكَرام,"Talks between Bourita and the Austrian Foreign Minister, and the Sahara file is at the top of the program",0.78
ARY-train-0506,سابقة. محجوبة اول رئيسة جماعة ما دايراش الدرة من العدالة والتنمية وفالرحامنة ل”كود”: ما عمر شي واحد فيهم كال لي ديرو الحجاب وحالفة كنجري على التراكتور من الاقليم ويضويه المصباح وكنتسنى بنكيران يزورني كيفما وعدني,"precedent. Mahjouba, the first president of the Ma Dayrash Al-Durra group from the Justice and Development Party and Al-Rahmaneh, told “Kode”: Not a single one of them has ever told me to wear the hijab and swear that I was running on the tractor from the region with the lamp lit, and I was waiting for Benkirane to visit me as he promised me.",انفراد: بنكيران ل”كود” ردا على تصريحات اخنوش والعنصر: ما غاديش نعلق على تصريحاتهم. احد قادة العدالة والتنمية ل”كود”: “واخا هاكاك مازال باغيين الاحرار يدخلو للحكومة وبنكيران كال باللي قضية الزيادة فليصانص ما عمر اخنوش كالها,"In private: Benkirane to “Kode” in response to the statements of Akhannouch and the member: We will not comment on their statements. One of the leaders of the Justice and Development Party told “Code”: “Brother, Hackak, the liberals still want to enter the government, and Benkirane has asked whoever is responsible for the increase issue, let him protect Omar Akhannouch from all of it.”",0.07
ARY-train-0507,هندوراس: كاندعمو مبادرة الحكم الذاتي المغربية حقاش هي الحل المعقول لقضية الصحرا,"Honduras: They supported the Moroccan autonomy initiative, Haqash, which is a reasonable solution to the Sahara issue",وزير الدفاع الاسباني السابق: المغرب جار مهم وإسبانيا عندها دور كبير فـ ملف الصحرا وخاصها تعاون فـ الحل وتدرس مبادرة الحكم الذاتي,"Former Spanish Defense Minister: Morocco is an important neighbor and Spain has a major role in the Sahara issue, especially cooperation in the solution and is studying the autonomy initiative",0.31
ARY-train-0508,رمضان وكونفينمون (الحلقة 18). جواد السايح فحوار مع “كود”: كنكَلس فالدار حيت كازا ولات مخنوقة بقوة الحفاري.. وإلى جا كل مهني يدعي إنتاج فني ماغنساليوش,"Ramadan and Confinmon (Episode 18). Jawad Al-Sayeh, in an interview with “Code”: Kinkles in the house where the Casa and Lat are suffocated by the power of the excavator.. and to the point of every professional who claims to produce artistic production that is not sane.",رمضان وكونفينمون (الحلقة 24).. الفنان نسيم حداد فحوار مع “كود”: كورونا حرماتنا من الجمهور والقرب من الناس.. والإنتاجات الرمضانية مزيانة,Ramadan and Confinmon (Episode 24)... Artist Nassim Haddad in an interview with “Code”: Corona deprives us of the public and proximity to people.. and Ramadan productions are decorated,0.32
ARY-train-0509,الحصيلة الوبائية لفيروس كورونا فهاد 24 ساعة: 78 تصابو و44 تشافاو وحتى واحد ما مات.. و686 اللي تحت العلاج والمغرب هو اللول فعدد التحاليل فشمال إفريقيا,"The epidemiological tally of the Corona virus in 24 hours: 78 infected, 44 recovered, and not even one died... and 686 are under treatment, and Morocco is the number of tests in North Africa.",الحصيلة الوبائية لفيروس كورونا فهاد 24 ساعة: تحطم الروكور فعدد حالات الشفاء ب261 واحد براو و74 تصابو وواحد مات.. الطوطال: 7407 اصابة و198 متوفي ول4638 متعافي,"The epidemiological toll of the Corona virus in 24 hours: The Rockor was destroyed, so the number of recovered cases reached 261, one recovered, 74 infected, and one died.. Total: 7407 infections, 198 deceased, and 4638 recovered.",0.5
ARY-train-0510,تنفرد بنشرها “كود”: سلسلة “كيفاش السلاطين ديال المغرب كايشوفو “ريوسهوم” وكايشوفو السلطة ديالهوم وكايحميوها؟ المكانة السياسية والدينية للسطان أمير المؤمنين وخليفة المسسلمين… القيمة الرمزية والسياسية والإلزامية لبيعة السلطان: واش “البيعة الحفيظية” عقد متساوي الأطراف، ولا غير الهضرة الخاوية؟. ح 81,"She is unique in publishing “Code”: the series “How can the sultans of Morocco be able to see “Rioshom” and how can they protect the authority and how can they protect it? The political and religious status of the Sultan, Commander of the Faithful and Caliph of the Muslims... The symbolic, political and obligatory value of the Sultan’s Pledge of Allegiance: Is the “Hafidiyah Pledge” a contract of equal parties, or nothing but empty sacrifice? H 81",تنفرد بنشرها “كود” سلسلة “كيفاش السلاطين ديال المغرب كايشوفو “ريوسهوم” وكايشوفو السلطة ديالهوم وكايحميوها؟ !” الاستقلال السياسي والإديولوجي المغربي على عهد السلالات ذات الشرعية الذاتية…المهدي بن تومرت “نبي أمازيغي” يعيد إنتاج رمزية سيدنا محمد عليه السلام بحذافرها ! ح 39,"She is unique in publishing the “code” of the series “How are the sultans of Morocco, how do they see “Rioshom” and how do they protect the authority? ! Moroccan political and ideological independence during the era of self-legitimate dynasties...Mahdi Ben Tumart, the “Berber prophet” reproduces the symbolism of our Prophet Muhammad, peace be upon him, to the letter! H 39",0.14
ARY-train-0511,لا تتركنا يا عمر بلفريج! أي مغرب. وأي عمل برلماني. دون بودكاستاتك. ودون رسائلك التي لم يكن يرد عليها أحد,"Don't leave us, Omar Belfrige! That is, Morocco. And any parliamentary action. Write down your podcasts. And write down your messages that no one responded to",لماذا اعتبر كثيرون فاطمة النجار أمهم، بينما لم يقل أحد لمولاي عمر يا أبي! أي مجتمع لا عقوق فيه، ويقدس الآباء، لا يمكنه أن يتقدم، ولا أن يكتشف أمراضه,"Why did many people consider Fatima Al-Najjar their mother, while no one said to Moulay Omar, “Dad!” Any society in which there is no disobedience, and which sanctifies fathers, cannot progress nor discover its ills",0.04
ARY-train-0512,المنتخب المحلي كيتسبب فتأجيل 4 الماتشات فالبطولة…وها برنامج الدورة الثانية,The local team caused the postponement of 4 matches in the tournament...and here is the program for the second round,البطولة الاحترافية.. 4 ديال الماتشات ما يتلعبوش وها برنامج الدورة الثانية,"The professional tournament.. 4 matches are not played, and this is the program for the second round",0.81
