PairID,Text1,Text1 Translation,Text2,Text2 Translation
kin_train_00359,"""Nta kintu kibabaza nko kuza witeguye kuburana ntuburane.""","""Nothing hurts like coming prepared to fight and not fighting.""","Yagize ati: ""Tuje hano inshuro ebyiri twiteguye kuburana tugasubirayo tutaburanye kandi nta kintu kibabaza nko kuza witeguye kuburana wagera mu rukiko ugasubirayo utaburanye.""","He said: ""We've come here twice ready to plead and come back without a plea and there's nothing more painful than coming to court ready to plead and going back without a plea."""
kin_train_00360,Ni umwe mu bahanzi bazafatanya na Beauty for Ashes mu gitaramo kizabera muri Serena Hotel tariki 9 Nyakanga,He is one of the artists who will join Beauty for Ashes in the concert that will be held at the Serena Hotel on July 9,Kizabera kuri Serena Hotel tariki 9 Nyakanga 2017 guhera ku isaha ya saa kumi n’ebyiri zuzuye.,"It will be held at Serena Hotel on July 9, 2017 starting at 6:00 p.m."
kin_train_00361,Ni we muhanzi rukumbi mu bakora umuziki uhimbaza Imana mu Rwanda umaze gukora ibitaramo bikomeye ndetse bikagaragaramo abahanzi bubatse izina.,He is the only artist among those who make music to praise God in Rwanda who has done great concerts and featured artists who have made a name for themselves.,"The Ben yitabiriye amarushanwa Akomeye, Ibihembo bikomeye, ndetse nibitaramo bikomeye cyane bitari byitabirwa nundi muhanzi uwariwe wese kuva Umuziki w’U Rwanda wabaho.","The Ben has participated in major competitions, major awards, and major concerts that have not been attended by any other artist from Rwanda Music."
kin_train_00362,"Nubwo FPR Inkotanyi yabonye imyanya myinshi mu Nteko, yagabanutseho umwe ugereranyije na manda y’Umutwe w’Abadepite icyuye igihe; PSD yatakaje ibiri naho PL itakaza umwe.","Although the RPF Inkotanyi won more seats in the Parliament, it was reduced by one compared to the mandate of the outgoing House of Representatives; PSD lost two and PL lost one.","Nubwo iri shyaka ryatakaje imyanya ibiri ugereranyije no muri manda ishize, Dr Biruta avuga ko nta kibazo biteye kuko mu matora byose bishoboka.","Although this party lost two seats compared to the last term, Dr Biruta says that there is no problem because everything is possible in the elections."
kin_train_00363,"Uwo mugore ariko ntiyagize amahirwe yo kuhasanga umuyobozi w'akarere wungirije ushinzwe imibereho myiza, kuko yari yagiye mu yindi mirimo mu karere ka Rutsiro akayivamo bwije.","The woman, however, did not have the chance to meet the assistant district mayor in charge of social welfare, because she had gone to other work in Rutsiro district and left after dark.","Umuyobozi w'Akarere ka Karongi Wungirije ushinzwe Ubukungu, Hakizimana Sébastien, we yibukije urubyiruko kubyaza umusaruro ikoranabuhanga kuko ngo risigaye ari kimwe mu ishingiro ry'ubukungu.","The Deputy Mayor of Karongi District in charge of Economy, Hakizimana Sébastien, reminded the youth to make use of technology because it remains one of the foundations of the economy."
kin_train_00364,"Mu kiganiro cyihariye yagiranye na Makuruki.rw Padiri mukuru wa Paruwasi Regina Pacis Remera Charles Ntabyera, yagarutse ku cyo uyu munsi wa mashami uvuze.","In an exclusive interview with Makuruki.rw, the head priest of Regina Pacis Remera Parish, Charles Ntabyera, returned to what the branch is saying today.",Padiri mukuru wa Paruwasi Regina Pacis avuga ko muri iki cyumweru (gitagatifu) abemera kiristu ndetse n' abatamwera bakwiye kurangwa n' urukundo no kwicisha bugufi.,"The head priest of the Parish, Regina Pacis, says that in this (holy) week, Christians and non-believers should be characterized by love and humility."
kin_train_00365,"Pastor Sebagabo Leonard niwe watorewe kuba Umunyamabanga Mukuru wa ADEPR, atsindira ku majwi 57 kuri 62 y'abari bagize Inteko Rusange ya ADEPR ubwo yatoraga.","Pastor Sebagabo Leonard was elected as the General Secretary of ADEPR, winning 57 out of 62 votes of the members of the ADEPR General Assembly when he voted.",Mukaruzage Olea nawe yatorewe kuba Perezidante w'Inama y'Ubuyobozi muri ADEPR aho yasimubye Pastor Sebagabo Leonard watorewe kuba Umunyamabanga Mukuru.,Mukaruzage Olea was also elected as the President of the Board of Directors in ADEPR where he replaced Pastor Sebagabo Leonard who was elected as the General Secretary.
kin_train_00366,"Hari abarokotse Jenoside yakorewe Abatutsi, urubyiruko rero rushobora kwandika ubwo buhamya, kugira ngo abandi babashe gusoma ibyabaye.”","There are survivors of the Genocide against the Tutsis, so the youth can write this testimony, so that others can read what happened.""","Nyuma yo kugira ubutwari bwo gutanga ubuhamya mu gihe cyo kwibuka Jenoside yakorewe Abatutsi, henshi hatandukanye, yagiriwe inama yo kwandika amateka ye mu gitabo.","After having the courage to testify during the commemoration of the Genocide against the Tutsis, he was advised to write his story in a book."
kin_train_00367,"Basabose Jean Paul, avuga ko abarwaye kanseri bagenda biyongera nyamara uburyo bwo kuyivura mu gihugu butari hose.","Sabose Jean Paul, says that the number of people suffering from cancer is increasing, but the way to treat it in the country is not everywhere.","Jean Paul Basabose, avuga abarwaye kanseri bagenda biyongera nyamara uburyo bwo kuyivura mu gihugu butari hose Umuganga w’indwara z’umubiri, akaba n’umuyobozi wa MBC Hospital, Dr.","Jean Paul Basabose, speaking about the increasing number of people suffering from cancer, but the way to treat it in the country is not everywhere. The doctor of physical diseases, and the director of MBC Hospital, Dr."
kin_train_00368,Umugabo witwaga Ananiya n'umugore we Safira bavugwa muri bibiliya bagurishije isambu babeshya umutambyi Petero ikiguzi bagurishirijeho iyo sambu bagamije kugavura bituma bombi bapfa bazize kubeshya.,A man named Ananias and his wife Sapphira mentioned in the Bible sold land and lied to the priest Peter about the price they paid for the land and they both died because of the lie.,"Hariho umugabo witwaga Ananiya hamwe n'umugore we Safira, agura isambu agabanya ku biguzi byayo umugore na we abizi, maze azana igice agishyira intumwa.","There was a man named Ananias and his wife Sapphira, who bought a plot of land and reduced the price of it, the wife also knew, and brought a portion of it to the apostles."
kin_train_00369,Umuvugizi wa Polisi y'u Rwanda mu ntara y'Amajyaruguru yasabye urubyiruko rw'abanyeshuri kuranya ibiyobyabwenge aho bari hose.,The spokesperson of the Rwandan Police in the Northern province asked the youth of the students to fight against drugs wherever they are.,"Chief Superintendent Francis Gahima, Umuvugizi wa Polisi y'u Rwanda mu ntara y'Amajyaruguru yaganirije abo banyeshuri ababwira ko ibiyobyabwenge byangiza ubwonko bityo kwiga ntibigende neza.","Chief Superintendent Francis Gahima, the Spokesperson of the Rwanda Police in the Northern province, spoke to the students and told them that drugs damage the brain and therefore learning is not going well."
kin_train_00370,"Yahamagariye ibihugu byose guhangana n’ibibazo byatewe na Covid-19, bikaziba icyuho yateye bishimangira umubano bifitanye bishingiye ku bumuntu.","He called on all countries to deal with the problems caused by Covid-19, and to close the gap it has created by strengthening their relations based on humanity.","Inzobere zaburiye isi ko mu gihe ibihugu bikennye bizakomeza guhura n’ibibazo by’ubukungu byatewe na Covid-19, bizatuma n’ibihugu bikize bitabasha kuziba icyuho cy’ubukungu burundu.","Experts have warned the world that while poor countries will continue to face economic problems caused by Covid-19, it will make rich countries unable to close the economic gap completely."
kin_train_00371,"Kuri ubu u Rwanda ruzigirwa mu nkingi enye zirimo Iterambere ry’Urwego rw’Abikorera, Guteza imbere ibyoherezwa hanze, uburyo igihugu cyishakamo ubushobozi ndetse n’iterambere ry’urwego rw’ubukungu.","At present, Rwanda will be supported in four pillars, which include the development of the private sector, the development of exports, the way the country acquires capacity and the development of the economic sector.","Mu migambi ya Macron, harimo guteza imbere umugabane wa Afurika cyane cyane Afurika y’Amajyaruguru ndetse n’iyo hagati, ari naho u Rwanda rubarizwa.","Macron's goals include developing the African continent, especially North and Central Africa, where Rwanda is located."
kin_train_00372,"Inkuru y’iki gitabo cya Mubalaka Edouard, ntiyavuzweho rumwe cyane cyane Abakristu bavuga ko ubu ari ubuyobe bukomeye.","The story of this book by Mubalaka Edouard, is not agreed, especially Christians who say that this is a great heresy.",Byinshi mu bikunze gutangazwa na Mubalaka Edouard ntibikunze kuvugwaho rumwe cyane cyane abakristu babirwanya bivuye inyuma bavuga ko ari ibishitani Umubavu.com,"Most of what is often published by Mubalaka Edouard is not often discussed, especially by Christians who oppose it from the back saying that it is a paradise Umubavu.com"
kin_train_00373,"Perezida Kagame wagize icyo atangaza bwa mbere ku ifatwa rya Lt Gen KARENZI, yavuze ko ibyakozwe ari ubucakara, ubwirasi ndetse n'ubukoloni bigikomeje muri Afurika.","President Kagame, who announced the arrest of Lt Gen KARENZI for the first time, said that slavery, terrorism and colonialism are still going on in Africa.","Ubwo Perezida Kagame yavugaga iri jambo, Abanyarwanda mu bice bitandukanye by'igihugu bari mu mihanda bamagana ifatwa rya Lt Gen Karenzi Karake.","When President Kagame said this, Rwandans in different parts of the country were in the streets protesting the arrest of Lt Gen Karenzi Karake."
kin_train_00374,Aha abantu benshi usanga barya ibyo abakunzi babo barya cyangwa banywa nyamara mbere atari ko byari bimeze.,"Many people now eat what their loved ones eat or drink, but it wasn't like that before.","Kurya inyama zanyuze mu nganda Usanga abantu benshi bakunda ibintu byanyuze mu nganda, nyamara akenshi usanga atari byiza ku mubiri.","Eating Processed Meat You'll find that many people love processed meat, but it's often not healthy for the body."
kin_train_00375,"Blatter yamenyeshejwe n’ubushinjacyaha bukuru bw’u Busuwisi ko aregwa kubera inguzanyo bivugwa ko FIFA yayoboraga, yahaye Ishyirahamwe ry’umupira w’amaguru rya Trinidad &Tobago mu",Blatter has been notified by the Swiss Attorney General that he is being prosecuted over a loan allegedly directed by FIFA to the Trinidad &amp; Tobago Football Association in,Sepp Blatter wayoboraga FIFA ari gukorwaho iperereza kubera miliyoni 1$ yagurijwe Ishyirahamwe ry'Umupira w'Amaguru rya Trinidad & Tobago mu 2010,FIFA president Sepp Blatter is under investigation over a $1 million loan to the Trinidad &amp; Tobago Football Association in 2010.
kin_train_00376,Ati “ Amafaranga nayivanyemo nayaguzemo ikibanza cya miliyoni imwe n’ibihumbi magana abiri by’amafaranga y’u Rwanda.”,"He said, ""The money I took out of it was worth one million two hundred Rwandan francs.""","Iyi igura $3,000 ni ukuvuga asaga miliyoni ebyiri n’ibihumbi 500 by’amafaranga y’u Rwanda.","This one costs $3,000, which is more than two and a half million Rwandan francs."
kin_train_00377,"Mu makipe y’abafana b’amakipe yo mu Rwanda harimo aba APR FC, Rayon Sports ndetse n’aba Kiyovu SC ari nayo ari mu itsinda ribanza.","Among the fan clubs of Rwandan teams are APR FC, Rayon Sports and Kiyovu SC who are also in the first group.","Usengimana Faustin yakiniye amakipe atandukanye mu Rwanda arimo Rayon Sports yanazamukiyemo na APR FC, aha hose akaba yaragiye atwara ibikombe.","Usengimana Faustin played for various teams in Rwanda, including Rayon Sports and APR FC, where he won trophies."
kin_train_00378,"Niba inkari zawe wumva zinuka cyane, bishobora kuba ikimenyetso cy’uko urwaye ubwandu bw’umuyoboro w’inkari (infection urinaire/urinary tract infection), indwara y’impyiko cg umwijima.","If your urine smells bad, it could be a sign of a urinary tract infection, kidney or liver disease.","Ibyo wituma Nubwo amabyi adahumura, ariko mu gihe wumva anuka bikabije; nk’igihe anuka nk’ibintu byaboze cg ibindi wumva bidasanzwe, bishobora kuba ikimenyetso cy’uburwayi.","What you do Although the pollen does not smell, but when you feel the smell; For example, when it smells like something rotten or something else feels strange, it can be a sign of illness."
kin_train_00379,"Perezida Kagame yavuze ko nta ngufu za gisirikari u Rwanda rufite, nta n'ikoranabuhanga rihanitse, ariko ko hari ikindi bafite, aricyo mbaraga z'umujinya.","President Kagame said that Rwanda has no military power, no advanced technology, but that they have something else, which is the power of anger.","Imbere y'abayobozi batandukanye n'imbaga y'abari baje kumva indahiro z'abayobozi bashya, Perezida Kagame yavuze ko hari icyo abanyamahanga bashakaga kugeraho mu Rwanda batagezeho.","In front of different leaders and the crowd of people who came to hear the oath of the new leaders, President Kagame said that there was something that foreigners wanted to achieve in Rwanda but they did not achieve it."
kin_train_00380,"Francois Regis Rukundakuvuga wagizwe Perezida w’uru rukiko, yari asanzwe ari Umucamanza mu Rukiko rw’Ikirenga kuva muri Mata","Francois Regis Rukundakuwuga who was appointed President of this court, was already a Judge in the Supreme Court since April","Dr Aime Muyoboke Kalimunda wagizwe Umucamanza mu Rukiko rw’Ikirenga, yari asanzwe ari Perezida w’Urukiko rw’Ubujurire akaba ari we wasimbuwe na Francois Regis Rukundakuvuga.","Dr Aime Muyoboke Kalimunda was appointed a Supreme Court Judge, who was previously the President of the Court of Appeal and was replaced by Francois Regis Rukundakuvuga."
kin_train_00381,Ni umukino wakinywe kuri uyu wa Gatatu tariki 10 Mutarama 2018 guhera saa cyenda n’igice ku isaha y’i Kigali.,"It is a game played on Wednesday, January 10, 2018, starting at 9:30 Kigali time.","Umukino watangiye ku isaha ya saa kumi n’ebyiri z’umugoroba(18h00), aho kuba saa cyenda n’igice nkuko bisanzwe kuyindi mikino.","The game started at 18:00, instead of 9:30 as usual in other games."
kin_train_00382,Minisitiri Dr Gashumba avuga ko ubuhahirane hagati y’ibihugu bukomeje kandi bazakomeza gushyira hamwe cyane ko Congo ifite ubunararibonye mu guhangana na Ebola.,Minister Dr. Gashumba says that the cooperation between the countries continues and they will continue to focus on Congo's experience in dealing with Ebola.,"Yagize ati “Gushyira hamwe na Congo byadufashije kugira ubunararibonye nk’igihugu cyahuye na Ebola, gusa tuzakomeza kuganira dukomeza ibikorwa by’isuku no gukumira Ebola.","He said, ""Joining Congo has helped us gain experience as a country that has faced Ebola, but we will continue to discuss and continue the sanitation and prevention of Ebola."
kin_train_00383,Inspector Emmanuel Kayigi umuvugizi wa Polisi y'igihugu ikorera mu ntara y'iburasirazuba avuga ko ari ibyaha byatewe n'ubusinzi atari ibyishimo by'iminsi mikuru.,"Inspector Emmanuel Kayigi, the spokesperson of the National Police in the Eastern Province says that these are crimes caused by drunkenness and not the joy of the holidays.","Umuvugizi wa Polisi mu Ntara y’Iburengerazuba, Chief Inspector of Police (CIP) Bonaventure Twizere Karekezi, avuga ko gufatwa kw’aba bantu bose byaturutse ku makuru yatanzwe n’abaturage.","The spokesperson of the Police in the Western Province, Chief Inspector of Police (CIP) Bonaventure Twizere Karekezi, says that the arrest of all these people resulted from information provided by the public."
kin_train_00384,Kubeshya mu tuntu duto Iyo ubeshya umukunzi wawe mu tuntu duto tworoheje nko kumubwira aho uri atariho uri bituma agenda agutakariza icyizere gahoro gahoro.,"Lying in small things When you lie to your partner in small things like telling him where you are not, he will slowly lose trust in you.",Kubeshya Kubeshya ni ingeso mbi cyane idashobora kwihanganirwa mu rukundo kuko iyo ubeshya umukunzi wawe agutakariza icyizere kandi urukundo rutarimo icyizere ruba rwamaze gusenyuka.,Lying Lying is a very bad habit that cannot be tolerated in love because when you lie your partner loses trust in you and love without trust has already collapsed.
kin_train_00385,"Ubwo yatangiza iyo gahunda, Minisitiri w’Urubyiruko n’ikoranabuhanga, Jean Philbert Nsengimana yavuze ko “uwo mushinga nukora neza uzagezwa mu gihugu hose.”","When he launched the program, the Minister of Youth and Technology, Jean Philbert Nsengimana said that ""if the project is successful, it will be implemented throughout the country.""","Minisitiri w’Urubyiruko n’Ikoranabuhanga, Jean Philbert Nsengimana yavuze ko amasezerano yasinywe uyu munsi agamije guhuza abaturage benshi bataragerwaho n’ikoranabuhanga muri Afurika.","The Minister of Youth and Technology, Jean Philbert Nsengimana said that the agreement signed today is aimed at connecting the majority of people who have not yet had access to technology in Africa."
kin_train_00386,"Guverineri w’Intara y’Amajyaruguru, Gatabazi Jean Marry Vianney, yabwiye abaturage ati “Tugomba kuboneza urubyaro dushaka ubuzima bwiza, ariko ntibigomba guhera mu magambo, bigomba gushyirwa mu bikorwa.”","The Governor of the Northern Province, Gatabazi Jean Marry Vianney, told the people: ""We must plan the offspring if we want a healthy life, but it should not start with words, it should be implemented.""","Guverineri w’Intara y’Amajyaruguru, Gatabazi Jean Marie Vianney uvuga ko yabanye na Padiri Rutsindintwarane ahitwa I Burehe mu 1990, yavuze ko ababajwe n’urupfu rwe.","The governor of the Northern Province, Gatabazi Jean Marie Vianney, who said that he lived with Father Rutsindintwarane at I Burehe in 1990, said that he was saddened by his death."
kin_train_00387,"Kanseri y’ibere iterwa n’ukwiyongera kudasanzwe k’uturemangingo tw’ibere, turakura birenze urugero umubiri ntubashe kuba wabicunga.","Breast cancer is caused by abnormal growth of breast tissue, which grows too much for the body to handle.","Kanseri y’ibere iterwa n’ukwiyongera kudasanzwe k’uturemangingo tw’ibere, turakura birenze urugero umubiri ntubashe kuba wabicunga neza.Yibasira abagore n’abagabo ariko ikunze kuboneka cyane mu bagore.","Breast cancer is caused by the abnormal growth of breast tissue, which grows too much for the body to handle properly. It affects both women and men but is more common in women."
kin_train_00388,Mukashyaka yatubwiye ko Byiringiro yahise atoroka nyuma yo kwica Kamuhire kugeza ubwo twakoraga iyi nkuru akaba yari atarafatwa.,Mukasyaka told us that Biiriringo escaped after killing Kamuhire and as we were doing this story he had not been arrested.,Byiringiro nyuma yo kubona ko ashobora kuzakurikiranwaho icyaha cyo kwica Kamuhire yahise ahunga ariko inzego z’umutekano zisaba abaturage kuzifasha kumushaka.,"Hope after seeing that he might be prosecuted for murdering Kamuhire, he ran away but the security agencies asked the public to help them find him."
kin_train_00389,"Inzobere mu buvuzi akaba akaba n’umuyobozi wa MBC Hospital, Dr.","Medical expert and director of MBC Hospital, Dr.","Abahanga bagaragaza ko iyo kanseri itahuwe kare ivurwa igakira Umuganga w’indwara z’umubiri, akaba n’umuyobozi wa MBC Hospital, Dr.",Experts show that cancer that is not detected early is treated and cured.
kin_train_00390,"Uzwi cyane ni Chloroquine, Ishami ry’Umuryango w’Abibumbye ryita ku Buzima (OMS) ukaba Umuryango mpuzamahanga ushinzwe iby’ubuzima wamaze guhagarika ubushakashatsi bwakorwaga kuri uwo muti.","The most famous is Chloroquine, the World Health Organization (WHO) and the International Health Organization have already stopped research on this drug.","RBC ku bufatanye n’Umuryango Ihorere Munyarwanda (IMRO) n’Ishami ry’Umuryango w’Abibumbye ryita ku Buzima bw’Imyororokere (UNFPA), yizihije umunsi mpuzamahanga wahariwe kuboneza urubyaro.","RBC in collaboration with the Rwandan Reproductive Organization (IMRO) and the United Nations Reproductive Health Organization (UNFPA), celebrated the International Family Planning Day."
kin_train_00391,"Ubu u Rwanda ruri ku mwanya wa gatandatu mu kwitabira ibikorwa byo kigarura amahoro ku isi aho rwohereza ingabo n'abapolisi, ingabo nyinshi ziri muri UNAMID.","Rwanda is now in sixth place in participating in peacekeeping operations in the world where it sends troops and police, most of the troops are in UNAMID.","Nyuma yo gutsindwa, u Rwanda ruri ku mwanya wa gatandatu mu makipe umunani.","After the defeat, Rwanda is in sixth place out of eight teams."
kin_train_00392,Mu Kinyarwanda igitero cy’imigogo byari nko kuvuga igitero cy’ibitero:igitero cyari kigamije kwihorera kubera ibitero bya Ntare V Rugingiza rwa Migereka wanyaze inyambo za Rwabugili.,In Kinyarwanda the attack of the trunks was like saying the attack of the attacks: the attack was aimed at revenge for the attacks of Ntare V Rugingiza of Migereka who stole the prey of Rwabugili.,Iki gitero cyari kigamije cyane cyane kwihorera no kugaruza inyambo zari zanyazwe ku ngufu na Ntare V Rugingiza rwa Migereka wa Ankole.,This attack was mainly aimed at retaliating and retrieving the spoils that had been forcibly taken by the Tiger V of the Ankole Army.
kin_train_00393,Irinde kurya ibiryo birimo ibinure byinshi kuko bituma umubiri ucika intege ugatangira kunanirwa ahubwo reba ubundi buryo wabiteka udakoresheje amavuta mesnhi cyangwa ukarya ibitogosheje.,"Avoid eating foods that contain a lot of fat because they make the body weak and begin to fail. Instead, look for other ways to cook them without using too much oil or eating fried foods.",Soma hano inama zagufasha kureka itabi  Irinde kurya kenshi ibiryo bitunganyirizwa mu nganda n’ibirimo amavuta menshi kuko bibangamira umwijima.,Read here for tips to help you quit smoking  Avoid eating processed foods and high-fat foods because they harm the liver.
kin_train_00394,Gusa muri aya mazu hari ayakoreshwa n'andi adakoreshwa bitewe n'uko yubatswe ariko akabura abayabamo bitewe n'uko abarimu bakayabayemo bose baturiye ibigo.,Only among these houses there are some that are used and others that are not used due to the fact that they were built but lack of residents due to the fact that the teachers who live in them are all living in institutions.,"Gusa ibi bifatwa na bamwe nk'igihombo kuri Leta bitewe n'uko aya mazu yatwaye amafaranga menshi yubakwa, ariko akaba ari aho apfa ubusa nta cyo akoreshwa.","Only this is considered by some as a loss for the State due to the fact that these houses cost a lot of money to build, but they are where they die without any use."
kin_train_00395,"Gusa, avuga ko hari imibare yerekana ko abantu bakingiwe bashobora kwandura Covid nanone ndetse bakayanduza abandi, bityo ashimangira ko guhana intera no kwambara udupfukamunwa bigikenewe.","However, he says that there are statistics that show that people who have been vaccinated can catch Covid again and spread it to others, so he insists that social distancing and wearing masks are still necessary.","Avuga ko aho iki gikorwa kizabera atahatangaza ubu kuko hazamenyeshwa abiyandikishije gusa, ngo hari umubare ntarengwa ndetse abantu barenga 80% bamaze kwiyandikisha.","He says that the location of this event will not be announced now because it will be announced only to those who have registered, that there is a limit and more than 80% of people have already registered."
kin_train_00396,"Idrissa, izina ry'umuntu unezezwa no kwirebera ibyaremwe Yanditswe kuya 1-07-2016 saa 07:20' na IGIHE Idrissa ni izina rihabwa umwana w'umuhungu.","Idrissa, the name of a person who enjoys looking at creation Written on 1-07-2016 at 07:20' by IGIHE Idrissa is a name given to a boy.",Jerome izina ry'umuntu bigoye gusobanukirwa Yanditswe kuya 4-08-2016 saa 07:39' na IGIHE Jerome ni izina rifite inkomoko mu Kigereki risobanura ‘izina ritagatifu cyangwa igihangange.,Jerome is a name that is difficult to understand Written on 4-08-2016 at 07:39' by IGIHE Jerome is a name of Greek origin meaning 'the name of a saint or giant.
kin_train_00397,"Umuyobozi w’ihuriro ry’ababyaza mu Rwanda, Josephine Murekezi, avuga ko kugeza ubu ababyaza bakiri bake ugereranyije n’abakenewe nk’uko biteganywa.","The head of the Midwives' Association in Rwanda, Josephine Murekezi, says that so far there are still few midwives compared to the number of people needed as per the provisions.","Josephine Murekezi, umuyobozi w’ihuriro ry’ababyaza mu Rwanda Ababyeyi batwite baboneyeho kwipimisha MENYA UMWANDITSI Jean Claude Munyantore Umunyamakuru wa Kigali Today/KT Radio  MunyantoreC PROMOTED STORIES","Josephine Murekezi, head of the Midwives Association in Rwanda Expectant mothers benefited from the screening KNOW THE AUTHOR Jean Claude Munyantore Reporter of Kigali Today/KT Radio MunyantoreC PROMOTED STORIES"
kin_train_00398,Peace Plaza’ bigamije kubungabunga ubuzima bw’abayikoreramo - Ubuyobozi Ibisobanuro ku bibasirwa na Covid-19 biboneka mu mibereho y’abaturage mu gace runaka - Dr.,Peace Plaza' aims to preserve the health of those who work there - Management Information about the victims of Covid-19 found in the lives of people in a certain area - Dr.,Ubuyobozi Ibisobanuro ku bibasirwa na Covid-19 biboneka mu mibereho y’abaturage mu gace runaka - Dr.,Management Information about the victims of Covid-19 is available in the lives of people in a certain area - Dr.
