PairID,Text1,Text1 Translation,Text2,Text2 Translation
kin_train_00574,Iyi gahunda igamije korohereza abarimu bigisha mu mashuri yisumbuye yo mu cyaro kubona amazi meza mu buryo bworoshye kandi ku giciro gito.,This program aims to make it easier for teachers in rural high schools to get clean water easily and at a low cost.,Avuga kandi ko bafite gahunda yo gukomeza kwagura icyo gikorwa ku buryo bazageza amazi meza ku baturage benshi hagamijwe ko bagira ubuzima bwiza.,He also says that they have plans to continue expanding the project so that they will provide clean water to more people in order to have a healthy life.
kin_train_00575,Ibi biganiro bizasozwa n'ijoro ryo kwibuka ndetse ku wa gatandatu hakazaba kwibuka nyirizina abakozi n'abandi bakoraga mu bitaro bya Kibogora bahitanywe na Jenoside yakorewe Abatutsi.,These discussions will end with a night of remembrance and on Saturday there will be a memorial service for the staff and others who worked at the Kibogora hospital who were killed in the Genocide against the Tutsis.,Abaganga ba Kibogora mu biganiro bijyanye n'icyumweru bahariye kwibuka abaguye muri ibyo bitaro muri Jenoside yakorewe Abatutsi.,"The doctors of Kibogora, in discussions about the week, dedicated to the memory of those who died in the hospital in the Genocide against the Tutsis."
kin_train_00576,"Kuva Wenger yagera muri Arsenal mu mwaka wa 1996, ikipe yatwaye ibikombe bya shampiyona bitatu, n'ibya FA Cup bitandatu.","Since Wenger arrived at Arsenal in 1996, the club has won three league titles and six FA Cups.",Ikipe ya Young yatwaye ibikombe 5 bya CECAFA Kagame cup ndetse na 24 bya Shampiyona y'iwabo .,Young's team won 5 CECAFA Kagame cups and 24 home championships.
kin_train_00577,Abahanga mu by’imikorere y’ubuzima bw’umuntu bakugira inama yo kunywa amazi nibura buri minota 45 kugira ngo umubiri urusheho gukomeza gukora neza.,Health experts recommend that you drink water at least every 45 minutes to keep your body functioning properly.,Gusohora imyanda Kunywa amazi ahagije bifasha buri gice cy’umubiri gukora neza.,Excretion Drinking enough water helps every part of the body function properly.
kin_train_00578,"Iki gitaramo cyabereye muri Kigali Conference and Exhibition Village [ahazwi nka Camp Kigali] ku mugoroba wo kuri iki Cyumweru, tariki ya 10 Ukuboza","The show was held at the Kigali Conference and Exhibition Village [known as Camp Kigali] on Sunday evening, December 10","Iki gitaramo cyiswe ‘Worship Legacy Season 2’ cyabereye i Rusororo muri Intare Conference Arena, ku mugoroba wo kuri iki Cyumweru, tariki ya 26 Gicurasi","The show titled 'Worship Legacy Season 2' was held in Rusororo at the Intare Conference Arena, this Sunday evening, the 26th of May."
kin_train_00579,"Itangazo rya LG rivuga ko uru ruganda rwahagaritse gutunganya telefone zigendanwa, rukaba rugiye kwibanda mu gukora indi bikoresho by’ikoranabuhanga.",LG's statement says that the company has stopped making mobile phones and is going to focus on making other electronic devices.,"Uretse gutunganya telefone zigendanwa, uru ruganda rukora televiziyo za rutura, ibirahure bya telefone, batiri zo mu modoka, radiyo zo mu modoka n’ibindi.","Apart from mobile phones, the company also manufactures home televisions, phone glasses, car batteries, car radios and more."
kin_train_00580,Ati “Ni ikimenyetso kigaragaza imbaraga n’ubushake bwinshi ubuyobozi bw’igihugu cyacu bushyira mu guteza imbere imitangire ya serivisi hakoreshejwe ikoranabuhanga mu rwego rwo kubungabunga ubuzima bw’Abanyarwanda.,"He said, “It is a sign that shows the strength and determination of the government of our country to promote the start of services using technology in order to preserve the lives of Rwandans.",ko imbaraga nyinshi zikwiriye gushyirwa mu baturage bakamenya inyungu za serivisi ibigo by’imari byashyizeho zigamije guteza imbere ikoranabuhanga mu guhererekanya amafaranga Amafoto: Muhizi Serge,that a lot of effort should be put into the public to know the benefits of the services that financial institutions have set up to develop money transfer technology. Photos: Muhizi Serge
kin_train_00581,"Minisitiri Biruta, yavuze ko gucana Urumuri Rutazima bigaragaza kwibuka Jenoside yakorewe Abatutsi, kugarurira agaciro abazize Jenoside ndetse n'u Rwanda muri rusange.","Minister Biruta said that the lighting of the Eternal Flame reflects the memory of the Genocide committed against the Tutsis, the recapture of the values of the victims of the Genocide and Rwanda as a whole.","Iki gikorwa cyo kwibuka ku nshuro ya 19 Jenoside yakorewe abatutsi, cyateguwe n'umuryango Never Again, ugizwe n'abarokotse Jenoside yakorewe abatutsi mu Rwanda ufatanyije n'inshuti zawo.","This commemoration of the 19th Genocide against the Tutsi was organized by the Never Again organization, which consists of survivors of the Genocide against the Tutsi in Rwanda together with their friends."
kin_train_00582,"By'umwihariko yashimye intambwe u Rwanda rugezeho, kugeza n'aho rwohereza abapolisi mbere y'uko itariki yateganyijwe n'Umuryango w'Abibumbye igera.","In particular, he praised the progress made by Rwanda, even to the point of sending the police before the date scheduled by the United Nations.",Kugeza ubu u Rwanda rufite abapolisi 528 mu butumwa bw'amahoro bw'umuryango w'abibumbye mu bihugu bitandukanye byo ku isi.,"Currently, Rwanda has 528 police officers in peacekeeping missions of the United Nations in different countries of the world."
kin_train_00583,"Imibare ya BNR igaragaza ko abanyarwanda bakoresha Mobile Money bavuye ku 231 000 mu mwaka wa 2010, bakagera kuri miliyoni 6 muri Kamena","BNR figures show that Rwandans using Mobile Money increased from 231,000 in 2010 to 6 million in June","Amafaranga yahererekanyijwe kuri Mobile Money yavuye kuri miliyoni 3 mu mwaka wa 2010, agera kuri miliyari 19 muri Kamena",Mobile Money transfers rose from $3 million in 2010 to $19 billion in June.
kin_train_00584,"Ubusanzwe lunettes de lumière bleue zishobora kugira umumaro igihe umuntu akoresha mudasobwa kuko zisubiza inyuma urumuri rwayo, ariko hari izindi zabugenewe zizwi nka lunettes d’ordinateur.","Usually lunettes de lumière bleue can be useful when using a computer because they reflect back its light, but there are other special ones known as lunettes d'ordinateur.",Lunettes de lumière bleue zisubiza inyuma urumuri rw'ubururu rushobora kwangiza amaso yawe Lunettes d’ordinateur zituma ibyo ureba muri mudasobwa byigira inyuma bityo amaso yawe ntiyangirike,Blue light glasses reflect the blue light that can damage your eyes.
kin_train_00585,"Hari ama couple ahitamo gukora imibonano mpuzabitsina buri munsi, hari n’andi yiha igihe runaka bitewe n’impamvu zitandukanye ziirmo akazi, n’ibindi.","There are couples who choose to have sex every day, there are others who give it a certain time due to various reasons including work, etc.","Ubusanzwe igitsina cy’umugabo gishobora guhindura ingano yacyo bitewe n’impamvu zitandukanye harimo nko kuba yiteguye gukora imibonano mpuzabitsina, ihindagurika ry’ibihe, ndetse n’ibindi,….","Normally, a man's penis can change its size due to various reasons including his readiness to have sex, seasonal changes, and more."
kin_train_00586,"Imyigaragambyo y'Interahamwe zambaye imyenda yazo n'amashara, (...)","The protests of the Interahamwe wearing their uniforms and coats, (...)","Imyigaragambyo y'Interahamwe zambaye imyenda yazo n'amashara, zinaganitse ku mamodoka biziritseho, ubwicanyi bwabo mu gihugu, yari integuza.","The protests of the Interahamwe wearing their uniforms and coats, standing on the cars attached to them, their killing in the country, was a warning."
kin_train_00587,Hari abagore benshi usanga abagabo babo bagerageza kubahindurira uburyo bateramo akabariro bakanga bitwaje ngo ntibabyiviramo bagahora bakoresha u buryo bumwe nyamara wenda umugabo wawe yaraburambiwe.,"There are many women who find that their husbands try to change their way of doing things and they refuse to pretend that they don't care and they always use the same way, but maybe your husband is bored.",Gufata umwanya ukanezeranwa n’abana bawe Ibi byo abagabo benshi barabitsinda ariko ntibazi ko ari uburyo bumwe bwo kwereka abagore babo ko babakunda.,Taking time to trust your children This is what many men do but they don't know that it is one way to show their wives that they love them.
kin_train_00588,Perezida Kagame kandi yavuze ko u Rwanda rwishimiye gukomeza imibanire myiza rufitanye n’abashoramari b’Abashinwa.,President Kagame also said that Rwanda is happy to maintain good relations with Chinese investors.,"Perezida Kagame yavuze ko nta ngufu za gisirikari u Rwanda rufite, nta n'ikoranabuhanga rihanitse, ariko ko hari ikindi bafite, aricyo mbaraga z'umujinya.","President Kagame said that Rwanda has no military power, no advanced technology, but that they have something else, which is the power of anger."
kin_train_00589,"Umugore ufite ikibazo cyo kumva atakigira ubushake bwo gukora imibonano mpuzabitsina, ashobora kubiterwa n’impamvu zitandukanye.","A woman who has a problem feeling that she no longer has the desire to have sex, can be caused by various reasons.",Ibibazo by’imisemburo Igihe umugore ari ageze mu gihe cyo gucura (atakibyara) ashobora kugira ikibazo cy’imisemburo imwongerera ubushake bwo kumva yifuje kuryamana n’umugabo.,"Hormonal problems When a woman reaches menopause (not having children), she may experience hormonal problems that increase her desire to have sex with a man."
kin_train_00590,"Uzwi cyane ni Chloroquine, Ishami ry’Umuryango w’Abibumbye ryita ku Buzima (OMS) ukaba Umuryango mpuzamahanga ushinzwe iby’ubuzima wamaze guhagarika ubushakashatsi bwakorwaga kuri uwo muti.","The most famous is Chloroquine, the World Health Organization (WHO) and the International Health Organization have already stopped research on this drug.",Ishami ry’umuryango w’abibumbye ryita ku buzima (OMS/WHO) ryaburiye ko iki cyorezo kiri kongera umuvuduko.,The United Nations Health Organization (WHO/WHO) has warned that the epidemic is increasing.
kin_train_00591,Ubuyobozi bwa PSF buvuga ko bukirimo gutegura ingengo yimari na gahunda yibikorwa byo kwibuka no gufasha abarokotse Jenoside muri buri ntara.,The PSF administration says that it is still preparing the budget and the program of activities to commemorate and help the survivors of Genocide in each province.,"Ubuyobozi bwa Kaminuza ya Kibogora buvuga ko bafite gahunda yo kuzasura izindi nzibutso, gusura inzibutso za Jenoside kikaba ari igikorwa bateganya gukora buri mwaka.","The administration of Kibogora University says that they have plans to visit other monuments, visiting the genocide memorials is an activity they plan to do every year."
kin_train_00592,"Babitangaje kuwa kane tariki 7 Mata 2016, mu biganiro bijyanye no kwibuka Jenoside yakorewe Abatutsi mu","They announced it on Thursday, April 7, 2016, in discussions about the commemoration of the Genocide committed against the Tutsis in","Celis avuga ko uruhare rwe ari ukubwira Abanyaburayi by'umwihariko abakoresha ururimi rw'Igifaransa, ukuri kuri Jenoside yakorewe Abatutsi muri Mata","Celis says that his role is to tell Europeans, especially those who use the French language, the truth about the Genocide against the Tutsis in April."
kin_train_00593,Polisi ikaba isaba abaturage gukomeza gutanga amakuru mbere kandi ku gihe kugira ngo hakomezwe ingamba zo gukumira ibyaha bitaraba.,The police are asking the public to continue to provide information early and on time in order to strengthen measures to prevent crimes before they occur.,Amakuru polisi ifite arifashishwa mu gutahura abandi bajura bari muri iri tsinda kandi abaturage barasabwa gukomeza gutanga amakuru yose bamenya ngo umutekano udahungabana.,The information the police have is being used to identify other thieves in this group and the public is requested to continue to provide all information knowing that security is not compromised.
kin_train_00594,"Mu 2016, Arsène Tuyi yahawe igihembo cya Groove Awards Rwanda nk’umuhanzi mushya w’umwaka mu ruhando rw’abaririmba indirimbo zo kuramya no guhimbaza Imana bakoze cyane.","In 2016, Arsène Tuyi was awarded the Groove Awards Rwanda as the new artist of the year in the category of worship and praise singers who have worked hard.","Iri tsinda rifite ibigwi kuko ryahembwe muri Groove Awards Rwanda 2016, nka Korali y’Umwaka, ifite Indirimbo nziza y’Umwaka n’iyo Kuramya y’Umwaka.","This group has been awarded at the Groove Awards Rwanda 2016, such as Choir of the Year, Best Song of the Year and Worship of the Year."
kin_train_00595,Ezechiel Ndabarinze umuyobozi w’ikigo nderabuzima cya Munyiginya avuga ko bagifite abakozi bacye ariko bikaba bitica serivise baha abaturage babagana.,"Ezechiel Ndabarinze, the director of the Munyiginya health center, says that they still have staff but they are not providing services to the people in the area.","Umuyobozi w’Ikigo Nderabuzima cya Munyiginya mu Karere ka Rwamagana, Ezechiel Ndabarinze, yavuze ko kuva babona amashanyarazi babashije gutanga serivisi nyinshi ndetse akazi karushaho kuborohera.","The director of Munyiginya Health Center in Rwamagana District, Ezechiel Ndabarinze, said that since they got electricity they have been able to provide more services and their work has become easier."
kin_train_00596,"Umunyamabanga nshingwabikorwa wa CNLG, Dr Bizimana Jean Damascène nawe yari ahari.","The executive secretary of CNLG, Dr Bizimana Jean Damascène was also present.","André Twahirwa, Dr Jean Damascène Bizimana na Albert Toch bari mu bitabiriye ibyo biganiro Umunyamabanga nshingwabikorwa wa komisiyo ishinzwe kurwanya Jenoside (CNLG) Dr.","André Twahirwa, Dr. Jean Damascène Bizimana and Albert Toch were among those who participated in the discussions."
kin_train_00597,"Shampiyona iyobowe by’agateganyo na Kiyovu Sports ifite amanota 24 , AS Kigali ya 2 ifite","The championship is temporarily led by Kiyovu Sports with 24 points, AS Kigali is second",Kugeza ubu AS Kigali niyo ikomeje kuyobora shampiyona n'amanota 12 n'ibitego 7 izigamye naho Police FC ikaba iya kabiri ifite amanota 12 ikazigama ibitego,"Currently, AS Kigali continues to lead the league with 12 points and 7 goals saved while Police FC is second with 12 points and goals saved."
kin_train_00598,Mark Bryan Schreiner yavuze ko abaturage bakwiye gukomeza guhabwa amakuru yerekeranye no kuboneza urubyaro ndetse bakegerezwa na serivisi zabafasha mu kuboneza urubyaro.,Mark Bryan Schreiner said that the public should continue to receive information about family planning and be closer to family planning support services.,"Muri ibyo birori byo kwizihiza umunsi mpuzamahanga w’abatuye isi, abaturage banaboneyeho n’umwanya wo guhabwa serivisi zo kuboneza urubyaro.","During the event to celebrate the International Day of the World's Population, the people also took advantage of the opportunity to receive family planning services."
kin_train_00599,Gutsindwa kwa Rayon Sports byatumye AS Kigali iza ku mwanya wa kabiri n'amanota 21 aho irushwa na APR FC ya mbere amanota abiri gusa.,"The defeat of Rayon Sports made AS Kigali to the second place with 21 points, only two points behind the first APR FC.",APR FC yari ihanganye na Rayon Sports yo yatakaje amanota abiri i Nyakinama aho yanganyije na Musanze FC ubusa ku busa.,APR FC was facing Rayon Sports who lost two points in Nyakinama where they drew with Musanze FC in a goalless draw.
kin_train_00600,"Kugeza ubu, abapadiri n’abandi banyamadini bashyigikira ubutinganyi biganje muri Leta Zunze Ubumwe za Amerika, Canada n’u Burayi.","Currently, clergy and other religious leaders who support equality are dominant in the United States, Canada and Europe.","Gusa ngo bitewe n'abimukira, iyi migenzo igera no muri Leta Zunze Ubumwe za amerika, Australia no mu bihugu bitandukanye by'i Burayi.","Only because of immigrants, these traditions reach the United States of America, Australia and various European countries."
kin_train_00601,"Ukwiyongera cyane kwabonetse mu bigo by’ubwishingizi bya leta ari byo RSSB na MMI, aho hiyongereyeho miliyari 6FRW bitewe n’abishinganisha bashya bangana na 432","The biggest increase was found in state-owned insurance companies RSSB and MMI, with an increase of 6FRW billion due to 432 new insurers.",RSSB na MMI nibyo byazamutse cyane bigera kuri miliyari 4 FRW ugereranyije na miliyari 9 FRW ku bigo by’ubwishingizi byigenga.,RSSB and MMI had the highest increase of 4 billion FRW compared to 9 billion FRW for private insurance companies.
kin_train_00602,"Ibinyoma abagabo bubatse babeshya abakobwa bashaka ko baryamana gusa Mu gihe ukundana n’umugabo wubatse ukaba ukeka ko hari aho umubano wanyu uzagera, tekereza",Lies married men lie to girls that they only want to have sex with,Ibi ni ibinyoma abagabo bubatse bakunda guhuriraho babeshya abagore cyangwa abakobwa babasezeranya kuzabana nyamara bishakira ko baryamana bakabayarana abo.,"These are lies that married men like to meet and lie to women or girls, promising them to live with them, but then asking them to have sex with them."
kin_train_00603,Amafaranga nakoreye ubanza yari nka 3 000 Frw ariko kuri njyewe byari ibintu bikomeye cyane kuko bwari ubwa mbere nari mpembwe n’umuziki.,The money I made at first was about 3 000 Frw but for me it was a big deal because it was the first time I was interested in music.,Ohlsson: Byari byiza ariko nari nafite impungenge kuko ari ubwa mbere duhuye.,Ohlsson: It was good but I was worried because it was the first time we met.
kin_train_00604,"Umuvugizi wa Polisi mu Ntara y'Amajyepfo, Chief Superintendent Hubert Gashagaza, atangaza ko polisi itajya irekura umuntu yafatanye urumogi, imyanzuro nk'iyo ikaba ifatwa n'ubushinjacyaha.","The spokesperson of the Police in the Southern Province, Chief Superintendent Hubert Gashagaza, announced that the police will not release the person involved in marijuana, such decisions are taken by the prosecution.","Chief Superintendent Francis Gahima, Umuvugizi wa Polisi y'u Rwanda mu ntara y'Amajyaruguru yaganirije abo banyeshuri ababwira ko ibiyobyabwenge byangiza ubwonko bityo kwiga ntibigende neza.","Chief Superintendent Francis Gahima, the Spokesperson of the Rwanda Police in the Northern province, spoke to the students and told them that drugs damage the brain and therefore learning is not going well."
kin_train_00605,"Kuva APR FC ibona igitego niyo yakomeje kwiharira umupira no gukina neza ahanini biturutse ku guhanahana neza imipira kwa Buteera Andrew, Bizimana Djihad na Muhajiri.","From the moment APR FC scored they continued to dominate the ball and play well mainly due to the good exchange of balls by Buteera Andrew, Bizimana Djihad and Muhajiri.",Mukura VS yakomeje kotsa igitutu APR FC ari nako ibona uburyo bumwe na bumwe bwari kuvamo igitego ariko Kimenyi Yves agakomeza kuba ibamba.,Mukura VS continued to pressurize APR FC and they found some ways to score but Kimenyi Yves continued to hold the ball.
kin_train_00606,"Akomeza agira ati:""Ubu tuvugana mvuye gusaba imbabazi Paccy kuko yakundaga Cyusa nkarenga ngashaka kumuca intege kuko nashakaga ko Cyusa yakundana na Esther.","He continues: ""Now we're talking, I'm going to apologize to Paccy because she loved Cyusa and I wanted to discourage her because I wanted Cyusa to fall in love with Esther.","akomeza agira ati:""ubu rero mboneyeho umwanya wo gusaba imbabazi umuvandimwe wanjye Esther kuko naharabitse umukunzi we kandi mubeshyera ni ukuri nabiterwaga n’amafaranga nahabwaga na Cyusa!""","He continues: ""So now I take the opportunity to apologize to my brother Esther because I cheated on his girlfriend and lied to him, it was because of the money I received from Cyusa!"""
kin_train_00607,Umuvugizi wa Polisi y'u Rwanda yakomeje asaba abaturage gutanga amakuru ahagaragaye ikibazo nk'iki hakiri kare.,The spokesperson of the Rwandan Police continued to ask the public to provide information in case of such a problem at an early stage.,Umuvugizi wa Polisi y’u Rwanda Assistant Commissioner of Police (ACP) Damas Gatare akaba asaba abaturage kwirinda ikintu cyose cyateza inkongi z’umuriro nk’insinga z’amashanyarazi buji n’ibindi.,"Rwanda Police Spokesperson Assistant Commissioner of Police (ACP) Damas Gatare is asking the public to avoid anything that could cause a fire such as electrical wires, candles, etc."
kin_train_00608,Imikino ya CECAFA iteganyijwe kubera muri Kenya kuva tariki ya 3 kugera 17 Ukuboza 2017 aho buri tsinda ririmo amakipe,The CECAFA games are scheduled to be held in Kenya from 3rd to 17th December 2017 where each group includes teams,Uko amakipe azakina Tariki ya 03 Ukuboza 2017 Itsinda A Libya vs Tanzania Kenya vs Rwanda,"How the teams will play on December 03, 2017 Group A Libya vs Tanzania Kenya vs Rwanda"
kin_train_00609,Diarra yasinye amasezerano muri Rayon Sports yongereye imanza za Leopard mu Rwanda Ismailla Diarra rutahizamu wa Rayon Sports yamaze kongera amasezerano muri iyi kipe.,Diarra has signed a contract with Rayon Sports to extend Leopard's cases in Rwanda.,FERWAFA yatangaje ko yamaze gusubika ibyangombwa bijyana Diarra muri Kenya kuko yamaze kongera amasezerano muri Rayon Sports.,FERWAFA has announced that it has already postponed the documents to take Diarra to Kenya as it has already renewed its contract with Rayon Sports.
kin_train_00610,"Kazan Arena Iyi ni stade yubatse mu Mujyi wa Kazan, ifite ubushobozi bwo kwakira abantu ibihumbi 45,379 ikaba yarafunguwe mu mwaka wa","Kazan Arena This is a stadium built in the city of Kazan, with a capacity of 45,379 people and it was opened in the year","Stade ya Fisht: Iyi stade yubatse mu Mujyi wa Sochi, yafunguwe mu 2013, ikaba ifite ubushobozi bwo kwakira abantu 47,","Fisht Stadium: This stadium was built in the city of Sochi, opened in 2013, and has a capacity of 47 people."
kin_train_00611,"Yavuze ko mu gihugu ahagarariye cya Israel ingufu nyinshi ziri gushyirwa mu bikorwa bihuza abantu nka siporo, umuco n’ubugeni kugira ngo abantu bongere kubana neza.","He said that in the country he represents, Israel, a lot of energy is being put into activities that bring people together, such as sports, culture and art, so that people can live together well.","Ati “Nyuma y’imyaka 26 Jenoside yakorewe Abatutsi mu Rwanda ihagaritswe, abantu bashobora kongera guhuzwa na siporo, umuco n’ubugeni kugira ngo bakire ibikomere.”","He said, ""After 26 years of the Genocide against the Tutsi in Rwanda being stopped, people can be reunited with sports, culture and art to heal their wounds."""
kin_train_00612,Hari ibyiza byo gukora imibonano mpuzabitsina mu gihe umugore ari mu mihango ?,Are there benefits to having sex while a woman is on her period?,"Mu gusubiza uwabajije ikibazo, Dr Iba yavuze ko kuva amaraso mu gihe cyo gukora imibonano mpuzabitsina ari ikintu kidasanzwe kabone n’ubwo umugore yaba yaracuze.","In response to the questioner, Dr Iba said that bleeding during intercourse is unusual even if the woman is pregnant."
kin_train_00613,Iki gitaramo cyiswe “Thanksgiving Celebration Live Concert” giteganyijwe kubera Kerkplein1 mu Buholandi ku wa 4-5 Mata,"The ""Thanksgiving Celebration Live Concert"" is scheduled for Kerkplein1 in the Netherlands on April 4-5.",Iki gitaramo cyiswe “Mpa Amavuta Live Concert” gitegerejwe kubera muri Kigali Arena ku wa 1 Werurwe,"The show called ""Mpa Amavata Live Concert"" is expected to be held at the Kigali Arena on March 1"
kin_train_00614,Mu Rwanda hatangiye gukorerwa udupfukamunwa two kwa muganga Bwa mbere mu mateka u Rwanda rwatangiye gukora udupfukamunwa twifashishwa kwa muganga ndetse n’abantu ku giti cyabo.,"In Rwanda, the production of dental implants has begun. For the first time in the history of Rwanda, the production of dental implants for medical use and for individuals has begun.","Inganda zitandukanye ndetse n’abantu ku giti cyabo bakomeje gukora udupfukamunwa mu moko atandukanye, ikintu kimaze kuba umuco muri ibi bihe cyo kwirinda COVID","Various industries and individuals continue to practice social distancing, a practice that has become commonplace during this time of COVID-19."
kin_train_00615,"Uramutse uyikeneye wahamagara kuri 0789433795/0726355630 cyangwa ukaba wagana Horaho Life aho ikorera kwa Rubangura muri Etage ya 3, mu muryango wa","If you need it, you can call 0789433795/0726355630 or go to Horaho Life at Rubangura on the 3rd Floor, at the entrance of","Izo nyunganiramirire ziboneka muri Horaho life company ikorera mu mujyi wa Kigali kwa Rubangura, etage 3, umuryango","These nutritional supplements are available at Horaho life company located in Kigali city at Rubangura, 3rd floor, door"
kin_train_00616,Kugeza ubu abamaze kwandura Coronavirus mu Rwanda ni 134 mu gihe 49 bamaze gukira iki cyorezo bagasezererwa mu bitaro.,"So far, 134 people have been infected with the coronavirus in Rwanda, while 49 have recovered from the disease and been discharged from the hospital.","Kugeza kuri uyu wa Kabiri abari bamaze gusangwamo Coronavirus mu Rwanda ni abantu 286, barimo 153 bamaze gukira, mu gihe abakirwaye ari","As of Tuesday, 286 people have been diagnosed with the coronavirus in Rwanda, including 153 who have recovered, while those who are still sick are"
kin_train_00617,Byari agahebuzo ubwo Ruhago Sports Promoters na Rayon Sports batangizaga ku ku mugaragaro ubufatanye bwabo!,It was the end when Ruhago Sports Promoters and Rayon Sports officially launched their partnership!,Tubibutse ko Ruhago Promoters LTD yatangiye ubufatanye n’ikipe ya Rayon Sports buzamara imyaka 5,We remind you that Ruhago Promoters LTD has started a partnership with Rayon Sports team that will last for 5 years
