PairID,Text1,Text1 Translation,Text2,Text2 Translation
kin_train_00001,"Izi serivisi benshi bigaragara ko batarasobanukirwa, zabanje gutangirwa mu bitaro byitiriwe Umwami Faisal (KFH) ariko ubu bisigaye bikorerwa mu bitaro bya gisirikare i Kanombe.","These services, which many do not seem to understand, were first started at the King Faisal Hospital (KFH) but are now being carried out at the military hospital in Kanombe.","Col Dr Charles Furaha, ni umusirikare w’umuganga uzobereye muri izi serivisi utashakira ahandi mu Rwanda uretse aho akorera mu bitaro bya gisirikare i Kanombe.","Col. Dr. Charles Furaha, is a military doctor specializing in these services who cannot be found anywhere else in Rwanda except where he works at the military hospital in Kanombe."
kin_train_00002,Avuga ko agahinda ke katangiye gukura ubwo yari ageze mu mashuri yisumbuye kuko akiri umwana nabwo yari agafite ariko katarakura cyane nk’uko byaje kugenda nyuma.,He says that his depression started to develop when he was in high school because he had it when he was a child but it was not as severe as it became later.,"Iyo akiri umwana aba avuga utugambo twinshi, ugasanga arasakuza ariko iyo afashijwe n'ababyeyi cyangwa abandi bamurera agenda akura ahinduka","When he is a child, he speaks a lot of words, and you find that he is loud, but when he is helped by his parents or others who raise him, he grows up and changes."
kin_train_00003,"Igitego cya Rayon Sports cyatsinzwe n'umusore w'umurundi Kwizera Pierrot ku munota wa 24 w'umukino, kuri Coup Franc Rayon yari ibonye.","Rayon Sports' goal was scored by the Burundian Kwizera Pierrot in the 24th minute of the game, for the Coup Franc Rayon had won.","Rayon Sports itsinda igitego cya mbere ku munota wa 68 cyatsinzwe na Niyonzima Olivier Sefu, nyuma y’akazi kari kabanje gukorwa na Caleb na Sarpong.","Rayon Sports team's first goal in the 68th minute was scored by Niyonzima Olivier Sefu, after the work done earlier by Caleb and Sarpong."
kin_train_00004,Ubutumwa buri muri iyi ndirimbo ni ukumenya no gushishikariza abantu ko nta wundi wo gusingizwa atari Imana.,The message in this song is to know and encourage people that there is no one to replace but God.,Ndayishimiye yavuze ko ubutumwa buri muri iyi ndirimbo bugamije kubwira abantu ko bafite ubutunzi bukomeye bwo kumenya Imana.,Ndayimiyi said that the message in this song is intended to tell people that they have a great wealth to know God.
kin_train_00005,Iwacu w’imyaka 20 y’amavuko yiga iby’ikoranabuhanga mu ishuri rikuru rya Akilah institute for Women riherereye mu mu Mujyi wa Kigali.,Our 20-year-old student studies technology at the Akilah Institute for Women located in Kigali City.,Ubu yiga mu mwaka wa nyuma mu ishami ry’ikoranabuhanga rya mudasobwa mu ishuri rikuru rya Akilah Institute for Women riri mu Mujyi wa Kigali.,She is currently studying in her final year at the Computer Technology Department at the Akilah Institute for Women in Kigali City.
kin_train_00006,"Ubwo Media yakomeje amubwira ati:""Cyusa twagerageje guhagarika ndetse no kwitambika umubano wa Esther na Micheal ariko aho bigeze urabona ko tumaze gutsindwa!""","Media continued to tell him: ""We just tried to stop and sacrifice the relationship between Esther and Micheal, but at that point you can see that we have already failed!""","Ariko Media aramusubiza ati:""Cyusa ntacyo ntakoze ngo ntandukanye Esther na Micheal Pe!","But Media replied: ""I just didn't do anything to separate Esther from Micheal Pe!"
kin_train_00007,"Perezida Kagame yavuze ko abanyarwanda nibakomeza gukora ibyo bashoboye byose bigamije iterambere, ngo nta kabuza bazabigeraho kuko ngo abantu bose Imana yabaremanye ubushobozi bungana.","President Kagame said that if Rwandans continue to do everything they can for the purpose of development, they will succeed because God created all people with equal potential.",Icyo gihe Perezida Kagame yagize ati “Leta izakomeza gukora ibishoboka byose ngo ifashe Abanyarwanda muri ibi bihe bitoroshye.,"At that time, President Kagame said: “The government will continue to do everything possible to help Rwandans in these difficult times."
kin_train_00008,Amavubi ari kwitegura umukino na Guinée-Conakry mu gushaka itike y’Igikombe cya Afurika,Tigers are preparing for the match against Guinea-Conakry in search of a ticket for the Africa Cup of Nations,Uyu yari kumwe na Côte d’Ivoire yanyagiye Amavubi ibitego 5-0 kuri stade Amahoro mu 2011 mu gushaka itike y’igikombe cya Afurika cya,He was with Côte d'Ivoire who beat the Tigers 5-0 at the Amahoro Stadium in 2011 to qualify for the Africa Cup of Nations.
kin_train_00009,Duhugukire kwandika neza Ikinyarwanda Mu myandikire y’Ikinyarwanda hari amakosa akunda gukorwa ashingiye ku ifatana n’itandukana ry’amagambo.,Let's learn to write well in Ikinyarwanda In writing Ikinyarwanda there are mistakes that are often made based on the connection and separation of words.,"Duhugukire kwandika neza Ikinyarwanda (igice cya gatatu) Mu myandikire y’Ikinyarwanda, hari amagambo afatana n’andi atandukana.","Let's practice writing well in Ikinyarwanda (part three) In Ikinyarwanda writing, there are words that go together and others that are different."
kin_train_00010,"“Abaturage kandi basabwa kugira isuku nko kumenyera kwituma mu bwiherero, gukaraba intoki, no kuryama mu nzitiramibu.”","""People are also required to practice good hygiene such as using the toilet, washing their hands, and sleeping in bed.""","Yagize ati “Nko mu Rwanda dukangurira abaturage isuku birinda ibigunga n’ibizenga by’amazi hafi y’ingo, dutera umuti mu ngo tukanakangurira abaturage kuryama mu nzitiramibu.","He said, ""Like in Rwanda, we are encouraging people to clean up the water bodies and ponds near their homes, we are spraying medicine in the houses and we are also encouraging people to sleep in the mud."""
kin_train_00011,Kuri uyu wa Gatatu tariki 20 Ugushyingo 2019 biteganyijwe ko Rayon Sports isubukurira imyitozo yo mu kibuga i Rugende.,"On this Wednesday, November 20, 2019, it is planned that Rayon Sports will resume field training in Rugende.",Rayon Sports iri kwitegura Sunrise FC bagomba guhura kuri uyu wa Gatanu tariki 1 Werurwe 2019 kuri Stade ya Kigali i Nyamirambo.,"Rayon Sports is preparing to face Sunrise FC on Friday, March 1, 2019 at the Kigali Stadium in Nyamirambo."
kin_train_00012,"Liesse, izina ry’umukobwa uhorana ibyishimo Liesse ni izina rihabwa umwana w’umukobwa risobanura ‘Ibyishimo’, rikaba rifite inkomoko mu Butaliyani kuva mu myaka yo hambere.","Liesse, a girl's name that is always happy Liesse is a girl's name meaning 'Joy', which has its origins in Italy since ancient times.","Rajesh, izina ry’abantu bagorwa no kuvugira mu ruhame Rajesh ni izina rihabwa umwana w’umuhungu, rifite inkomoko mu gihinde ku izina Riaja risobanura ‘umwami’.","Rajesh, a name for people with difficulty in public speaking Rajesh is a name given to a boy, which has its origin in the Indian name Riaja which means 'king'."
kin_train_00013,"Urwibutso rwa Jenoside yakorewe Abatutsi rwa Mukarange rubitse imibiri y’Abatutsi 8,763 bishwe muri Jenoside Masengesho Winfrida Jenoside yatangiye afite imyaka 15 y’amavuko.","The Mukarange Genocide Memorial holds the bodies of 8,763 Tutsis killed in the Genocide Masengesho Winfrida Genocide started when she was 15 years old.","Akarere ka Kayonza gafite inzibutso za jenoside yakorewe Abatutsi 7, zose zibitse imibiri y’Abatutsi","Kayonza District has 7 Tutsi Genocide Memorials, all of which contain the bodies of Tutsis."
kin_train_00014,"Ribanje Laurent, umwe mubatangiranye na koperative Duterimbere Murundi yagarutse kuburyo koperative yatangiye n’uburyo babifashijwemo na Kayonza Rice Product Ltd.","First, Laurent, one of the founders of Duterimbere Murundi cooperative, returned to how the cooperative started and how they were helped by Kayonza Rice Product Ltd.",Yagize ati koperative twayingije muri 2012 ariko mu mpera za 2013 nibwo twabonye ubuzimagatozi tubifashijwemo n’umuterankunga wacyu Muzehe Nyagatare uhagarariye Kayonza Rice Product Ltd.,He said that we joined the cooperative in 2012 but at the end of 2013 we got the legalization with the help of our sponsor Muzehe Nyagatare representing Kayonza Rice Product Ltd.
kin_train_00015,Gusa ngo iperereza rirakomeje kugira ngo uwabigizemo uruhare wese amenyekane kandi abihanirwe.,It's just that the investigation is ongoing so that whoever is involved can be identified and punished.,"CIP Hakizimana kandi avuga ko abakekwaho kugira uruhare muri ubu bwicanyi nabo ntibaramenyekana, gusa ngo iperereza rikaba rigikomeza.","CIP Hakizimana also says that the suspects involved in this murder have not yet been identified, only that the investigation is still ongoing."
kin_train_00016,"Rayon Sports ifite abanyamahanga bane barimo Umunye-Congo Manace Mutatu, Umunya-Mali Oumar Sidibé, Abanya-Côte d’Ivoire Drissa Dagnogo na Jean Vital Ourega.","Rayon Sports has four foreigners including Congolese Manace Mutatu, Mali Oumar Sidibé, Côte d'Ivoire Drissa Dagnogo and Jean Vital Ourega.","Manace Mutatu, Ourega Jean Vital, Drissa Dagnogo, Sunday Jimoh na Oumar Sidibe nibo bakorewe iki gikorwa.","Manace Mutatu, Ourega Jean Vital, Drissa Dagnogo, Sunday Jimoh and Oumar Sidibe were involved in this operation."
kin_train_00017,Riderman yavuze ko iyi ndirimbo yari imaze igihe kinini muri studio ndetse mu byumweru bibiri azashyira hanze amashusho yayo.,Riderman said that the song had been in the studio for a long time and in two weeks he will release the video for it.,"Akiva Dubai, Knowless ngo azahita ashyira hanze imwe mu ndirimbo zizafatirwa amashusho i Dubai yise ‘Reka ngukunde"" ndetse ikazanasohokana n'amashusho yayo.","After leaving Dubai, Knowless will soon release one of the songs that will be filmed in Dubai called 'Let me love you' and it will also be released with its video."
kin_train_00018,Mimi Mirage ufite n’ibikorwa by’ubucuruzi mu mujyi wa Kigali ni umwe mu batangaje ku mugaragaro ko bashyigikiye Mwiseneza Josiane ndetse amwemerera imodoka.,"Mimi Mirage, who also has business activities in Kigali city, is one of those who publicly announced their support for Mwiseneza Josiane and even allowed her a car.","Mwiseneza Josiane yashimiye Mimi Mirage washyize mu bikorwa ibyo yamusezeranyije, agasanga ari urugero rw’umuntu mwiza ufite umutima w’urukundo.","Mwisene Josiane thanked Mimi Mirage who fulfilled her promise, finding her to be an example of a good person with a loving heart."
kin_train_00019,Perezida Kagame yageze mu Bushinwa ku wa Gatanu tariki 17 Werurwe ari kumwe na Madamu n’abandi bayobozi mu nzego nkuru z’igihugu.,"President Kagame arrived in China on Friday, March 17, accompanied by Mrs.",Biteganyijwe ko uruzinduko rwa Perezida Kagame mu Bushinwa rusozwa kuri uyu wa Gatandatu tariki 18 Werurwe,"It is planned that President Kagame's visit to China will end on Saturday, March 18"
kin_train_00020,Rayon Sports yasubijwe imodoka tariki ya 9 Kanama uwo mwaka nyuma y’ibiganiro byahuje impande zombi.,Rayon Sports returned the car on August 9 that year after negotiations between the two sides.,Rayon Sports izakira umukino ubanza uzaba tariki ya 9 Kanama 2019 mu gihe uwo kwishyura uzabera muri Sudani nyuma y’ibyumweru bibiri.,"Rayon Sports will host the first match on August 9, 2019 while the second leg will be held in Sudan two weeks later."
kin_train_00021,Ntabwo hagaragajwe impamvu y’uko kugabanyuka ko gukora imibonano mpuzabitsina mu bashakanye ariko no mu bindi bihugu nka Leta Zunze Ubumwe za Amerika byaragabanyutse.,It is not clear why the rate of sex in marriage has declined in other countries such as the United States.,"Iri zina ryakunze gukoreshwa cyane mu bihugu bikoresha ururimi rw’Icyongereza, nkaho muri Leta Zunze Ubumwe za Amerika ryatangiye gukoreshwa ahagana mu","This name has been widely used in English-speaking countries, such as in the United States of America."
kin_train_00022,"Umuvugo: Abana Yanditswe kuya 4-09-2013 saa 11:25' na Chantal Nyirabera Abana ni abahanga Bahanga Isi ikareka guhangayika, Bahangamura n'ibiyihungabanya, Ikaruhuka igahumeka amahoro.","Poem: Children Written on 4-09-2013 at 11:25' by Chantal Nyirabera Children are the experts who make the world stop worrying, They disturb it and disturb it, It rests and breathes peace.","Abana ni abahanga Bahanga Isi ikareka guhangayika, Bahangamura n'ibiyihungabanya, Ikaruhuka igahumeka amahoro.",Children are geniuses. They make the world stop worrying.
kin_train_00023,"Hakiri kare ku munota wa 18’, Nsengiyumva Moustapha yaboneye Rayon Sports igitego cya mbere mbere yo kungamo icya kabiri ku munota wa 34’ w’umukino.","Early on in the 18th minute, Nsengiyumva Moustapha got the first goal for Rayon Sports before scoring the second in the 34th minute of the game.",Nsengiyumva Moustapha yasimbuwe na Sibomana Abouba ku munota wa 65’ mbere naho Nova Bayama asimbura Muhire Kevin ku munota wa 68’ w’umukino.,Nsengiyumva Moustapha was replaced by Sibomana Abouba in the 65th minute and Nova Bayama replaced Muhire Kevin in the 68th minute of the game.
kin_train_00024,"Umuyobozi Mukuru wa Polisi y’u Rwanda, Inspector General of Police (IGP) Emmanuel K.","The Director General of Rwanda Police, Inspector General of Police (IGP) Emmanuel K.","Kigali: Abapolisi basabwe kurushaho kunoza imikorere bagendera ku ndangagaciro zayo Umuyobozi Mukuru wa Polisi y'u Rwanda, Emmanuel K.","Kigali: The police have been asked to improve their performance based on their values. The Director General of the Rwanda Police, Emmanuel K."
kin_train_00025,Muri iyi nkuru rero tugiye kurebera hamwe zimwe mu mpamvu zishobora gutera gutukura amaso ndetse n’ubufasha.,So in this article we are going to look at some of the possible causes of red eyes and how to help.,Muri iyi nkuru tugiye kureba uko inzoka zo mu nda ndetse n’izindi ndiririzi na Mikorobe zishobora gutera umubyibuho ukabije.,In this article we are going to look at how intestinal worms and other worms and microbes can cause obesity.
kin_train_00026,Mubikorwa biteganyijwe gukorwa n'iri huriro harimo kwifatanya n'Abanyarwanda n'amahanga kwibuka ku nshuro ya 22 Jenoside yakorewe Abatutsi mu,Among the activities planned to be carried out by this forum is to join Rwandans and foreigners in commemorating the 22nd Genocide against the Tutsis.,Umuyobozi Wungirije wa Kaminuza ya UNESCO IHE avuga ko bazakomeza kwifatanya n'Abanyarwanda mu kwibuka abazize Jenoside yakorewe Abatutsi.,The Deputy Director of the UNESCO IHE University says that they will continue to join Rwandans in commemorating the victims of the Genocide against the Tutsis.
kin_train_00027,Suge J Knight yavuze ko ari gukorana indirimbo nshya na Tupac muri studio ndetse atapfuye uri Nzeri 1996 nkuko byavuzwe.,Suge J Knight said he was working on a new song with Tupac in the studio even though he didn't die in September 1996 as reported.,Suge J Knight yatangaje byinshi kuri Tupac ndetse ashyira hanze amafoto aherutse kwifotozanya na 50 Cent na Beyonce,Suge J Knight revealed more about Tupac and released recent photos of himself with 50 Cent and Beyonce
kin_train_00028,Perezida KAGAME yashimiye Ndayisenga Valens watwaye Tour du Rwanda Perezida Paul Kagame yashimiye Ndayisenga Valens nyuma y'umunsi umwe yegukanye Tour du Rwanda,President KAGAME congratulated Ndayisenga Valens who won the Tour du Rwanda President Paul Kagame congratulated Ndayisenga Valens a day after he won the Tour du Rwanda,"Ndayisenga Valens watwaye Tour du Rwanda kuri iki cyumweru Ku rubuga rwe rwa Twitter, Perezida Kagame yanditse ashimira Ndayisenga Valens ndetse n'abayitabiriye bose muri rusange.","Ndayisenga Valens who took the Tour du Rwanda this week On his Twitter page, President Kagame wrote thanking Ndayisenga Valens and all the participants in general."
kin_train_00029,Bamwe mu bafana bagize Gisaka Fan Club nibo bagiye gusangira n’abarwayi barwariye mu bitaro bikuru bya Kibungo biherereye mu Karere ka Ngoma.,Some of the fans who are members of Gisaka Fan Club are the ones who are going to eat with patients who are sick at Kibungo General Hospital located in Ngoma District.,Gisaka Fan Club ibarizwa mu Karere ka Ngoma.,Gisaka Fan Club is located in Ngoma District.
kin_train_00030,"Icyerekana ko hari ikintu cyabaye ni ibarwa cyangwa se inama [imyanzuro] ikaba isinye, ukaba ufite imyanzuro y’inama ariko ibyo ntibikorwa n’imyanzuro y’inama bikorwa n’ibarwa.’’","What shows that something has happened is the count or the council's [decisions] being signed, and you have the council's resolutions, but that is not done by the council's decisions, which are done by the count.",Mu gihe ufite umukunzi ukaba umukunda nyabyo ariko we akaba atakwizera hari inama ugirwa nkuko tubikesha Agasaro Magazine.,"If you have a boyfriend and you really love him, but he doesn't trust you, there is some advice you can get, thanks to Agasaro Magazine."
kin_train_00031,Ba mukerarugendo bagenda mu karere ka Rutsiro bavuga ko hari ibyiza byinshi ariko umuhanda n'ibyapa biyobora abagenzi biracyari imbogamizi.,Tourists who travel to Rutsiro region say that there are many attractions but the road and road signs are still a problem.,Imbogamizi ba mukerarugendo bavuga ko bahura na zo mu gihe batembera mu karere ka Rutsiro ngo ni ibyapa bikiri bicye ku mihanda biyobora abagenzi.,The obstacles that tourists say they face while traveling in Rutsiro region are the signs that are still on the roads that guide travelers.
kin_train_00032,Inkuru bijyanye:Ibyumba by'amasengesho bisigaye bifatirwamo abagore ku ngufu Hari abahurira n'ibibazo mu byumba by'amasengesho,Related story: Prayer rooms remain where women are raped Some people encounter problems in prayer rooms,Abaririmbyi b'itorero Indangamuco bizihiwe Abakobwa b'itorero Indangamuco babyina Abasore bagize itorero Indangamucoi bahamiriza mu Buyapani,Indangamucoi church singers celebrate Indangamucoi church girls dance Indangamucoi church boys celebrate in Japan
kin_train_00033,Mfite imishinga myinshi hano ndi no gukora kuri album yanjye nshya ishobora kuzasohoka umwaka utaha.,I have many projects here and I am also working on my new album which will be released next year.,"Meddy: Ni byinshi mfite imishinga myinshi ndi gukoraho ngira ngo mu bintu byanzanye hano nabyo birimo, ngo mfatanye n’abandi bahanzi kuzamura umuziki.",Meddy: I have a lot of projects that I want to work on. I think one of the things that brought me here is to collaborate with other artists to promote music.
kin_train_00034,"Yagize ati “Muzi ko Afreximbank nk’uko perezida wayo yabivuze ubwo inama yatangiraga, ishaka guha u Rwanda miliyoni 500 z’amadolari.","He said: “You know that Afreximbank, as its president said when the meeting started, wants to give Rwanda 500 million dollars.","Ubwo hizihizwaga imyaka 40 y’umubano w’ibihugu byombi, u Bushinwa bwari bumaze guha u Rwanda miliyoni 170 z’amadolari.","When the 40th anniversary of bilateral relations was celebrated, China had already given Rwanda 170 million dollars."
kin_train_00035,Bigirinka yatangiriye urugendo rwe iwabo ku ivuko mu Murenge wa Mukamira ho mu Karere ka Nyabihu mu Ntara y’Iburengerazuba.,Bigirinka started his journey from his hometown in Mukamira Sector in Nyabihu District in Western Province.,Bigirinka yakomereje urugendo rwe mu yindi mirenge igize Akarere ka Nyabihu aho yamaze iminsi ine mbere yo kwerekeza mu Karere ka Rusizi.,Bigirinka continued his journey to other sectors that make up Nyabihu District where he spent four days before heading to Rusizi District.
kin_train_00036,Umwanya wo kuramya no guhimbaza Imana uzayoborwa n’amatsinda abizobereye arimo Ntora Worship Team iyoborwa n’umuramyi Tuyizere Papi Clever n’irya Nyarugenge.,The place to worship and praise God will be led by specialized groups including Ntora Worship Team led by worshiper Tuyizere Papi Clever and Nyarugenge.,16:40: Healing Worship Team yageze ku rubyiniro itangira kuririmba Itsinda rimaze kwamamara mu muzika wo guhimbaza no kuramya Imana rya Healing Worship Team ryahamagawe.,16:40: The Healing Worship Team arrived on the dance floor and began to sing.
kin_train_00037,"Gutanga amakuru Ubuyobozi bw'Akarere ka Burera bukomeza gushishikariza abaturage kurwanya ibiyobyabwenge, batanga amakuru y'aho byaba biri cyangwa se y'ababicuruza.","Providing information The Burera District Administration continues to encourage the people to fight against drugs, providing information on the whereabouts of drug dealers.",N'ubwo ubuyobozi bw'Akarere ka Burera bukomeza gusaba abaturage kurwanya ibiyobyabwenge bigaragara ko bidacika burundu.,"Even though the administration of Burera District continues to ask the people to fight against drugs, it seems that it will not be completely eradicated."
kin_train_00038,Iri tangazo ryashyizweho umukono na Stella Ford MUGABO Ministiri Ushinzwe Imirimo y'Inama y'Abaminisitiri,This announcement was signed by Stella Ford MUGABO Minister for Cabinet Affairs,FOTO/Faustin Nkurunziza NB: Mu nkuru zacu zitaha turabagezaho uko abandi bahanzi nabo bitwaye VIDEO: Eliel Sando,PHOTO/Faustin Nkurunziza NB: In our next stories we will tell you how other artists are doing VIDEO: Eliel Sando
kin_train_00039,"Buri inzu ifite agaciro ka miliyoni 18 n’ibihumbi magana atandatu, ikaba igizwe n’ibyumba bitatu.","Each house is worth 18 million six hundred thousand, and consists of three rooms.","Izo modoka zashyikirijwe Minisitiri ushinzwe ibiza no gucyura impunzi, Madame Seraphine Mukantabana; buri imwe ikaba ifite agaciro k’amafaranga miliyoni 35,","The vehicles were presented to the Minister in charge of disasters and refugee resettlement, Madame Seraphine Mukantabana; each worth 35 million rupees,"
kin_train_00040,"Munyemana yavuze ko imikino yakinwe nyuma gato ya Jenoside yagize uruhare mu kongera guhuza Abanyarwanda, abari hanze y’igihugu baratahuka.","Munyemana said that the games played shortly after the Genocide played a role in reuniting Rwandans, those outside the country were fleeing.","Mu butumwa bwe, Minisitiri Uwizeye yavuze ko nyuma ya Jenoside u Rwanda rwari rukeneye abafatanyabikorwa bo kongera guhuza imbaraga narwo mu kongera kubaka ibyari byarangiritse.","In his message, Minister Uwizeye said that after the Genocide, Rwanda needed partners to join forces with it in rebuilding what had been destroyed."
kin_train_00041,"Yagize ati ""Ndagushimiye Donald Trump ku ntsinzi wabonye kandi neza.Twizeye gukomeza umubano mwiza na Leta Zunze Ubumwe za Amerika ndetse n'ubuyobozi bushya.""","He said, ""I congratulate Donald Trump on his success and success. We look forward to maintaining good relations with the United States of America and the new administration.""","Coronavirus nta muti n’urukingo irabonerwa, ariko abaganga bo mu Bushinwa barakataje bashaka umuti ndetse n’abo muri Leta Zunze Ubumwe za Amerika batangiye kugerageza urukingo rwayo.","There is no cure or vaccine for the coronavirus, but doctors in China are desperate for a cure and those in the United States have begun testing its vaccine."
kin_train_00042,"Iki gikorwa cyo kwibuka ku nshuro ya 19 Jenoside yakorewe abatutsi, cyateguwe n'umuryango Never Again, ugizwe n'abarokotse Jenoside yakorewe abatutsi mu Rwanda ufatanyije n'inshuti zawo.","This commemoration of the 19th Genocide against the Tutsi was organized by the Never Again organization, which consists of survivors of the Genocide against the Tutsi in Rwanda together with their friends.",Mubikorwa biteganyijwe gukorwa n'iri huriro harimo kwifatanya n'Abanyarwanda n'amahanga kwibuka ku nshuro ya 22 Jenoside yakorewe Abatutsi mu,Among the activities planned to be carried out by this forum is to join Rwandans and foreigners in commemorating the 22nd Genocide against the Tutsis.
kin_train_00043,Ni indirimbo yashyize hanze kuri uyu wa Kabiri tariki 22 Kanama,"It's a song he released on Tuesday, August 22",Kuri uyu wa Kabiri tariki 29 Mutarama 2019 nibwo Mbonyi yashyize hanze indirimbo ya mbere izaba iri kuri iyo album.,"On this Tuesday, January 29, 2019, Mbonyi released the first song that will be on the album."
kin_train_00044,“Tukaba dufitemo iteka rya Minisitiri rigena imikorere n’imikoranire y’inzego z’imitunganyirize ya siporo n’imikino n’uburyo bwo gutanga ishimwe n’ingororano ku bakinnyi.,"""We have the Minister's decree that determines the functioning and interaction of sports and games organizations and the way to give praise and compensation to athletes.",Shema akomeza ati “Iteka rya kabiri ni irya Minisitiri rigena imitunganyirize y’ibyiciro bya siporo n’imikino n’imikorere n’imitunganyirize y’irerero ryigisha siporo n’imikino.,"Shema continued, “The second order is that of the Minister that determines the organization of sports and games classes and the operation and organization of schools that teach sports and games."
kin_train_00045,"Ni igitaramo cyatangiye ahagana ku isaha ya saa kumi n’imwe n’igice, gisozwa saa yine n’igice z’ijoro.",It was a show that started around 5:30 PM and ended at 4:30 PM.,Sinach yageze mu Rwanda ahagana ku isaha ya saa tatu n’igice z’ijoro.,Sinach arrived in Rwanda around 3:30 pm.
kin_train_00046,"Mu Bwongereza n’u Budage, izagurishijwe zifite ubushobozi bwo kwakira internet yihuta ya 5G mu gihe muri Leta Zunze Ubumwe za Amerika ho bidakunda.","In the UK and Germany, it will be sold with the ability to receive high-speed 5G internet while in the US it will not.",U Bushinwa bwabaye igihugu cya gatatu kigeze ku Kwezi nyuma ya Leta Zunze Ubumwe za Amerika n’u Burusiya.,China became the third country to reach the Moon after the United States of America and Russia.
