PairID,Text1,Text1 Translation,Text2,Text2 Translation
kin_train_00179,Bwana RUNIGA Pierre Claver: Umuyobozi w'Ishami rishinzwe ibijyanye n'Ikirango n'Ireme ry'inyandiko z'ubutabera/Division Manager/Senior State Attorney ?,Mr. RUNIGA Pierre Claver: Division Manager/Senior State Attorney?,Bwana MALAALA Aimable: Umuyobozi w'Ishami rishinzwe ibibazo ?,Mr. MALAALA Aimable: Head of the Affairs Department?
kin_train_00180,"Kuwa 14 Nyakanga 2015, Inteko rusange ya buri mutwe w'inteko Ishinga Amategeko yasuzumye ubusabe bw'abanyarwanda maze hemezwa ishingiro ryabwo.","On July 14, 2015, the General Assembly of each section of the Parliament considered the request of the Rwandans and approved its basis.",Kuwa 20 Nyakanga kugeza tariki 3 Nyakanga abagize Inteko Ishinga Amategeko imitwe yombi bagiranye ibiganiro n'abanyarwanda mu mirenge,"From July 20 to July 3, members of the Parliament of both parties held discussions with Rwandans in the sectors"
kin_train_00181,Ikipe ya AS Kigali yaraye itsinze ikipe ya APR FC 1-,AS Kigali defeated APR FC 1-,"Icyo gihe Ikipe ya APR FC yari yakiriye AS Kigali kuri Stade ya Kigali, iyihatsindira 2-","At that time, APR FC hosted AS Kigali at Kigali Stadium, winning 2-"
kin_train_00182,Ariko ngo mbere yuko ashiramo umwuka yabanje gutaka cyane bagiye kureba basanga yitabye Imana.,"But before he breathed his last, he screamed loudly. They went to see and found that he had passed away.",Nyuma yaje kwitura hasi bamujyana mu modoka ariko ashiramo umwuka mbere y’uko agezwa mu bitaro.,He later sat down and was taken to the car but died before being taken to the hospital.
kin_train_00183,"Mu 2015 yatangiye gukoreshwa muri Leta Zunze Ubumwe za Amerika ndetse kugeza mu ntangiriro za Kanama 2016, yari imaze gukoreshwa n’abasaga miliyoni imwe n’igice.","In 2015 it started to be used in the United States of America and until the beginning of August 2016, it had been used by more than one and a half million people.",Ng'uko uko bambutse inyanja ubu ababakomokaho bakaba ari abaturage b'igihugu gihatse ibindi ku isi cya Leta Zunze Ubumwe za Amerika ndetse n'umugabane wose muri rusange.,"As they crossed the ocean, their descendants are now the citizens of the most powerful country in the world, the United States of America and the entire continent in general."
kin_train_00184,Nziyonsenga avuga ko kuva mu mwaka wa 2005 kugeza ubu amaze gutanga amafaranga y'u Rwanda nka miliyoni 4 kugira ngo uru rugomero rwe rukomeze gukora.,Nziyonsenga says that from 2005 until now he has given 4 million Rwandan francs to keep his dam running.,Akomeza avuga ko iyo filimi izamutwara amafaranga y'u Rwanda miliyoni esheshatu n'ibihumbi,He goes on to say that the film will cost him six million Rwandan francs
kin_train_00185,"Nyamara mu gihe cy’igerageza rya Jenoside 1992, Interahamwe zari zagerageje gutera padiri Kageyo na bagenzi be Perezida Habyarimana akabibuza.","However, during the 1992 Genocide attempt, the Interahamwe tried to attack priest Kageyo and his friends, but President Habyarimana stopped them.","Bagaragaza avuga ko ubwo indege ya Habyarimana yari imaze guhanurwa, Zigiranyirazo yategetse Interahamwe kwica Padiri Kageyo na bagenzi be akoresheje radiyo ya gisirikare ya Maj.","Bagaragaza says that when Habyarimana's flight was predicted, Zigiranyirazo ordered the Interahamwe to kill Padiri Kageyo and his companions using the military radio of Maj."
kin_train_00186,"Muneza yatanze ubutumwa muri iki gihe cyo kwibuka Jenoside yakorewe Abatutsi, asaba abagize AERG-Indame kwirinda icyorezo cya Coronavirus bubahiriza amabwiriza ya Leta.","Muneza sent a message during the commemoration of the Genocide against the Tutsis, asking the members of AERG-Indame to avoid the Corona Virus epidemic by complying with the Government's instructions.","Ni ubutumwa yatanze ubwo yifurizaga abanyarwanda Noheli nziza, aho yabasabye no kuzirikana ko icyorezo cya COVID19 gihari, asaba kwirinda ikintu cyose cyagiha urwaho.","This is the message he gave when he wished Rwandans a happy Christmas, where he also asked them to remember that the COVID-19 epidemic exists, asking them to avoid anything that could cause it."
kin_train_00187,"Muri uru ruzinduko, biteganyijwe ko Perezida Kagame azahura na Minisitiri w’intebe wa Isiraheli Benjamin Netanyahu na Perezida w’iki gihugu Reuven Rivlin.","During this visit, it is planned that President Kagame will meet the Prime Minister of Israel Benjamin Netanyahu and the President of this country Reuven Rivlin.",Perezida Kagame asuye iki gihugu nyuma y’uruzinduko Minisitiri w’Intebe wa cyo Benjamin Netanyahu yagiriye mu Rwanda kuwa 6 Nyakanga,President Kagame is visiting this country after Prime Minister Benjamin Netanyahu's visit to Rwanda on July 6
kin_train_00188,"Umuganga w’Inzobere mu kuvura indwara zo mu Mutwe, Kanyandekwe Dr Simon, yigeze kubwira IGIHE ko izi ndwara ziterwa n’uruhererekane rw’impamvu nyinshi.","A specialist in the treatment of mental disorders, Kanyandekwe Dr Simon, once told IGIHE that these disorders are caused by a series of factors.","Dr Christian Ntizimira, umuganga w’inzobere mu kwita ku bafite indwara zidakira, yemeza ko umuryango w’ufute izo ndwara ari wo ugira uruhare runini mu kumwitaho.","Dr Christian Ntizimira, a doctor specializing in the care of those with chronic diseases, confirms that the family of those suffering from these diseases plays a major role in his care."
kin_train_00189,"Bourne yavuze ko kugira ngo umubare w’abatabona ugabanuke, hagomba kongerwa imbaraga mu buvuzi haba ku rwego rw’igihugu, mu karere no ku Isi muri rusange.","Bourne said that in order to reduce the number of blind people, there should be an increase in medical efforts at the national, regional and global levels.","Ati ""Tugiye kongera imbaraga mu kuzamura umubare w'abakiriya haba mu Rwanda no mu karere kugira ngo Banki yacu ikomeze itere imbere kandi ndabona tuzabigeraho.""","He said, ""We are going to increase our efforts to increase the number of customers both in Rwanda and in the region so that our Bank continues to grow and I think we will succeed."""
kin_train_00190,APR FC ya kabiri n’amanota 62 ntabwo yashyikira Rayon Sports mu mikino ibiri isigaje.,Second-placed APR FC with 62 points could not reach Rayon Sports in the remaining two games.,Gutsinda uyu mukino bivuze ko Rayon Sports igize amanota 64 irusha APR FC ya kabiri,A win in this match means that Rayon Sports is 64 points ahead of second placed APR FC
kin_train_00191,"Izindi nkuru wasoma: Batanze ubuhamya ko basambanyijwe n'abapasiteri mu byumba by'amasengesho Kigali: Amateraniro yahindutse imirwano, Pasiteri ashinjwa gusambanya abayoboke","Other stories to read: They testified that they were molested by pastors in prayer rooms Kigali: Meetings turned into fights, Pastor accused of molesting members",Apotre Nkurunziza Francois uyobora itorero Bethel mu Rwanda,Apostre Nkurunziza Francois who leads the Bethel church in Rwanda
kin_train_00192,"Igihe cyose wumvise impumuro idasanzwe mu myanya y’ibanga yawe, ni ngombwa kugana k’umuganga w’indwara zifata mu myanya ndagagitsina (gynecologist).","Whenever you feel a strange smell in your private parts, it is important to see a gynecologist.","Gishobora kandi kuza cyoroshye, igihe cyose wumvise mu ibere ryawe harimo ikintu kidasanzwe ni ngombwa kugana kwa muganga ukisuzumisha.","It can also come easily, whenever you feel something unusual in your breast it is important to go to the doctor and get it checked out."
kin_train_00193,"U Rwanda rwaje kuri uwo mwanya mu bihugu 38 byakoreweho ubushakashatsi n'ikigo cy'inzobere z'Abongereza mu iterambere, Legatum Institute.","Rwanda came to that position among the 38 countries surveyed by the British development experts, the Legatum Institute.","Ubushakashatsi bwakozwe n'ikinyamakuru gikorera ku murongo wa Internet cyitwa answers africa.com,cyashyize u Rwanda ku mwanya wa 3 mu bihugu by'africa mu kunywa ibinyobwa bisembuye.","A survey conducted by an online magazine called answers africa.com, placed Rwanda at the 3rd place in African countries for drinking alcoholic beverages."
kin_train_00194,Estella Damm yenzwe bwa mbere na August Kuentzmann Damm mu mwaka wa,Estella Damm was first photographed by August Kuentzmann Damm in the year,Estella Damm yagumanye umwihariko August Kuentzmann Damm yayenganaga ubwo yari atangiye kuyikora mu mwaka wavuze haruguru.,Estella Damm retained the distinctiveness of August Kuentzmann Damm when he first started acting in the aforementioned year.
kin_train_00195,"Ni rimwe mu mazina akunzwe cyane dore ko ryaje ku mwanya wa 3, 243 mu mazina akunzwe kurusha ayandi mu","It is one of the most popular names as it came in at number 3, 243 of the most popular names in the world.","Iri zina rishobora gukoreshwa nk’izina ry’umuryango cyangwa ayo benshi bita aya Gikirisitu, riza ku mwanya wa 69 mu mazina akunzwe cyane mu","This name can be used as a family name or as a Christian name, it is the 69th most popular name in"
kin_train_00196,"Iyi promosiyo yatangijwe kuri uyu wa 30 Mutarama izarangira kuwa 31 Werurwe 2017, ibihembo nyamukuru ni imodoka y'amafaranga miliyoni 36 n'inzu ya miliyoni 30 Frw.","This promotion started on January 30 and will end on March 31, 2017, the main prizes are a car worth 36 million Frw and a house worth 30 million Frw.",Ibikomeye ni imodoka nshya ya Mitsubishi (nshya yakozwe mu 2016) ya miliyoni 36 frw n'inzu ya miliyoni 30 z'amafaranga y'u Rwanda.,The big ones are a new Mitsubishi car (new made in 2016) for 36 million frw and a house for 30 million frw.
kin_train_00197,Uganda ihera he ihakana ko idakorana n’abashaka guhungabanya umutekano w’u Rwanda?,Where does Uganda deny that it does not cooperate with those who want to disturb the security of Rwanda?,Igihamya gikomeye ko Uganda ikorana n’abashaka guhungabanya umutekano w’u Rwanda cyagaragajwe na Raporo y’impuguke za Loni yasohotse mu Ukuboza umwaka ushize.,A strong proof that Uganda is working with those who want to disrupt Rwanda's security was revealed by the report of UN experts published in December last year.
kin_train_00198,"Uko bikora, ni ugufata ibibabi by’amapera, umuntu akabisekura nyuma akabivanga n’amazi makeya, akabirambika ku gisebe nibura umunota umwe.","The way it works is to take pear leaves, wash them and then mix them with a little water, and lay them on the sore for at least one minute.","Uko bikorwa ngo ni ugufata ibibabi by’amapera, umuntu akabitekana n’amazi bikabira, nyuma akareka bigahora bikaba akazuyazi, akayameshesha mu mutwe asa n’unanura uruhu rumeraho umusatsi.","This is done by taking pear leaves, boiling them with water, then letting them stay warm, and then rubbing them on the head as if drying the skin that covers the hair."
kin_train_00199,"Ubwo Musenyeri Ntihinyurwa yizihizaga Yubile y’imyaka 75, hari 109 babaye abapadiri ba diyosezi i Kigali abaramburiyeho ibiganza.","When Bishop Ntihinyuwa celebrated his 75th anniversary, there were 109 priests of the diocese in Kigali who spread their hands.",Musenyeri Ntihinyurwa ayobora Diyosezi ya Cyangugu hari Paruwasi zashinzwe na 12 zashinzwe ayobora i Kigali.,"Bishop Ntihinyurwa leads the Diocese of Cyangugu, there are 12 parishes established and he leads in Kigali."
kin_train_00200,"Minisitiri w’Ubuzima, Dr Ngamije Daniel yavuze ko ntawe ukwiriye guha icyuho icyorezo, kuko ingaruka zacyo zigera kuri benshi barimo n’abatabigizemo uruhare.","The Minister of Health, Dr Ngamije Daniel said that no one should ignore the epidemic, because its effects reach many including those who are not involved.","Minisitiri w’Ubuzima, Dr Ngamije Daniel yavuze ko ntawe ukwiriye guha icyuho icyorezo","The Minister of Health, Dr Ngamije Daniel said that no one should give up on the epidemic"
kin_train_00201,16:40: Healing Worship Team yageze ku rubyiniro itangira kuririmba Itsinda rimaze kwamamara mu muzika wo guhimbaza no kuramya Imana rya Healing Worship Team ryahamagawe.,16:40: The Healing Worship Team arrived on the dance floor and began to sing.,Itsinda ryo kuramya no guhimbaza Imana rya Shekinah ryo muri Evangelical Restoration Church niryo ryageze ku rubyiniro mbere.,The Shekinah Worship and Praise Team from the Evangelical Restoration Church was the first to arrive at the dance.
kin_train_00202,Twabibutsa ko iyo miti nta zindi ngaruka igira ku muntu wayikoresheje kuko ikoze mu bimera ikaba ari myimerere.,It should be noted that these medicines have no other side effects on the person who used them because they are made from plants and are natural.,"Muri yo twavugamo nka Ginseng Rh Capsules,A-Power Capsules,Propolis plus Capsules,Soy power capsule,… Twabibutsa ko iyi miti nta ngaruka igira ku muntu wayikoresheje.","Among them we can talk about Ginseng Rh Capsules, A-Power Capsules, Propolis plus Capsules, Soy power capsule,... It should be noted that these drugs have no effect on the person who used them."
kin_train_00203,ACP Twahirwa yavuze ko Mukankomeje ibyo akurikiranyweho bifitanye isano n'ibyaha bishinjwa abahoze ari abayobozi b'Akarere ka Rutsiro barimo Umuyobozi w'Akarere ndetse n'Umunyamabanga Nshingwabikorwa.,"ACP Twahirwa said that Mukankomebe's prosecution is related to the crimes against the former leaders of Rutsiro District, including the District Mayor and the Executive Secretary.",Ni ibyaha bifitanye isano n'ibiregwa abari abayobozi b'Akarere ka Rutsiro byo kunyereza umutungo wa leta n'ibya ruswa.,These are crimes related to the charges against the leaders of Rutsiro District for misappropriation of state resources and corruption.
kin_train_00204,"Muganga Victorien Ndacyayisenga yagize ati “birashimisha cyane kubyara kuri Noheli, ababyeyi benshi baterwa ishema no kwibaruka muri ibi bihe by’iminsi mikuru”.","Doctor Victorien Ndacyayysenga said ""it is very exciting to give birth on Christmas, many parents are proud to give birth during this festive period"".","Yagize ati “birabashimisha, ababyeyi benshi babifata nk’umugisha kubyara kuri Noheli, bakumva ari igikorwa cy’indashyikirwa bagezeho”.","He said ""it makes them happy, many parents consider it a blessing to give birth on Christmas, they feel it is a great work they have achieved""."
kin_train_00205,Tihabyona Jean de Dieu Umuyobozi w'akarere wungirije ushinzwe Ubukungu avuga ko ikigo by'imari Urunana cyatangiye kigaragaza ibikorwa bizamura abaturage nyuma kigira imicungire mibi y'umutungo.,"Tihabyona Jean de Dieu, Deputy Mayor in charge of Economy, says that the Urunana financial institution started with activities that would improve the people and then started to mismanage the resources.","Umuyobozi w'akarere wungirije ushinzwe ubukungu, Imari n'iterambere arashishikariza n'abandi bashoramari kwitabira kugura ibibanza byo kubakamo ibikorwa by'iterambere ku nkombe z'ikiyaga cya Kivu kuko bikiri kuboneka.","The Deputy Regional Mayor in charge of Economy, Finance and Development is encouraging other investors to participate in the purchase of development sites on the shores of Lake Kivu because they are still available."
kin_train_00206,Ibyo Sarpong yemeye Ubuyobozi bwa Rayon Sports bwemeje ko Sarpong yagaruye ibikoresho by’ikipe nk’uko yari yabisabwe.,Sarpong's acceptance Rayon Sports management has confirmed that Sarpong has returned the team's equipment as requested.,Ubuyobozi bwa Rayon Sports bwemeje kandi ko Sarpong yemeye ko atazabaza umushahara w’ukwezi kwa Mata 2020 nk’uko n’abandi bakinanaga babyemeye.,The management of Rayon Sports also confirmed that Sarpong has agreed that he will not ask for his salary for the month of April 2020 as other players have agreed.
kin_train_00207,"Wakomotse ku munyabugesera witwaga Muganza wiyahuye muri Cyohoha, i Bugesera (ubu ni mu Karere ka Bugesera) ahayinga umwaka w’i","He was descended from a Bugesera man named Muganza who committed suicide in Cyohoha, Bugesera (now in Bugesera District) in the year of",Wadukanywe na Gasharankwanzi ka Bureshyo mu Gishubi cya Muganza i Rukoma (Gitarama) ahayinga umwaka w’i,He was killed by Gasharankwanzi of Bureshyo in the village of Muganza in Rukoma (Gitarama) in the year of
kin_train_00208,Guverineri Munyantwari yifatanya n'abaturage ba Cyahinda mu kwibuka ku nshuro ya 22 Jenoside yakorewe Abatutsi.,Governor Munyantwari joins the people of Cyahinda in commemorating the 22nd Genocide against the Tutsis.,Abakozi b'ibigo by'ubucuruzi bine bari bitabiriye uyu muhango wo kwibuka ku nshuro ya 22 Jenoside yakorewe Abatutsi mu Rwanda mu,The employees of four commercial companies participated in the 22nd commemoration of the Genocide against the Tutsis in Rwanda in
kin_train_00209,"Miss Umwiza wakozwe ku mutima n’aba bana, yashimiye ababyeyi bashinze iki kigo ahita yiyemeza kugikorera ubuvugizi.","Miss Umwiza was touched by these children, thanked the parents who founded this center and immediately decided to advocate for it.","Mu kiganiro yagiranye na IGIHE, Miss Umwiza yagize ati ”Ni ukuri nakozwe ku mutima n’aba bana, birababaje nitwe bo kubitaho.”","In an interview with IGIHE, Miss Umwiza said, ""It's true that I was touched by these children, it's sad that we are the ones who take care of them."""
kin_train_00210,"Iyi gahunda yagiye ikorwa muri diyoseze zose zigize u Rwanda, akenshi by'umwihariko biciye muri Komisiyo y'ubutabera n'amahoro, rumwe mu nzego za Kiliziya Gatolika.","This program has been carried out in all the dioceses that make up Rwanda, often especially through the Justice and Peace Commission, one of the Catholic Church's institutions.","Iyi gahunda kandi yagiye ikomereza mu rwego rwa komisiyo y'ubutabera n'amahoro, muri paruwasi zose zo mu Rwanda.","This program has been continuing in the framework of the justice and peace commission, in all parishes in Rwanda."
kin_train_00211,"Dr Byiringiro ati “Imibare muri raporo y’Ishami ry’Umuryango w’Abibumbye ryita ku buzima (OMS) yerekana ko mu mwaka wa 2019-2020 abarwaye igituntu mu Rwanda bari 5,678”.","Dr. Byiringiro said, ""The figures in the report of the United Nations Health Organization (WHO) show that in the year 2019-2020 there were 5,678 people with tuberculosis in Rwanda"".",Ishami ry’Umuryango w’Abibumbye ryita ku Buzima (OMS) rigaragaza ko mu 2018 kanseri zishe abarenga miliyoni 6 muri miliyoni 1 z’abari bazirwaye.,"The World Health Organization (WHO) shows that in 2018, cancer killed more than 6 million of the 1 million people who will get sick."
kin_train_00212,"Karake yasabye abayobozi n'abakozi b'imirenge SACCO gutanga serivisi nziza ku babagana, kuko kwakira neza abakiriya ariryo banga ryo guteza imbere ibikorwa by'ubucuruzi ndetse n'ibindi byose.","Karake urged the leaders and staff of the SACCO sector to provide better service to the people, as customer service is the secret to business development and everything else.","Umutegarugori ucuruza ibiribwa muri iryo soko kuri we ngo yumva kwakira neza abakiriya bivuga kubabwira neza, ndetse no kubaha serivisi batagusabye.","A woman who sells food in the market says that she feels that welcoming customers means being kind to them, as well as giving them services they don't ask for."
kin_train_00213,Abantu benshi ngo bakunze kwinjira mu gikorwa cyo gukora imibonano mpuzabitsina ariko akenshi ngo ugasanga batishimiye uko bateye.,Many people often enter the act of having sex but often find that they are not happy with it.,"Abantu benshi bakora imibonano mpuzabitsina bagamije kugera ku munezero, ariko hari izindi nyungu nyinshi bigira ku mubiri n’ubuzima z’umwihariko.","Most people engage in sex for pleasure, but there are many other special physical and health benefits."
kin_train_00214,"Imibare y’Urwego Ngenzuramikorere, RURA, igaragaza ko kugeza mu Ukuboza 2018, abanyarwanda bangana na 1% ari bo bakoreshaga internet bavuye kuri 9% babarwaga mu","Statistics from the Regulatory Authority, RURA, show that as of December 2018, 1% of Rwandans were using the internet, up from 9%","Imibare ya RURA igaragaza ko kugeza mu Ugushyingo 2018, abaturarwanda bakoresha telefoni ngendanwa bari 63%, bangana na 9,640,","RURA figures show that as of November 2018, 63% of Rwandans use mobile phones, amounting to 9,640."
kin_train_00215,"Icyo gihe Radio Rwanda yatangaje ko Koreya ya Ruguru yemeye gufasha u Rwanda mu bijyanye n’amahugurwa y’urubyiruko, kubaka inzu mberabyombi y’urubyiruko n’ibindi.","At that time, Radio Rwanda announced that North Korea has agreed to help Rwanda in terms of youth training, building a youth center, etc.","Uwo mwaka kandi Koreya yemeye gufasha u Rwanda mu mishinga irimo uwo kubaka ikigo cy’amashuri cyakira abanyeshuri 400, kubaka ibitaro n’uruganda rw’ibireti.","That same year, Korea agreed to help Rwanda in projects including the construction of an educational center for 400 students, the construction of a hospital and a tire factory."
kin_train_00216,"Abanyarwanda batahuka mu Gihugu bemerewe gutaha, ariko bagahita bashyirwa mu kato (isolation) k’iminsi 14 ahantu habugenewe. g.","Rwandans who do not leave the country are allowed to go home, but they are immediately put in isolation for 14 days in a designated place. g.","Abanyarwanda n’abandi bantu basanzwe batuye mu Rwanda bemerewe gutaha, ariko bagahita bashyirwa mu kato nk’uko amabwiriza y’inzego z’ubuzima abiteganya.","Rwandans and other people who normally live in Rwanda are allowed to return home, but they are immediately placed in quarantine according to the instructions of the health authorities."
kin_train_00217,"Umuvugizi wungirije, Musanabaganwa Eugenie ubarizwa mu Ishyaka rya PSP wasimbuye Depite Mukama Abbas.","The Deputy Speaker, Ms. Eugenie, who is from the PSP Party, replaced Deputy Mukama Abbas.",Depite Munyangeyo ubarizwa mu ishyaka riharanira Ukwishyira ukizana kwa buri muntu(PL) yamamajwe kuri uyu mwanya wenyine atorwa ku majwi 100% Musanabaganwa Eugenie wabaye umuvugizi wungirije,"MP Munyangeyo, who belongs to the People's Liberation Party (PL), was announced for this position alone and was elected with 100% of the votes."
kin_train_00218,"Semujanaga ati ""Igitabo cyanditswe n'abantu benshi, twahuje abantu bababajwe n'abapfobya n'abahakana Jenoside yakorewe Abatutsi.","Semujanaga said, ""The book was written by many people, we brought together people who suffered and those who underestimated and denied the Genocide against the Tutsis.","Semujanga atangaza ko abantu bakwiye kubaka igihugu gishingiye ku mahame yubaka, umuntu agahabwa agaciro mu gihugu, harwanywa abapfobya n'abahakana Jenoside yakorewe Abatutsi.","Semujanga declares that people should build a country based on constructive principles, people should be valued in the country, and fight against those who underestimate and deny the Genocide committed against the Tutsis."
kin_train_00219,"Umuyobozi w'Akarere ka Ruhango wungirije ushinzwe imibereho myiza y'abaturage Kambayire Annonciata, yamaganiye kure ibyakozwe n'ibi bitaro bya Kinazi avuga ko bagomba kumurekura akishyura ari hanze.",Ruhango District Mayor Deputy Social Welfare Officer Kambayire Annonciata has strongly condemned what was done by these Nazi hospitals saying that they should release him if he pays while he is outside.,Tihabyona Jean de Dieu Umuyobozi w'akarere wungirije ushinzwe Ubukungu avuga ko ikigo by'imari Urunana cyatangiye kigaragaza ibikorwa bizamura abaturage nyuma kigira imicungire mibi y'umutungo.,"Tihabyona Jean de Dieu, Deputy Mayor in charge of Economy, says that the Urunana financial institution started with activities that would improve the people and then started to mismanage the resources."
kin_train_00220,APR FC yari ihanganye na Rayon Sports yo yatakaje amanota abiri i Nyakinama aho yanganyije na Musanze FC ubusa ku busa.,APR FC was facing Rayon Sports who lost two points in Nyakinama where they drew with Musanze FC in a goalless draw.,Muhadjili Hakizimana wagoye ububwugarizi bwa Rayon Sports cyane Michel Rusheshango wagiye mu kibuga asimbuye niwe wafashije APR FC kubona amanota,Muhadjili Hakizimana made it difficult for Rayon Sports management. Michel Rusheshango went to the field to replace him and he helped APR FC get points.
kin_train_00221,Iki giterane kizajya gitangira saa kumi z’umugoroba gisozwe saa moya n’igice z’ijoro (16h00 Pm -19:30 Pm.),This meeting will start at 10:00 PM and end at 7:30 PM (4:00 PM - 7:30 PM).,Iki gikorwa kizajya gitangira saa mbiri n’igice gisozwe saa kumi n’imwe mu minsi itatu.,This event will start at 2:30 pm and end at 5 pm for three days.
kin_train_00222,Ingendo hagati y’intara zitandukanye cyangwa intara n’Umujyi wa Kigali ziremewe ariko kujya no kuva mu Turere twa Rusizi na Rubavu birabujijwe.,Travel between different provinces or provinces and the City of Kigali is allowed but travel to and from Rusizi and Rubavu Districts is prohibited.,Ingendo mu modoka rusange mu turere twa Rubavu na Rusizi zirabujijwe.,Travel by public transport in Rubavu and Rusizi areas is prohibited.
kin_train_00223,"BNR nayo ikora igenzura ry’ubwo busabe yasanga bufite ishingiro, ikagarura amafaranga kuri konti y’umukiriya muri Banki y’ubucuruzi iba yanditse isaba ko amafaranga agarurwa.","BNR also checks the request and finds that it is justified, and returns the money to the customer's account in the Commercial Bank if he has written a request for the money to be returned.","Murabizi Minisiteri iba ifite amafaranga mu mpapuro, twe tubyigaho tukabyohereza muri Minecofin, nayo ikabyohereza muri BNR noneho amafaranga akajya kuri konti zabo.","You know, when the Ministry has money in paper, we study it and send it to Minecofin, which in turn sends it to BNR and then the money goes to their accounts."
